Title,Description,Destination URL,Board,Alt Text,Image Path,Image URL,ASIN,Price,Exact Product URL,Affiliate Link,Manual Link,SiteStripe URL,AI Score,Conversion Score,Buyer Intent,Quality Grade,Recommendation,AI Action,Risk Flags,HF Category,HF Image Label,Duplicate Cluster,Best Posting Window,Status,Failure Reason,Created At
Best Backpack Travel Laptop Under Rs 1200 India,"Safari 45L Expandable Overnighter Casual Hiking Travel Backpack Large si is a strong backpack travel laptop pick at around Rs. 1,199. Check the exact product page for latest specs, reviews and offers. #backpacktravellaptop #amazonindia #budgetgadgets #techindia #amazondeals",https://www.amazon.in/dp/B097GNF52Q,Travel And Everyday Essentials,"Safari 45L Expandable Overnighter Casual Hiking Travel Backpack Large size Laptop Bag for Man and Women with suitcase compartment, Ideal for Office Use, Work Trips, School, College, boys and girls available on Amazon",/home/runner/work/PinAffiliate_V3/PinAffiliate_V3/output/images/B097GNF52Q_light_blue_20260626_114904.jpg,https://m.media-amazon.com/images/I/71JHyqChjeL._AC_UY218_.jpg,B097GNF52Q,1199.0,https://www.amazon.in/dp/B097GNF52Q,,https://www.amazon.in/dp/B097GNF52Q,https://www.amazon.in/dp/B097GNF52Q,77.34,75.47,medium,B,post,post,manual-link,heuristic,heuristic,35815b2ef938,22:00-23:00,manual_fallback,Pinterest access token missing,2026-06-26T11:49:04.787729
Best Trimmer For Men Best Seller Under Rs 900 India,"Philips Battery Powered SkinProtect Beard Trimmer for Men is a strong trimmer for men best seller pick at around Rs. 895. Check the exact product page for latest specs, reviews and offers. #trimmerformenbestseller #amazonindia #budgetgadgets #techindia #amazondeals",https://www.amazon.in/dp/B0BXNVPRGS,Wellness Beauty And Fitness Finds,"Philips Battery Powered SkinProtect Beard Trimmer for Men - Lasts 4x Longer, DuraPower Technology, Cordless Rechargeable with USB Charging, Charging Indicator, Travel Lock, No Oil Needed BT1232/18 available on Amazon",/home/runner/work/PinAffiliate_V3/PinAffiliate_V3/output/images/B0BXNVPRGS_cream_green_20260626_114904.jpg,https://m.media-amazon.com/images/I/71SrQ37ld0L._AC_UL320_.jpg,B0BXNVPRGS,895.0,https://www.amazon.in/dp/B0BXNVPRGS,,https://www.amazon.in/dp/B0BXNVPRGS,https://www.amazon.in/dp/B0BXNVPRGS,72.27,74.97,high,B,post,post,manual-link,heuristic,heuristic,4c853894ec3e,07:30-09:00,manual_fallback,Pinterest access token missing,2026-06-26T11:49:04.787748
Best Trimmer For Men Best Seller Under Rs 1500 India,"Philips India's No.1 Men's Trimmer* is a strong trimmer for men best seller pick at around Rs. 1,499. Check the exact product page for latest specs, reviews and offers. #trimmerformenbestseller #amazonindia #budgetgadgets #techindia #amazondeals",https://www.amazon.in/dp/B0G6DVB6DG,Wellness Beauty And Fitness Finds,"Philips India's No.1 Men's Trimmer* | One stroke beard trimming | All-in-One Grooming Kit- Face, Hair, Body | Ear/Nose attachment | Safe for Sensitive Skin | 60 mins runtime | 5yr warranty* | MG3927 available on Amazon",/home/runner/work/PinAffiliate_V3/PinAffiliate_V3/output/images/B0G6DVB6DG_dark_red_20260626_114904.jpg,https://m.media-amazon.com/images/I/61FfgEFs1iL._AC_UL320_.jpg,B0G6DVB6DG,1499.0,https://www.amazon.in/dp/B0G6DVB6DG,,https://www.amazon.in/dp/B0G6DVB6DG,https://www.amazon.in/dp/B0G6DVB6DG,72.05,73.07,medium,B,post,post,manual-link,heuristic,heuristic,8510849c6bfd,07:30-09:00,manual_fallback,Pinterest access token missing,2026-06-26T11:49:04.787760
Best Vacuum Cleaner Home Budget Under Rs 6700 India,"AGARO Ace Wet & Dry Vacuum Cleaner for Home, 1600 Watts, 21.5 kPa Suctio is a strong vacuum cleaner home budget pick at around Rs. 6,699. Check the exact product page for latest specs, reviews and offers. #vacuumcleanerhomebudget #amazonindia #budgetgadgets #techindia #amazondeals",https://www.amazon.in/dp/B07RCGTZ4M,Trending Home Finds,"AGARO Ace Wet & Dry Vacuum Cleaner for Home, 1600 Watts, 21.5 kPa Suction Power, 21 litres Tank Capacity, for Home Use, Blower Function, Washable 3L Dust Bag, Stainless Steel Body (Black, Red, Steel) available on Amazon",/home/runner/work/PinAffiliate_V3/PinAffiliate_V3/output/images/B07RCGTZ4M_cream_green_20260626_114904.jpg,https://m.media-amazon.com/images/I/61B8-nfHqlL._AC_UY218_.jpg,B07RCGTZ4M,6699.0,https://www.amazon.in/dp/B07RCGTZ4M,,https://www.amazon.in/dp/B07RCGTZ4M,https://www.amazon.in/dp/B07RCGTZ4M,70.84,69.36,medium,B,post,post,manual-link,heuristic,heuristic,3fbac7172fc4,12:00-13:30,manual_fallback,Pinterest access token missing,2026-06-26T11:49:04.787772
Best Home Organization Products Under Rs 300 India,"ShineXPro Microfiber Cleaning Cloth Roll, 20Pcs, 4000 Times Washable is a strong home organization products pick at around Rs. 299. Check the exact product page for latest specs, reviews and offers. #homeorganizationproducts #amazonindia #budgetgadgets #techindia #amazondeals",https://www.amazon.in/dp/B0FS1VB862,Trending Home Finds,"ShineXPro Microfiber Cleaning Cloth Roll, 20Pcs, 4000 Times Washable - 10X Cheaper Than Paper Kitchen Towel Roll - Ultra Absorbent Lint Free Microfiber Cleaning Cloth for Kitchen - Tearable, Reusable available on Amazon",/home/runner/work/PinAffiliate_V3/PinAffiliate_V3/output/images/B0FS1VB862_light_blue_20260626_114904.jpg,https://m.media-amazon.com/images/I/81zwlei7RyL._AC_UL320_.jpg,B0FS1VB862,299.0,https://www.amazon.in/dp/B0FS1VB862,,https://www.amazon.in/dp/B0FS1VB862,https://www.amazon.in/dp/B0FS1VB862,70.24,66.45,low,B,post,post,manual-link,heuristic,heuristic,726abd925022,12:00-13:30,manual_fallback,Pinterest access token missing,2026-06-26T11:49:04.787784
Best Vacuum Cleaner Home Budget Under Rs 4300 India,"SEZNIK Vacuum Cleaner for House is a strong vacuum cleaner home budget pick at around Rs. 4,299. Check the exact product page for latest specs, reviews and offers. #vacuumcleanerhomebudget #amazonindia #budgetgadgets #techindia #amazondeals",https://www.amazon.in/dp/B0D8G9J1P5,Trending Home Finds,"SEZNIK Vacuum Cleaner for House | Floor Mopping & Wet Spills + Dry Vacuuming | Turbo Sweep 3-in-1 Handheld Vacuum Cleaner | Vacuum & Mop | Corded, 600W, 20kpa Suction | 200ml Water Tank (SZ-V07) available on Amazon",/home/runner/work/PinAffiliate_V3/PinAffiliate_V3/output/images/B0D8G9J1P5_navy_gold_20260626_114904.jpg,https://m.media-amazon.com/images/I/819Jw6LziOL._AC_UY218_.jpg,B0D8G9J1P5,4299.0,https://www.amazon.in/dp/B0D8G9J1P5,,https://www.amazon.in/dp/B0D8G9J1P5,https://www.amazon.in/dp/B0D8G9J1P5,67.45,67.26,medium,B,post,post,manual-link,heuristic,heuristic,71865723f34a,12:00-13:30,manual_fallback,Pinterest access token missing,2026-06-26T11:49:04.787796
Best Backpack Travel Laptop Under Rs 900 India,"FUR JADEN 40L Weekender Travel Laptop Backpack with Anti Theft Pocket, O is a strong backpack travel laptop pick at around Rs. 830. Check the exact product page for latest specs, reviews and offers. #backpacktravellaptop #amazonindia #budgetgadgets #techindia #amazondeals",https://www.amazon.in/dp/B0B34WJK3X,Travel And Everyday Essentials,"FUR JADEN 40L Weekender Travel Laptop Backpack with Anti Theft Pocket, Organizer, 15.6 Inch Padded Laptop Sleeve and Dual Handles available on Amazon",/home/runner/work/PinAffiliate_V3/PinAffiliate_V3/output/images/B0B34WJK3X_cream_green_20260626_114904.jpg,https://m.media-amazon.com/images/I/41p7Iq8lLyL._AC_UY218_.jpg,B0B34WJK3X,830.0,https://www.amazon.in/dp/B0B34WJK3X,,https://www.amazon.in/dp/B0B34WJK3X,https://www.amazon.in/dp/B0B34WJK3X,67.03,64.46,low,B,post,post,manual-link,heuristic,heuristic,aa89477a61e9,07:30-09:00,manual_fallback,Pinterest access token missing,2026-06-26T11:49:04.787806
Best Beauty Tools Under Budget Under Rs 500 India,"7 pcs Face Massager & Skincare Beauty Tool Kit is a strong beauty tools under budget pick at around Rs. 484. Check the exact product page for latest specs, reviews and offers. #beautytoolsunderbudget #amazonindia #budgetgadgets #techindia #amazondeals",https://www.amazon.in/dp/B0GTJ58BKN,Wellness Beauty And Fitness Finds,7 pcs Face Massager & Skincare Beauty Tool Kit | Jade Roller Gua Sha Ice Roller 3D Face Massager Gold Beauty T Bar Derma Roller Silicone Scalp Brush | Skin Tightening Glow Kit | Women Men Face Care available on Amazon,/home/runner/work/PinAffiliate_V3/PinAffiliate_V3/output/images/B0GTJ58BKN_navy_gold_20260626_114904.jpg,https://m.media-amazon.com/images/I/61Z-qQuz3XL._AC_UL320_.jpg,B0GTJ58BKN,484.0,https://www.amazon.in/dp/B0GTJ58BKN,,https://www.amazon.in/dp/B0GTJ58BKN,https://www.amazon.in/dp/B0GTJ58BKN,63.38,67.7,medium,C,post,post,"low-review-proof, manual-link",heuristic,heuristic,4a74cf194513,18:30-20:00,manual_fallback,Pinterest access token missing,2026-06-26T11:49:04.787822
