,CONSIDERATION,PinAffiliateBot Daily Finds 2026-05-23,DRAFT,,,,,NO,,,,,,America/New_York,,,,,Daily product pins,,,,,,,DAILY,DRAFT,,,,,YES,"SEARCH,BROWSE",,,,,,,,,,,,,,,,,,,,,,,,,,,,,,,"home office gadgets under budget, Lifelong Electronics Extension Board 7-in-1 | Home Office Gadgets Under Budget",,,,,,B0GGBTZW1H_pin.jpg,Lifelong Electronics Extension Board 7-in-1 | Home Office Gadgets Under Budget,"Lifelong Electronics Extension Board 7-in-1 is today's budget pick for home office gadgets under budget. Price: Rs. 1,289. Check the exact product page for specs, reviews and current offers. #homeofficegadgetsunderbudget #amazonfinds #dailyfinds #budgetshopping",https://www.amazon.in/dp/B0GGBTZW1H?tag=newdro04-21,Lifelong Electronics Extension Board 7-in-1 with Switch | 4 AC Sockets + 3 USB Ports (2 Type A + 1 Type C) | Overload Protection | Desk Accessories & Multiplug Gadget | 2M Cord (Model: Cube) available on Amazon,NO,DRAFT,,STANDARD,18 Lifelong Electronics Extension Board 7-in-1 | Home Office Gadgets Under Budget,https://www.amazon.in/dp/B0GGBTZW1H?tag=newdro04-21,,,,,,,,,,,,,,,,,,,,,,,,,,,,,,,,,,,,,,,,,,,,,,,,,,,,,,,,,,,,,,DIRECT_TO_DESTINATION,SHOP_NOW,ACTIVE,"home office gadgets under budget, Lifelong Electronics Extension Board 7-in-1 | Home Office Gadgets Under Budget",,,,,,,,,,,,,,,,ready,BulkSheetVersion=V2
,CONSIDERATION,PinAffiliateBot Daily Finds 2026-05-23,DRAFT,,,,,NO,,,,,,America/New_York,,,,,Daily product pins,,,,,,,DAILY,DRAFT,,,,,YES,"SEARCH,BROWSE",,,,,,,,,,,,,,,,,,,,,,,,,,,,,,,"vacuum cleaner home budget, SEZNIK Vacuum Cleaner | Vacuum Cleaner Home Budget",,,,,,B0D8G9J1P5_pin.jpg,SEZNIK Vacuum Cleaner | Vacuum Cleaner Home Budget,"SEZNIK Vacuum Cleaner is today's budget pick for vacuum cleaner home budget. Price: Rs. 4,299. Check the exact product page for specs, reviews and current offers. #vacuumcleanerhomebudget #amazonfinds #dailyfinds #budgetshopping",https://www.amazon.in/dp/B0D8G9J1P5?tag=newdro04-21,"SEZNIK Vacuum Cleaner for Home Use Wet and Dry | Floor Mopping & Wet Spills + Dry Vacuuming | Turbo Sweep 3-in-1 Handheld Vacuum Cleaner | Corded, 600W, 20kpa Suction | 200ml Water Tank (SZ-V07) available on Amazon",NO,DRAFT,,STANDARD,19 SEZNIK Vacuum Cleaner | Vacuum Cleaner Home Budget,https://www.amazon.in/dp/B0D8G9J1P5?tag=newdro04-21,,,,,,,,,,,,,,,,,,,,,,,,,,,,,,,,,,,,,,,,,,,,,,,,,,,,,,,,,,,,,,DIRECT_TO_DESTINATION,SHOP_NOW,ACTIVE,"vacuum cleaner home budget, SEZNIK Vacuum Cleaner | Vacuum Cleaner Home Budget",,,,,,,,,,,,,,,,ready,BulkSheetVersion=V2
,CONSIDERATION,PinAffiliateBot Daily Finds 2026-05-23,DRAFT,,,,,NO,,,,,,America/New_York,,,,,Daily product pins,,,,,,,DAILY,DRAFT,,,,,YES,"SEARCH,BROWSE",,,,,,,,,,,,,,,,,,,,,,,,,,,,,,,"vacuum cleaner home budget, AGARO Regal Plus Upright Vacuum Cleaner, 2-in-1, Handheld & Stic | Vacuum Cleane",,,,,,B08WXPJKWY_pin.jpg,"AGARO Regal Plus Upright Vacuum Cleaner, 2-in-1, Handheld & Stic | Vacuum Cleaner Home Budget","AGARO Regal Plus Upright Vacuum Cleaner, 2-in-1, Handheld & Stic is today's budget pick for vacuum cleaner home budget. Price: Rs. 2,155. Check the exact product page for specs, reviews and current offers. #vacuumcleanerhomebudget #amazonfinds #dailyfinds #budgetshopping",https://www.amazon.in/dp/B08WXPJKWY?tag=newdro04-21,"AGARO Regal Plus Upright Vacuum Cleaner, 2-in-1, Handheld & Stick, Dry Vacuuming, for Home Use, 800 Watts, 6.5 kPa Suction Power, Bagless, Black available on Amazon",NO,DRAFT,,STANDARD,"20 AGARO Regal Plus Upright Vacuum Cleaner, 2-in-1, Handheld & Stic | Vacuum Cleaner Home Budget",https://www.amazon.in/dp/B08WXPJKWY?tag=newdro04-21,,,,,,,,,,,,,,,,,,,,,,,,,,,,,,,,,,,,,,,,,,,,,,,,,,,,,,,,,,,,,,DIRECT_TO_DESTINATION,SHOP_NOW,ACTIVE,"vacuum cleaner home budget, AGARO Regal Plus Upright Vacuum Cleaner, 2-in-1, Handheld & Stic | Vacuum Cleane",,,,,,,,,,,,,,,,ready,BulkSheetVersion=V2
,CONSIDERATION,PinAffiliateBot Daily Finds 2026-05-23,DRAFT,,,,,NO,,,,,,America/New_York,,,,,Daily product pins,,,,,,,DAILY,DRAFT,,,,,YES,"SEARCH,BROWSE",,,,,,,,,,,,,,,,,,,,,,,,,,,,,,,"viral amazon finds under budget, 2 Pc Q-Tip Cottonswab Stᴏrage Dispenser, Cotton Ball Swab Hᴏlder | Viral Amazon ",,,,,,B0C153JPSJ_pin.jpg,"2 Pc Q-Tip Cottonswab Stᴏrage Dispenser, Cotton Ball Swab Hᴏlder | Viral Amazon Finds Under Budget","2 Pc Q-Tip Cottonswab Stᴏrage Dispenser, Cotton Ball Swab Hᴏlder is today's viral trend for viral amazon finds under budget. Price: Rs. 261. Check the exact product page for specs, reviews and current offers. #viralamazonfindsunderbudget #amazonfinds #dailyfinds #budgetshopping",https://www.amazon.in/dp/B0C153JPSJ?tag=newdro04-21,"2 Pc Q-Tip Cottonswab Stᴏrage Dispenser, Cotton Ball Swab Hᴏlder Cotton/Earbud Hᴏlder Stᴏrage Box, Multipupose Cosmetics Makeup Stᴏrage Hᴏlder Box Organizer Container with Lid-Clear available on Amazon",NO,DRAFT,,STANDARD,"21 2 Pc Q-Tip Cottonswab Stᴏrage Dispenser, Cotton Ball Swab Hᴏlder | Viral Amazon Finds Under Budget",https://www.amazon.in/dp/B0C153JPSJ?tag=newdro04-21,,,,,,,,,,,,,,,,,,,,,,,,,,,,,,,,,,,,,,,,,,,,,,,,,,,,,,,,,,,,,,DIRECT_TO_DESTINATION,SHOP_NOW,ACTIVE,"viral amazon finds under budget, 2 Pc Q-Tip Cottonswab Stᴏrage Dispenser, Cotton Ball Swab Hᴏlder | Viral Amazon ",,,,,,,,,,,,,,,,ready,BulkSheetVersion=V2
,CONSIDERATION,PinAffiliateBot Daily Finds 2026-05-23,DRAFT,,,,,NO,,,,,,America/New_York,,,,,Daily product pins,,,,,,,DAILY,DRAFT,,,,,YES,"SEARCH,BROWSE",,,,,,,,,,,,,,,,,,,,,,,,,,,,,,,"gift ideas useful products, Skillmatics Large Flash Cards | Gift Ideas Useful Products",,,,,,B0BFDGYSZM_pin.jpg,Skillmatics Large Flash Cards | Gift Ideas Useful Products,"Skillmatics Large Flash Cards is today's daily trend for gift ideas useful products. Price: Rs. 590. Check the exact product page for specs, reviews and current offers. #giftideasusefulproducts #amazonfinds #dailyfinds #budgetshopping",https://www.amazon.in/dp/B0BFDGYSZM?tag=newdro04-21,"Skillmatics Large Flash Cards for Babies & Infants - High Contrast, 60 Pictures, Language_Skills, Visual Stimulation & Sensory Development, Travel Friendly, Gifts for Infants 0 to 12 Months Kids available on Amazon",NO,DRAFT,,STANDARD,22 Skillmatics Large Flash Cards | Gift Ideas Useful Products,https://www.amazon.in/dp/B0BFDGYSZM?tag=newdro04-21,,,,,,,,,,,,,,,,,,,,,,,,,,,,,,,,,,,,,,,,,,,,,,,,,,,,,,,,,,,,,,DIRECT_TO_DESTINATION,SHOP_NOW,ACTIVE,"gift ideas useful products, Skillmatics Large Flash Cards | Gift Ideas Useful Products",,,,,,,,,,,,,,,,ready,BulkSheetVersion=V2
,CONSIDERATION,PinAffiliateBot Daily Finds 2026-05-23,DRAFT,,,,,NO,,,,,,America/New_York,,,,,Daily product pins,,,,,,,DAILY,DRAFT,,,,,YES,"SEARCH,BROWSE",,,,,,,,,,,,,,,,,,,,,,,,,,,,,,,"fitness accessories for home workout, Burnlab 6 in 1 multifunctional weight training kit | Fitness Accessories For Hom",,,,,,B0C6KRGHKX_pin.jpg,Burnlab 6 in 1 multifunctional weight training kit | Fitness Accessories For Home Workout,"Burnlab 6 in 1 multifunctional weight training kit is today's daily trend for fitness accessories for home workout. Price: Rs. 4,355. Check the exact product page for specs, reviews and current offers. #fitnessaccessoriesforhomeworkout #amazonfinds #dailyfinds #budgetshopping",https://www.amazon.in/dp/B0C6KRGHKX?tag=newdro04-21,"Burnlab 6 in 1 multifunctional weight training kit - Dumbbells, Kettlebells, Barbells & Push up brackets in 1 | Adjustable Weights | Perfect for Full Body Workout for Men & Women available on Amazon",NO,DRAFT,,STANDARD,23 Burnlab 6 in 1 multifunctional weight training kit | Fitness Accessories For Home Workout,https://www.amazon.in/dp/B0C6KRGHKX?tag=newdro04-21,,,,,,,,,,,,,,,,,,,,,,,,,,,,,,,,,,,,,,,,,,,,,,,,,,,,,,,,,,,,,,DIRECT_TO_DESTINATION,SHOP_NOW,ACTIVE,"fitness accessories for home workout, Burnlab 6 in 1 multifunctional weight training kit | Fitness Accessories For Hom",,,,,,,,,,,,,,,,ready,BulkSheetVersion=V2
,CONSIDERATION,PinAffiliateBot Daily Finds 2026-05-23,DRAFT,,,,,NO,,,,,,America/New_York,,,,,Daily product pins,,,,,,,DAILY,DRAFT,,,,,YES,"SEARCH,BROWSE",,,,,,,,,,,,,,,,,,,,,,,,,,,,,,,"laptop accessories best sellers, Dyazo 360° Rotating Laptop Stand | Laptop Accessories Best Sellers",,,,,,B09RG19X14_pin.jpg,Dyazo 360° Rotating Laptop Stand | Laptop Accessories Best Sellers,"Dyazo 360° Rotating Laptop Stand is today's best seller for laptop accessories best sellers. Price: Rs. 2,999. Check the exact product page for specs, reviews and current offers. #laptopaccessoriesbestsellers #amazonfinds #dailyfinds #budgetshopping",https://www.amazon.in/dp/B09RG19X14?tag=newdro04-21,Dyazo 360° Rotating Laptop Stand | Height Adjustable & Foldable Riser with Swivel Base | Heat Vent & Anti-Slip Design | Laptop Holder for Desk & Standing Use | Fits Upto 15.6 Inch Laptops (Space Grey) available on Amazon,NO,DRAFT,,STANDARD,24 Dyazo 360° Rotating Laptop Stand | Laptop Accessories Best Sellers,https://www.amazon.in/dp/B09RG19X14?tag=newdro04-21,,,,,,,,,,,,,,,,,,,,,,,,,,,,,,,,,,,,,,,,,,,,,,,,,,,,,,,,,,,,,,DIRECT_TO_DESTINATION,SHOP_NOW,ACTIVE,"laptop accessories best sellers, Dyazo 360° Rotating Laptop Stand | Laptop Accessories Best Sellers",,,,,,,,,,,,,,,,ready,BulkSheetVersion=V2
,CONSIDERATION,PinAffiliateBot Daily Finds 2026-05-23,DRAFT,,,,,NO,,,,,,America/New_York,,,,,Daily product pins,,,,,,,DAILY,DRAFT,,,,,YES,"SEARCH,BROWSE",,,,,,,,,,,,,,,,,,,,,,,,,,,,,,,"self care products trending, Minimalist Anti-Acne Kit, Skincare Routine Kit | Self Care Products Trending",,,,,,B0B9SN8P4M_pin.jpg,"Minimalist Anti-Acne Kit, Skincare Routine Kit | Self Care Products Trending","Minimalist Anti-Acne Kit, Skincare Routine Kit is today's daily trend for self care products trending. Price: Rs. 1,137. Check the exact product page for specs, reviews and current offers. #selfcareproductstrending #amazonfinds #dailyfinds #budgetshopping",https://www.amazon.in/dp/B0B9SN8P4M?tag=newdro04-21,"Minimalist Anti-Acne Kit, Skincare Routine Kit for Unisex, Salicylic Acid Face Wash, Vitamin B5 Moisturizer, and Salicylic Acid Serum Combo available on Amazon",NO,DRAFT,,STANDARD,"25 Minimalist Anti-Acne Kit, Skincare Routine Kit | Self Care Products Trending",https://www.amazon.in/dp/B0B9SN8P4M?tag=newdro04-21,,,,,,,,,,,,,,,,,,,,,,,,,,,,,,,,,,,,,,,,,,,,,,,,,,,,,,,,,,,,,,DIRECT_TO_DESTINATION,SHOP_NOW,ACTIVE,"self care products trending, Minimalist Anti-Acne Kit, Skincare Routine Kit | Self Care Products Trending",,,,,,,,,,,,,,,,ready,BulkSheetVersion=V2
,CONSIDERATION,PinAffiliateBot Daily Finds 2026-05-23,DRAFT,,,,,NO,,,,,,America/New_York,,,,,Daily product pins,,,,,,,DAILY,DRAFT,,,,,YES,"SEARCH,BROWSE",,,,,,,,,,,,,,,,,,,,,,,,,,,,,,,"daily deals useful products, SJeware Men and Women Solid Ankle Length Socks Multicolored | Daily Deals Useful",,,,,,B0BZVZYXV5_pin.jpg,SJeware Men and Women Solid Ankle Length Socks Multicolored | Daily Deals Useful Products,"SJeware Men and Women Solid Ankle Length Socks Multicolored is today's budget pick for daily deals useful products. Price: Rs. 199. Check the exact product page for specs, reviews and current offers. #dailydealsusefulproducts #amazonfinds #dailyfinds #budgetshopping",https://www.amazon.in/dp/B0BZVZYXV5?tag=newdro04-21,SJeware Men and Women Solid Ankle Length Socks Multicolored (SJW-PLAIN-PACKOF12-B) available on Amazon,NO,DRAFT,,STANDARD,26 SJeware Men and Women Solid Ankle Length Socks Multicolored | Daily Deals Useful Products,https://www.amazon.in/dp/B0BZVZYXV5?tag=newdro04-21,,,,,,,,,,,,,,,,,,,,,,,,,,,,,,,,,,,,,,,,,,,,,,,,,,,,,,,,,,,,,,DIRECT_TO_DESTINATION,SHOP_NOW,ACTIVE,"daily deals useful products, SJeware Men and Women Solid Ankle Length Socks Multicolored | Daily Deals Useful",,,,,,,,,,,,,,,,ready,BulkSheetVersion=V2
,CONSIDERATION,PinAffiliateBot Daily Finds 2026-05-23,DRAFT,,,,,NO,,,,,,America/New_York,,,,,Daily product pins,,,,,,,DAILY,DRAFT,,,,,YES,"SEARCH,BROWSE",,,,,,,,,,,,,,,,,,,,,,,,,,,,,,,"daily deals useful products, Kesh King Gold Anti Hairfall Shampoo, Reduces Hair Fall, Makes H | Daily Deals U",,,,,,B0B2R6WXGC_pin.jpg,"Kesh King Gold Anti Hairfall Shampoo, Reduces Hair Fall, Makes H | Daily Deals Useful Products","Kesh King Gold Anti Hairfall Shampoo, Reduces Hair Fall, Makes H is today's budget pick for daily deals useful products. Price: Rs. 466. Check the exact product page for specs, reviews and current offers. #dailydealsusefulproducts #amazonfinds #dailyfinds #budgetshopping",https://www.amazon.in/dp/B0B2R6WXGC?tag=newdro04-21,"Kesh King Gold Anti Hairfall Shampoo, Reduces Hair Fall, Makes Hair Strong, Strengthens, Nourishes & Conditions, For Soft, Smooth & Voluminous Hair, For Men & Women, 1000 ml available on Amazon",NO,DRAFT,,STANDARD,"27 Kesh King Gold Anti Hairfall Shampoo, Reduces Hair Fall, Makes H | Daily Deals Useful Products",https://www.amazon.in/dp/B0B2R6WXGC?tag=newdro04-21,,,,,,,,,,,,,,,,,,,,,,,,,,,,,,,,,,,,,,,,,,,,,,,,,,,,,,,,,,,,,,DIRECT_TO_DESTINATION,SHOP_NOW,ACTIVE,"daily deals useful products, Kesh King Gold Anti Hairfall Shampoo, Reduces Hair Fall, Makes H | Daily Deals U",,,,,,,,,,,,,,,,ready,BulkSheetVersion=V2
,CONSIDERATION,PinAffiliateBot Daily Finds 2026-05-23,DRAFT,,,,,NO,,,,,,America/New_York,,,,,Daily product pins,,,,,,,DAILY,DRAFT,,,,,YES,"SEARCH,BROWSE",,,,,,,,,,,,,,,,,,,,,,,,,,,,,,,"bluetooth speaker portable, pTron Newly Launched Fusion Joy 20W Bluetooth Speaker | Bluetooth Speaker Portab",,,,,,B0D772RKGT_pin.jpg,pTron Newly Launched Fusion Joy 20W Bluetooth Speaker | Bluetooth Speaker Portable,"pTron Newly Launched Fusion Joy 20W Bluetooth Speaker is today's daily trend for bluetooth speaker portable. Price: Rs. 1,799. Check the exact product page for specs, reviews and current offers. #bluetoothspeakerportable #amazonfinds #dailyfinds #budgetshopping",https://www.amazon.in/dp/B0D772RKGT?tag=newdro04-21,"pTron Newly Launched Fusion Joy 20W Bluetooth Speaker with Wireless Karaoke Mic, 6Hrs Playtime, Vivid RGB Lights, Voice Effects, Multi-Play Modes BT5.3/TF Card & Type-C Charging Port (Light Cream) available on Amazon",NO,DRAFT,,STANDARD,28 pTron Newly Launched Fusion Joy 20W Bluetooth Speaker | Bluetooth Speaker Portable,https://www.amazon.in/dp/B0D772RKGT?tag=newdro04-21,,,,,,,,,,,,,,,,,,,,,,,,,,,,,,,,,,,,,,,,,,,,,,,,,,,,,,,,,,,,,,DIRECT_TO_DESTINATION,SHOP_NOW,ACTIVE,"bluetooth speaker portable, pTron Newly Launched Fusion Joy 20W Bluetooth Speaker | Bluetooth Speaker Portab",,,,,,,,,,,,,,,,ready,BulkSheetVersion=V2
,CONSIDERATION,PinAffiliateBot Daily Finds 2026-05-23,DRAFT,,,,,NO,,,,,,America/New_York,,,,,Daily product pins,,,,,,,DAILY,DRAFT,,,,,YES,"SEARCH,BROWSE",,,,,,,,,,,,,,,,,,,,,,,,,,,,,,,"air fryer best seller, Ninja Air Fryer MAX PRO 6.2L | Air Fryer Best Seller",,,,,,B0FWY8R9W8_pin.jpg,Ninja Air Fryer MAX PRO 6.2L | Air Fryer Best Seller,"Ninja Air Fryer MAX PRO 6.2L is today's best seller for air fryer best seller. Price: Rs. 10,998. Check the exact product page for specs, reviews and current offers. #airfryerbestseller #amazonfinds #dailyfinds #budgetshopping",https://www.amazon.in/dp/B0FWY8R9W8?tag=newdro04-21,"Ninja Air Fryer MAX PRO 6.2L (AF180IN) 2000W Max Crisp Technology Variable Air Flow PFOA-Free Non-Stick 6-in-1 Air Fry, Roast, Bake & More Cook from Frozen to Crispy, black available on Amazon",NO,DRAFT,,STANDARD,29 Ninja Air Fryer MAX PRO 6.2L | Air Fryer Best Seller,https://www.amazon.in/dp/B0FWY8R9W8?tag=newdro04-21,,,,,,,,,,,,,,,,,,,,,,,,,,,,,,,,,,,,,,,,,,,,,,,,,,,,,,,,,,,,,,DIRECT_TO_DESTINATION,SHOP_NOW,ACTIVE,"air fryer best seller, Ninja Air Fryer MAX PRO 6.2L | Air Fryer Best Seller",,,,,,,,,,,,,,,,ready,BulkSheetVersion=V2
,CONSIDERATION,PinAffiliateBot Daily Finds 2026-05-23,DRAFT,,,,,NO,,,,,,America/New_York,,,,,Daily product pins,,,,,,,DAILY,DRAFT,,,,,YES,"SEARCH,BROWSE",,,,,,,,,,,,,,,,,,,,,,,,,,,,,,,"aesthetic desk setup essentials, GKD Desk Organizer stylish foldable all in One Cube Box Office d | Aesthetic Des",,,,,,B09LYM7XBR_pin.jpg,GKD Desk Organizer stylish foldable all in One Cube Box Office d | Aesthetic Desk Setup Essentials,"GKD Desk Organizer stylish foldable all in One Cube Box Office d is today's viral trend for aesthetic desk setup essentials. Price: Rs. 670. Check the exact product page for specs, reviews and current offers. #aestheticdesksetupessentials #amazonfinds #dailyfinds #budgetshopping",https://www.amazon.in/dp/B09LYM7XBR?tag=newdro04-21,"GKD Desk Organizer stylish foldable all in One Cube Box Office desk organizer with clock mobile stand portable desk organizer, Calendar 2026 corporate gifts (Bamboo Ecofriendly) available on Amazon",NO,DRAFT,,STANDARD,30 GKD Desk Organizer stylish foldable all in One Cube Box Office d | Aesthetic Desk Setup Essentials,https://www.amazon.in/dp/B09LYM7XBR?tag=newdro04-21,,,,,,,,,,,,,,,,,,,,,,,,,,,,,,,,,,,,,,,,,,,,,,,,,,,,,,,,,,,,,,DIRECT_TO_DESTINATION,SHOP_NOW,ACTIVE,"aesthetic desk setup essentials, GKD Desk Organizer stylish foldable all in One Cube Box Office d | Aesthetic Des",,,,,,,,,,,,,,,,ready,BulkSheetVersion=V2
