asin,title,price,currency,rating,reviews,keyword,category,source,fetched_at,has_affiliate,product_url,affiliate_link,manual_link,sitestripe_url,search_url,trend_label,seo_keyword,google_title,google_description,trend_score,product_score,ai_score,buyer_intent,quality_grade,recommendation,risk_flags,hf_signal,hf_signal_source,best_posting_window,seo_title_variants,caption_variants,pin_title,pin_description,pin_link,pin_board,pin_image_size,pin_alt_text,image_url
B0D78Y3KRP,"pTron Bassbuds Astra in-Ear TWS Earbuds w/Stereo Sound, 34Hrs Playtime, Stereo Calls, Custom EQ, Mobile App, BTv5.3 Headphones, Touch Control, Voice Assistant, Type C Charging & IPX4 (Light Blue)",598.0,INR,4.0,"2,306",best wireless earbuds under budget,Electronics & Gadgets,scrape,2026-06-02T12:20:00.909904,False,https://www.amazon.in/dp/B0D78Y3KRP,,https://www.amazon.in/dp/B0D78Y3KRP,https://www.amazon.in/dp/B0D78Y3KRP,https://www.amazon.in/s?k=best+wireless+earbuds+under+budget,budget pick,best wireless earbuds under budget,"pTron Bassbuds Astra in-Ear TWS Earbuds w/Stereo Sound, 34Hrs Pl | Wireless Earbuds Under Budget Price, Review And Deals","pTron Bassbuds Astra in-Ear TWS Earbuds w/Stereo Sound, 34Hrs Pl is a budget pick for best wireless earbuds under budget. Compare current price, rating, features and exact Amazon product link before you buy.",28,78.18,78.18,high,A,post,manual-link,0,heuristic,22:00-23:00,"[""Best Best Wireless Earbuds Under Budget Under Rs 600 India"", ""pTron Bassbuds Astra in-Ear TWS Earbuds w/Stereo Sound Review And Price"", ""Useful Amazon Find: pTron Bassbuds Astra in-Ear TWS Earbuds w/Stereo Sound"", ""Best Wireless Earbuds Under Budget For Home And Daily Use"", ""Top Rated Best Wireless Earbuds Under Budget Worth Checking""]","[""pTron Bassbuds Astra in-Ear TWS Earbuds w/Stereo Sound, 34Hrs Playtime,  is a strong best wireless earbuds under budget pick at around Rs. 598. Check the exact product page for latest specs, reviews and offers."", ""Looking for best wireless earbuds under budget? pTron Bassbuds Astra in-Ear TWS Earbuds w/Stereo Sound, 34Hrs Playtime,  has useful everyday appeal and is worth comparing before you buy."", ""Save this best wireless earbuds under budget idea for later. pTron Bassbuds Astra in-Ear TWS Earbuds w/Stereo Sound, 34Hrs Playtime,  may fit home, work or gifting needs depending on today's Amazon price.""]","pTron Bassbuds Astra in-Ear TWS Earbuds w/Stereo Sound, 34Hrs Pl | Wireless Earbuds Under Budget","pTron Bassbuds Astra in-Ear TWS Earbuds w/Stereo Sound, 34Hrs Pl is today's budget pick for best wireless earbuds under budget. Price: Rs. 598. Check the exact product page for specs, reviews and current offers. #bestwirelessearbudsunderbudget #amazonfinds #dailyfinds #budgetshopping",https://www.amazon.in/dp/B0D78Y3KRP,Viral Amazon Finds,1000x1500px,"pTron Bassbuds Astra in-Ear TWS Earbuds w/Stereo Sound, 34Hrs Playtime, Stereo Calls, Custom EQ, Mobile App, BTv5.3 Headphones, Touch Control, Voice Assistant, Type C Charging & IPX4 (Light Blue) available on Amazon",https://m.media-amazon.com/images/I/511a5xoskhL._AC_UY218_.jpg
B0F63DQ9L6,"HAMMER New Ultra pods 2026 TWS Wireless Bluetooth Earbuds with Inbuilt Mic, 100H Standby Time, 50H Playtime, USB Type-C, 13mm Dynamic Drivers, BT v6.0, IPX5 Water-Resistant Earphones (Blue)",598.0,INR,3.7,"1,048",best wireless earbuds under budget,Electronics & Gadgets,scrape,2026-06-02T12:20:00.908304,False,https://www.amazon.in/dp/B0F63DQ9L6,,https://www.amazon.in/dp/B0F63DQ9L6,https://www.amazon.in/dp/B0F63DQ9L6,https://www.amazon.in/s?k=best+wireless+earbuds+under+budget,budget pick,best wireless earbuds under budget,"HAMMER New Ultra pods 2026 TWS Wireless Bluetooth Earbuds | Wireless Earbuds Under Budget Price, Review And Deals","HAMMER New Ultra pods 2026 TWS Wireless Bluetooth Earbuds is a budget pick for best wireless earbuds under budget. Compare current price, rating, features and exact Amazon product link before you buy.",28,73.7,73.7,high,B,post,"low-rating, manual-link",0,heuristic,22:00-23:00,"[""Best Best Wireless Earbuds Under Budget Under Rs 600 India"", ""HAMMER New Ultra pods 2026 TWS Wireless Bluetooth Earb Review And Price"", ""Useful Amazon Find: HAMMER New Ultra pods 2026 TWS Wireless Bluetooth Earb"", ""Best Wireless Earbuds Under Budget For Home And Daily Use"", ""Top Rated Best Wireless Earbuds Under Budget Worth Checking""]","[""HAMMER New Ultra pods 2026 TWS Wireless Bluetooth Earbuds with Inbuilt M is a strong best wireless earbuds under budget pick at around Rs. 598. Check the exact product page for latest specs, reviews and offers."", ""Looking for best wireless earbuds under budget? HAMMER New Ultra pods 2026 TWS Wireless Bluetooth Earbuds with Inbuilt M has useful everyday appeal and is worth comparing before you buy."", ""Save this best wireless earbuds under budget idea for later. HAMMER New Ultra pods 2026 TWS Wireless Bluetooth Earbuds with Inbuilt M may fit home, work or gifting needs depending on today's Amazon price.""]",HAMMER New Ultra pods 2026 TWS Wireless Bluetooth Earbuds | Wireless Earbuds Under Budget,"HAMMER New Ultra pods 2026 TWS Wireless Bluetooth Earbuds is today's budget pick for best wireless earbuds under budget. Price: Rs. 598. Check the exact product page for specs, reviews and current offers. #bestwirelessearbudsunderbudget #amazonfinds #dailyfinds #budgetshopping",https://www.amazon.in/dp/B0F63DQ9L6,Viral Amazon Finds,1000x1500px,"HAMMER New Ultra pods 2026 TWS Wireless Bluetooth Earbuds with Inbuilt Mic, 100H Standby Time, 50H Playtime, USB Type-C, 13mm Dynamic Drivers, BT v6.0, IPX5 Water-Resistant Earphones (Blue) available on Amazon",https://m.media-amazon.com/images/I/51qiyGm3FqL._AC_UY218_.jpg
B0FD8QFWCV,"ASTRIDE Ergofit Ergonomic Office Chair for Home | 3-Years Warranty | 2D Headrest, Adjustable Arms & Lumbar Support | Tilt Lock Mechanism [Heavy Duty Chromium Metal Base, Black]",4999.0,INR,4.0,"6,467",office chair ergonomic budget,Electronics & Gadgets,scrape,2026-06-02T12:20:39.665174,False,https://www.amazon.in/dp/B0FD8QFWCV,,https://www.amazon.in/dp/B0FD8QFWCV,https://www.amazon.in/dp/B0FD8QFWCV,https://www.amazon.in/s?k=office+chair+ergonomic+budget,budget pick,office chair ergonomic budget,"ASTRIDE Ergofit Ergonomic Office Chair | Office Chair Ergonomic Budget Price, Review And Deals","ASTRIDE Ergofit Ergonomic Office Chair is a budget pick for office chair ergonomic budget. Compare current price, rating, features and exact Amazon product link before you buy.",6,67.98,67.98,medium,B,post,manual-link,0,heuristic,12:00-13:30,"[""Best Office Chair Ergonomic Budget Under Rs 5000 India"", ""ASTRIDE Ergofit Ergonomic Office Chair for Home Review And Price"", ""Useful Amazon Find: ASTRIDE Ergofit Ergonomic Office Chair for Home"", ""Office Chair Ergonomic Budget For Home And Daily Use"", ""Top Rated Office Chair Ergonomic Budget Worth Checking""]","[""ASTRIDE Ergofit Ergonomic Office Chair for Home is a strong office chair ergonomic budget pick at around Rs. 4,999. Check the exact product page for latest specs, reviews and offers."", ""Looking for office chair ergonomic budget? ASTRIDE Ergofit Ergonomic Office Chair for Home has useful everyday appeal and is worth comparing before you buy."", ""Save this office chair ergonomic budget idea for later. ASTRIDE Ergofit Ergonomic Office Chair for Home may fit home, work or gifting needs depending on today's Amazon price.""]",ASTRIDE Ergofit Ergonomic Office Chair | Office Chair Ergonomic Budget,"ASTRIDE Ergofit Ergonomic Office Chair is today's budget pick for office chair ergonomic budget. Price: Rs. 4,999. Check the exact product page for specs, reviews and current offers. #officechairergonomicbudget #amazonfinds #dailyfinds #budgetshopping",https://www.amazon.in/dp/B0FD8QFWCV,Budget Tech And Desk Setup,1000x1500px,"ASTRIDE Ergofit Ergonomic Office Chair for Home | 3-Years Warranty | 2D Headrest, Adjustable Arms & Lumbar Support | Tilt Lock Mechanism [Heavy Duty Chromium Metal Base, Black] available on Amazon",https://m.media-amazon.com/images/I/71-TyvMTL0L._AC_UL320_.jpg
B0BSLRB8NJ,"Sounce 3 in 1 Cleaning Kit Set for Screen PC, Laptops, Monitors, Mobiles, LCD, LED, TV/Professional Quality/Prevents Static Electricity, 100ml with Micro Fiber Cloth and Brush",139.0,INR,4.2,"4,531",laptop accessories best sellers,Electronics & Gadgets,scrape,2026-06-02T12:20:23.844810,False,https://www.amazon.in/dp/B0BSLRB8NJ,,https://www.amazon.in/dp/B0BSLRB8NJ,https://www.amazon.in/dp/B0BSLRB8NJ,https://www.amazon.in/s?k=laptop+accessories+best+sellers,best seller,laptop accessories best sellers,"Sounce 3 in 1 Cleaning Kit Set | Laptop Accessories Best Sellers Price, Review And Deals","Sounce 3 in 1 Cleaning Kit Set is a best seller for laptop accessories best sellers. Compare current price, rating, features and exact Amazon product link before you buy.",15,67.45,67.45,medium,B,post,manual-link,0,heuristic,12:00-13:30,"[""Best Laptop Accessories Best Sellers India"", ""Sounce 3 in 1 Cleaning Kit Set for Screen PC, Laptops Review And Price"", ""Useful Amazon Find: Sounce 3 in 1 Cleaning Kit Set for Screen PC, Laptops"", ""Laptop Accessories Best Sellers For Home And Daily Use"", ""Top Rated Laptop Accessories Best Sellers Worth Checking""]","[""Sounce 3 in 1 Cleaning Kit Set for Screen PC, Laptops, Monitors, Mobiles is a strong laptop accessories best sellers pick at around Rs. 139. Check the exact product page for latest specs, reviews and offers."", ""Looking for laptop accessories best sellers? Sounce 3 in 1 Cleaning Kit Set for Screen PC, Laptops, Monitors, Mobiles has useful everyday appeal and is worth comparing before you buy."", ""Save this laptop accessories best sellers idea for later. Sounce 3 in 1 Cleaning Kit Set for Screen PC, Laptops, Monitors, Mobiles may fit home, work or gifting needs depending on today's Amazon price.""]",Sounce 3 in 1 Cleaning Kit Set | Laptop Accessories Best Sellers,"Sounce 3 in 1 Cleaning Kit Set is today's best seller for laptop accessories best sellers. Price: Rs. 139. Check the exact product page for specs, reviews and current offers. #laptopaccessoriesbestsellers #amazonfinds #dailyfinds #budgetshopping",https://www.amazon.in/dp/B0BSLRB8NJ,Budget Tech And Desk Setup,1000x1500px,"Sounce 3 in 1 Cleaning Kit Set for Screen PC, Laptops, Monitors, Mobiles, LCD, LED, TV/Professional Quality/Prevents Static Electricity, 100ml with Micro Fiber Cloth and Brush available on Amazon",https://m.media-amazon.com/images/I/71CFc-fYMBL._AC_UY218_.jpg
B08PFSZ7FH,"STRIFF Laptop Tabletop Stand, Adjustable Laptop Computer Stand, Multi-Angle, Portable Foldable Laptop Riser Notebook Holder Compatible for 9 to 15.6 Laptops (Black)",199.0,INR,4.2,"3,256",laptop accessories best sellers,Electronics & Gadgets,scrape,2026-06-02T12:20:23.843259,False,https://www.amazon.in/dp/B08PFSZ7FH,,https://www.amazon.in/dp/B08PFSZ7FH,https://www.amazon.in/dp/B08PFSZ7FH,https://www.amazon.in/s?k=laptop+accessories+best+sellers,best seller,laptop accessories best sellers,"STRIFF Laptop Tabletop Stand, Adjustable Laptop Computer Stand | Laptop Accessories Best Sellers Price, Review And Deals","STRIFF Laptop Tabletop Stand, Adjustable Laptop Computer Stand is a best seller for laptop accessories best sellers. Compare current price, rating, features and exact Amazon product link before you buy.",15,65.4,65.4,medium,B,post,manual-link,0,heuristic,07:30-09:00,"[""Best Laptop Accessories Best Sellers India"", ""STRIFF Laptop Tabletop Stand, Adjustable Laptop Comput Review And Price"", ""Useful Amazon Find: STRIFF Laptop Tabletop Stand, Adjustable Laptop Comput"", ""Laptop Accessories Best Sellers For Home And Daily Use"", ""Top Rated Laptop Accessories Best Sellers Worth Checking""]","[""STRIFF Laptop Tabletop Stand, Adjustable Laptop Computer Stand, Multi-An is a strong laptop accessories best sellers pick at around Rs. 199. Check the exact product page for latest specs, reviews and offers."", ""Looking for laptop accessories best sellers? STRIFF Laptop Tabletop Stand, Adjustable Laptop Computer Stand, Multi-An has useful everyday appeal and is worth comparing before you buy."", ""Save this laptop accessories best sellers idea for later. STRIFF Laptop Tabletop Stand, Adjustable Laptop Computer Stand, Multi-An may fit home, work or gifting needs depending on today's Amazon price.""]","STRIFF Laptop Tabletop Stand, Adjustable Laptop Computer Stand | Laptop Accessories Best Sellers","STRIFF Laptop Tabletop Stand, Adjustable Laptop Computer Stand is today's best seller for laptop accessories best sellers. Price: Rs. 199. Check the exact product page for specs, reviews and current offers. #laptopaccessoriesbestsellers #amazonfinds #dailyfinds #budgetshopping",https://www.amazon.in/dp/B08PFSZ7FH,Budget Tech And Desk Setup,1000x1500px,"STRIFF Laptop Tabletop Stand, Adjustable Laptop Computer Stand, Multi-Angle, Portable Foldable Laptop Riser Notebook Holder Compatible for 9 to 15.6 Laptops (Black) available on Amazon",https://m.media-amazon.com/images/I/71-z2kQ-NuL._AC_UY218_.jpg
B0C376RWQP,"Zebronics-NS1000 Laptop Stand Featuring Foldable Design, Anti-Slip Silicone Rubber Pads, Supports Maximum of 5kgs Weight, 6 Adjustable Levels",197.0,INR,3.5,"4,722",laptop accessories best sellers,Electronics & Gadgets,scrape,2026-06-02T12:20:23.842507,False,https://www.amazon.in/dp/B0C376RWQP,,https://www.amazon.in/dp/B0C376RWQP,https://www.amazon.in/dp/B0C376RWQP,https://www.amazon.in/s?k=laptop+accessories+best+sellers,best seller,laptop accessories best sellers,"Zebronics-NS1000 Laptop Stand Featuring Foldable Design, Anti-Sl | Laptop Accessories Best Sellers Price, Review And Dea","Zebronics-NS1000 Laptop Stand Featuring Foldable Design, Anti-Sl is a best seller for laptop accessories best sellers. Compare current price, rating, features and exact Amazon product link before you buy.",15,64.58,64.58,medium,B,post,"low-rating, manual-link",0,heuristic,07:30-09:00,"[""Best Laptop Accessories Best Sellers India"", ""Zebronics-NS1000 Laptop Stand Featuring Foldable Desig Review And Price"", ""Useful Amazon Find: Zebronics-NS1000 Laptop Stand Featuring Foldable Desig"", ""Laptop Accessories Best Sellers For Home And Daily Use"", ""Top Rated Laptop Accessories Best Sellers Worth Checking""]","[""Zebronics-NS1000 Laptop Stand Featuring Foldable Design, Anti-Slip Silic is a strong laptop accessories best sellers pick at around Rs. 197. Check the exact product page for latest specs, reviews and offers."", ""Looking for laptop accessories best sellers? Zebronics-NS1000 Laptop Stand Featuring Foldable Design, Anti-Slip Silic has useful everyday appeal and is worth comparing before you buy."", ""Save this laptop accessories best sellers idea for later. Zebronics-NS1000 Laptop Stand Featuring Foldable Design, Anti-Slip Silic may fit home, work or gifting needs depending on today's Amazon price.""]","Zebronics-NS1000 Laptop Stand Featuring Foldable Design, Anti-Sl | Laptop Accessories Best Sellers","Zebronics-NS1000 Laptop Stand Featuring Foldable Design, Anti-Sl is today's best seller for laptop accessories best sellers. Price: Rs. 197. Check the exact product page for specs, reviews and current offers. #laptopaccessoriesbestsellers #amazonfinds #dailyfinds #budgetshopping",https://www.amazon.in/dp/B0C376RWQP,Budget Tech And Desk Setup,1000x1500px,"Zebronics-NS1000 Laptop Stand Featuring Foldable Design, Anti-Slip Silicone Rubber Pads, Supports Maximum of 5kgs Weight, 6 Adjustable Levels available on Amazon",https://m.media-amazon.com/images/I/51B4emQb6yL._AC_UY218_.jpg
B0D7Z944C7,"EDNITA Mini Laptop Stand for Desk | Portable Metal PC Desk Stand, Aluminium Cooling Pad Mini Clip Compatible with MacBook Apple Laptop, Lenovo, Dell, Hp, Acer & Other Laptops Pack of-2 (Silver)",198.0,INR,4.2,"1,493",laptop accessories best sellers,Electronics & Gadgets,scrape,2026-06-02T12:20:23.844022,False,https://www.amazon.in/dp/B0D7Z944C7,,https://www.amazon.in/dp/B0D7Z944C7,https://www.amazon.in/dp/B0D7Z944C7,https://www.amazon.in/s?k=laptop+accessories+best+sellers,best seller,laptop accessories best sellers,"EDNITA Mini Laptop Stand | Laptop Accessories Best Sellers Price, Review And Deals","EDNITA Mini Laptop Stand is a best seller for laptop accessories best sellers. Compare current price, rating, features and exact Amazon product link before you buy.",15,61.72,61.72,medium,C,post,manual-link,0,heuristic,07:30-09:00,"[""Best Laptop Accessories Best Sellers India"", ""EDNITA Mini Laptop Stand for Desk Review And Price"", ""Useful Amazon Find: EDNITA Mini Laptop Stand for Desk"", ""Laptop Accessories Best Sellers For Home And Daily Use"", ""Top Rated Laptop Accessories Best Sellers Worth Checking""]","[""EDNITA Mini Laptop Stand for Desk is a strong laptop accessories best sellers pick at around Rs. 198. Check the exact product page for latest specs, reviews and offers."", ""Looking for laptop accessories best sellers? EDNITA Mini Laptop Stand for Desk has useful everyday appeal and is worth comparing before you buy."", ""Save this laptop accessories best sellers idea for later. EDNITA Mini Laptop Stand for Desk may fit home, work or gifting needs depending on today's Amazon price.""]",EDNITA Mini Laptop Stand | Laptop Accessories Best Sellers,"EDNITA Mini Laptop Stand is today's best seller for laptop accessories best sellers. Price: Rs. 198. Check the exact product page for specs, reviews and current offers. #laptopaccessoriesbestsellers #amazonfinds #dailyfinds #budgetshopping",https://www.amazon.in/dp/B0D7Z944C7,Budget Tech And Desk Setup,1000x1500px,"EDNITA Mini Laptop Stand for Desk | Portable Metal PC Desk Stand, Aluminium Cooling Pad Mini Clip Compatible with MacBook Apple Laptop, Lenovo, Dell, Hp, Acer & Other Laptops Pack of-2 (Silver) available on Amazon",https://m.media-amazon.com/images/I/61ZejdSL77L._AC_UY218_.jpg
B0D2XZ6SZC,IAFA FURNITURE® Diego Mid-Back Mesh Office Chair | 3 Year Warranty | Ergonomic Study | Computer Chair with Revolving Base | Tilting & Height Adjustable Mechanism | Heavy-Duty Metal Base (Black) (DIY),2899.0,INR,3.6,"1,664",office chair ergonomic budget,Electronics & Gadgets,scrape,2026-06-02T12:20:39.662853,False,https://www.amazon.in/dp/B0D2XZ6SZC,,https://www.amazon.in/dp/B0D2XZ6SZC,https://www.amazon.in/dp/B0D2XZ6SZC,https://www.amazon.in/s?k=office+chair+ergonomic+budget,budget pick,office chair ergonomic budget,"IAFA FURNITURE® Diego Mid-Back Mesh Office Chair | Office Chair Ergonomic Budget Price, Review And Deals","IAFA FURNITURE® Diego Mid-Back Mesh Office Chair is a budget pick for office chair ergonomic budget. Compare current price, rating, features and exact Amazon product link before you buy.",6,58.22,58.22,low,C,post,"low-rating, manual-link",0,heuristic,22:00-23:00,"[""Best Office Chair Ergonomic Budget Under Rs 2900 India"", ""IAFA FURNITURE® Diego Mid-Back Mesh Office Chair Review And Price"", ""Useful Amazon Find: IAFA FURNITURE® Diego Mid-Back Mesh Office Chair"", ""Office Chair Ergonomic Budget For Home And Daily Use"", ""Top Rated Office Chair Ergonomic Budget Worth Checking""]","[""IAFA FURNITURE® Diego Mid-Back Mesh Office Chair is a strong office chair ergonomic budget pick at around Rs. 2,899. Check the exact product page for latest specs, reviews and offers."", ""Looking for office chair ergonomic budget? IAFA FURNITURE® Diego Mid-Back Mesh Office Chair has useful everyday appeal and is worth comparing before you buy."", ""Save this office chair ergonomic budget idea for later. IAFA FURNITURE® Diego Mid-Back Mesh Office Chair may fit home, work or gifting needs depending on today's Amazon price.""]",IAFA FURNITURE® Diego Mid-Back Mesh Office Chair | Office Chair Ergonomic Budget,"IAFA FURNITURE® Diego Mid-Back Mesh Office Chair is today's budget pick for office chair ergonomic budget. Price: Rs. 2,899. Check the exact product page for specs, reviews and current offers. #officechairergonomicbudget #amazonfinds #dailyfinds #budgetshopping",https://www.amazon.in/dp/B0D2XZ6SZC,Budget Tech And Desk Setup,1000x1500px,IAFA FURNITURE® Diego Mid-Back Mesh Office Chair | 3 Year Warranty | Ergonomic Study | Computer Chair with Revolving Base | Tilting & Height Adjustable Mechanism | Heavy-Duty Metal Base (Black) (DIY) available on Amazon,https://m.media-amazon.com/images/I/71zC-swECpL._AC_UL320_.jpg
B0D4QJY239,"Noise Buds N1 Pro Truly Wireless Earbuds with Metallic Finish, ANC(Upto 30Db), 60H of Playtime, Dual Pairing, Instacharge(10 Min=200 Min), BT V5.3(Chrome Green)",1499.0,INR,3.8,,best wireless earbuds under budget,Electronics & Gadgets,scrape,2026-06-02T12:20:00.902292,False,https://www.amazon.in/dp/B0D4QJY239,,https://www.amazon.in/dp/B0D4QJY239,https://www.amazon.in/dp/B0D4QJY239,https://www.amazon.in/s?k=best+wireless+earbuds+under+budget,budget pick,best wireless earbuds under budget,"Noise Buds N1 Pro Truly Wireless Earbuds | Wireless Earbuds Under Budget Price, Review And Deals","Noise Buds N1 Pro Truly Wireless Earbuds is a budget pick for best wireless earbuds under budget. Compare current price, rating, features and exact Amazon product link before you buy.",28,55.68,55.68,high,C,post,"missing-image, manual-link",0,heuristic,22:00-23:00,"[""Best Best Wireless Earbuds Under Budget Under Rs 1500 India"", ""Noise Buds N1 Pro Truly Wireless Earbuds with Metallic Review And Price"", ""Useful Amazon Find: Noise Buds N1 Pro Truly Wireless Earbuds with Metallic"", ""Best Wireless Earbuds Under Budget For Home And Daily Use"", ""Top Rated Best Wireless Earbuds Under Budget Worth Checking""]","[""Noise Buds N1 Pro Truly Wireless Earbuds with Metallic Finish, ANC(Upto  is a strong best wireless earbuds under budget pick at around Rs. 1,499. Check the exact product page for latest specs, reviews and offers."", ""Looking for best wireless earbuds under budget? Noise Buds N1 Pro Truly Wireless Earbuds with Metallic Finish, ANC(Upto  has useful everyday appeal and is worth comparing before you buy."", ""Save this best wireless earbuds under budget idea for later. Noise Buds N1 Pro Truly Wireless Earbuds with Metallic Finish, ANC(Upto  may fit home, work or gifting needs depending on today's Amazon price.""]",Noise Buds N1 Pro Truly Wireless Earbuds | Wireless Earbuds Under Budget,"Noise Buds N1 Pro Truly Wireless Earbuds is today's budget pick for best wireless earbuds under budget. Price: Rs. 1,499. Check the exact product page for specs, reviews and current offers. #bestwirelessearbudsunderbudget #amazonfinds #dailyfinds #budgetshopping",https://www.amazon.in/dp/B0D4QJY239,Viral Amazon Finds,1000x1500px,"Noise Buds N1 Pro Truly Wireless Earbuds with Metallic Finish, ANC(Upto 30Db), 60H of Playtime, Dual Pairing, Instacharge(10 Min=200 Min), BT V5.3(Chrome Green) available on Amazon",
B0D4QNLF6Y,Check each product page for other buying options,1499.0,INR,3.8,,best wireless earbuds under budget,Electronics & Gadgets,scrape,2026-06-02T12:20:00.907151,False,https://www.amazon.in/dp/B0D4QNLF6Y,,https://www.amazon.in/dp/B0D4QNLF6Y,https://www.amazon.in/dp/B0D4QNLF6Y,https://www.amazon.in/s?k=best+wireless+earbuds+under+budget,budget pick,best wireless earbuds under budget,"Check each product page | Wireless Earbuds Under Budget Price, Review And Deals","Check each product page is a budget pick for best wireless earbuds under budget. Compare current price, rating, features and exact Amazon product link before you buy.",28,55.68,55.68,high,C,post,"missing-image, manual-link",0,heuristic,22:00-23:00,"[""Best Best Wireless Earbuds Under Budget Under Rs 1500 India"", ""Check each product page for other buying options Review And Price"", ""Useful Amazon Find: Check each product page for other buying options"", ""Best Wireless Earbuds Under Budget For Home And Daily Use"", ""Top Rated Best Wireless Earbuds Under Budget Worth Checking""]","[""Check each product page for other buying options is a strong best wireless earbuds under budget pick at around Rs. 1,499. Check the exact product page for latest specs, reviews and offers."", ""Looking for best wireless earbuds under budget? Check each product page for other buying options has useful everyday appeal and is worth comparing before you buy."", ""Save this best wireless earbuds under budget idea for later. Check each product page for other buying options may fit home, work or gifting needs depending on today's Amazon price.""]",Check each product page | Wireless Earbuds Under Budget,"Check each product page is today's budget pick for best wireless earbuds under budget. Price: Rs. 1,499. Check the exact product page for specs, reviews and current offers. #bestwirelessearbudsunderbudget #amazonfinds #dailyfinds #budgetshopping",https://www.amazon.in/dp/B0D4QNLF6Y,Viral Amazon Finds,1000x1500px,Check each product page for other buying options available on Amazon,
