asin,title,price,currency,rating,reviews,keyword,category,source,fetched_at,has_affiliate,product_url,affiliate_link,manual_link,sitestripe_url,search_url,trend_label,seo_keyword,google_title,google_description,trend_score,product_score,ai_score,buyer_intent,quality_grade,recommendation,risk_flags,hf_signal,hf_signal_source,best_posting_window,seo_title_variants,caption_variants,pin_title,pin_description,pin_link,pin_board,pin_image_size,pin_alt_text,image_url
B0DST37ZS3,"Rated 4.3 out of 5 stars from 14,629 reviews",,INR,4.3,,office chair ergonomic budget,Electronics & Gadgets,scrape,2026-06-02T12:20:39.656436,False,https://www.amazon.in/dp/B0DST37ZS3,,https://www.amazon.in/dp/B0DST37ZS3,https://www.amazon.in/dp/B0DST37ZS3,https://www.amazon.in/s?k=office+chair+ergonomic+budget,budget pick,office chair ergonomic budget,"Rated 4.3 out of 5 stars from 14,629 reviews | Office Chair Ergonomic Budget Price, Review And Deals","Rated 4.3 out of 5 stars from 14,629 reviews is a budget pick for office chair ergonomic budget. Compare current price, rating, features and exact Amazon product link before you buy.",6,34.61,34.61,medium,D,review,"missing-image, manual-link",0,heuristic,22:00-23:00,"[""Best Office Chair Ergonomic Budget India"", ""Rated 4.3 out of 5 stars from 14,629 reviews Review And Price"", ""Useful Amazon Find: Rated 4.3 out of 5 stars from 14,629 reviews"", ""Office Chair Ergonomic Budget For Home And Daily Use"", ""Top Rated Office Chair Ergonomic Budget Worth Checking""]","[""Rated 4.3 out of 5 stars from 14,629 reviews is a strong office chair ergonomic budget pick at with current Amazon pricing. Check the exact product page for latest specs, reviews and offers."", ""Looking for office chair ergonomic budget? Rated 4.3 out of 5 stars from 14,629 reviews has useful everyday appeal and is worth comparing before you buy."", ""Save this office chair ergonomic budget idea for later. Rated 4.3 out of 5 stars from 14,629 reviews may fit home, work or gifting needs depending on today's Amazon price.""]","Rated 4.3 out of 5 stars from 14,629 reviews | Office Chair Ergonomic Budget","Rated 4.3 out of 5 stars from 14,629 reviews is today's budget pick for office chair ergonomic budget. Price: check listing. Check the exact product page for specs, reviews and current offers. #officechairergonomicbudget #amazonfinds #dailyfinds #budgetshopping",https://www.amazon.in/dp/B0DST37ZS3,Budget Tech And Desk Setup,1000x1500px,"Rated 4.3 out of 5 stars from 14,629 reviews available on Amazon",
B0CG13FJ5M,"ZEBRONICS PHERO Wired Gaming Mouse with up to 2400 DPI, Rainbow LED Lights, DPI Switch, High Precision, Plug & Play, 4 Buttons",184.0,INR,4.0,7963,gaming accessories budget,Electronics & Gadgets,scrape,20260601124031.895,False,https://www.amazon.in/dp/B0CG13FJ5M,,https://www.amazon.in/dp/B0CG13FJ5M,https://www.amazon.in/dp/B0CG13FJ5M,https://www.amazon.in/s?k=gaming+accessories+budget,budget pick,gaming accessories budget,"ZEBRONICS PHERO Wired Gaming Mouse | Gaming Accessories Budget Price, Review And Deals","ZEBRONICS PHERO Wired Gaming Mouse is a budget pick for gaming accessories budget. Compare current price, rating, features and exact Amazon product link before you buy.",3,61.4,61.4,low,C,post,manual-link,0,heuristic,22:00-23:00,"[""Best Gaming Accessories Budget India"", ""ZEBRONICS PHERO Wired Gaming Mouse with up to 2400 DPI Review And Price"", ""Useful Amazon Find: ZEBRONICS PHERO Wired Gaming Mouse with up to 2400 DPI"", ""Gaming Accessories Budget For Home And Daily Use"", ""Top Rated Gaming Accessories Budget Worth Checking""]","[""ZEBRONICS PHERO Wired Gaming Mouse with up to 2400 DPI, Rainbow LED Ligh is a strong gaming accessories budget pick at around Rs. 184. Check the exact product page for latest specs, reviews and offers."", ""Looking for gaming accessories budget? ZEBRONICS PHERO Wired Gaming Mouse with up to 2400 DPI, Rainbow LED Ligh has useful everyday appeal and is worth comparing before you buy."", ""Save this gaming accessories budget idea for later. ZEBRONICS PHERO Wired Gaming Mouse with up to 2400 DPI, Rainbow LED Ligh may fit home, work or gifting needs depending on today's Amazon price.""]",ZEBRONICS PHERO Wired Gaming Mouse | Gaming Accessories Budget,"ZEBRONICS PHERO Wired Gaming Mouse is today's budget pick for gaming accessories budget. Price: Rs. 184. Check the exact product page for specs, reviews and current offers. #gamingaccessoriesbudget #amazonfinds #dailyfinds #budgetshopping",https://www.amazon.in/dp/B0CG13FJ5M,Budget Tech And Desk Setup,10001500,"ZEBRONICS PHERO Wired Gaming Mouse with up to 2400 DPI, Rainbow LED Lights, DPI Switch, High Precision, Plug & Play, 4 Buttons available on Amazon",https://m.media-amazon.com/images/I/71PfyTreJIL._AC_UY218_.jpg
B0FFB3XDFL,"M27 Wired USB Optical Gaming Mouse, 1000 DPI Precision | Ergonomic Gaming Design with LED Light, 3 Buttons, Plug & Play, 1.1m Cable, Lightweight USB mouse for PC, Laptop, Mac & Windows (Black)",149.0,INR,4.0,171,gaming accessories budget,Electronics & Gadgets,scrape,20260601124031.895,False,https://www.amazon.in/dp/B0FFB3XDFL,,https://www.amazon.in/dp/B0FFB3XDFL,https://www.amazon.in/dp/B0FFB3XDFL,https://www.amazon.in/s?k=gaming+accessories+budget,budget pick,gaming accessories budget,"M27 Wired USB Optical Gaming Mouse, 1000 DPI Precision | Gaming Accessories Budget Price, Review And Deals","M27 Wired USB Optical Gaming Mouse, 1000 DPI Precision is a budget pick for gaming accessories budget. Compare current price, rating, features and exact Amazon product link before you buy.",3,46.17,46.17,low,D,review,manual-link,0,heuristic,22:00-23:00,"[""Best Gaming Accessories Budget India"", ""M27 Wired USB Optical Gaming Mouse, 1000 DPI Precision Review And Price"", ""Useful Amazon Find: M27 Wired USB Optical Gaming Mouse, 1000 DPI Precision"", ""Gaming Accessories Budget For Home And Daily Use"", ""Top Rated Gaming Accessories Budget Worth Checking""]","[""M27 Wired USB Optical Gaming Mouse, 1000 DPI Precision is a strong gaming accessories budget pick at around Rs. 149. Check the exact product page for latest specs, reviews and offers."", ""Looking for gaming accessories budget? M27 Wired USB Optical Gaming Mouse, 1000 DPI Precision has useful everyday appeal and is worth comparing before you buy."", ""Save this gaming accessories budget idea for later. M27 Wired USB Optical Gaming Mouse, 1000 DPI Precision may fit home, work or gifting needs depending on today's Amazon price.""]","M27 Wired USB Optical Gaming Mouse, 1000 DPI Precision | Gaming Accessories Budget","M27 Wired USB Optical Gaming Mouse, 1000 DPI Precision is today's budget pick for gaming accessories budget. Price: Rs. 149. Check the exact product page for specs, reviews and current offers. #gamingaccessoriesbudget #amazonfinds #dailyfinds #budgetshopping",https://www.amazon.in/dp/B0FFB3XDFL,Budget Tech And Desk Setup,10001500,"M27 Wired USB Optical Gaming Mouse, 1000 DPI Precision | Ergonomic Gaming Design with LED Light, 3 Buttons, Plug & Play, 1.1m Cable, Lightweight USB mouse for PC, Laptop, Mac & Windows (Black) available on Amazon",https://m.media-amazon.com/images/I/71uO4QpdrtL._AC_UY218_.jpg
B08NXFC6YV,DailyObjects Turf 2.0 Desk Mat | Super Smooth Felt for Gaming Home and Office | Vegan Leather | Work from Home Solution for Laptop Keyboard and Mouse | Reversible Anti Slip Water Resistant - Green,1498.0,INR,4.5,,gaming accessories budget,Electronics & Gadgets,scrape,20260601124031.887,False,https://www.amazon.in/dp/B08NXFC6YV,,https://www.amazon.in/dp/B08NXFC6YV,https://www.amazon.in/dp/B08NXFC6YV,https://www.amazon.in/s?k=gaming+accessories+budget,budget pick,gaming accessories budget,"DailyObjects Turf 2.0 Desk Mat | Gaming Accessories Budget Price, Review And Deals","DailyObjects Turf 2.0 Desk Mat is a budget pick for gaming accessories budget. Compare current price, rating, features and exact Amazon product link before you buy.",3,42.84,42.84,medium,D,review,"missing-image, manual-link",0,heuristic,12:00-13:30,"[""Best Gaming Accessories Budget Under Rs 1500 India"", ""DailyObjects Turf 2.0 Desk Mat Review And Price"", ""Useful Amazon Find: DailyObjects Turf 2.0 Desk Mat"", ""Gaming Accessories Budget For Home And Daily Use"", ""Top Rated Gaming Accessories Budget Worth Checking""]","[""DailyObjects Turf 2.0 Desk Mat is a strong gaming accessories budget pick at around Rs. 1,498. Check the exact product page for latest specs, reviews and offers."", ""Looking for gaming accessories budget? DailyObjects Turf 2.0 Desk Mat has useful everyday appeal and is worth comparing before you buy."", ""Save this gaming accessories budget idea for later. DailyObjects Turf 2.0 Desk Mat may fit home, work or gifting needs depending on today's Amazon price.""]",DailyObjects Turf 2.0 Desk Mat | Gaming Accessories Budget,"DailyObjects Turf 2.0 Desk Mat is today's budget pick for gaming accessories budget. Price: Rs. 1,498. Check the exact product page for specs, reviews and current offers. #gamingaccessoriesbudget #amazonfinds #dailyfinds #budgetshopping",https://www.amazon.in/dp/B08NXFC6YV,Budget Tech And Desk Setup,10001500,DailyObjects Turf 2.0 Desk Mat | Super Smooth Felt for Gaming Home and Office | Vegan Leather | Work from Home Solution for Laptop Keyboard and Mouse | Reversible Anti Slip Water Resistant - Green available on Amazon,
B08DNVDF52,Check each product page for other buying options,399.0,INR,4.4,,gaming accessories budget,Electronics & Gadgets,scrape,20260601124031.895,False,https://www.amazon.in/dp/B08DNVDF52,,https://www.amazon.in/dp/B08DNVDF52,https://www.amazon.in/dp/B08DNVDF52,https://www.amazon.in/s?k=gaming+accessories+budget,budget pick,gaming accessories budget,"Check each product page | Gaming Accessories Budget Price, Review And Deals","Check each product page is a budget pick for gaming accessories budget. Compare current price, rating, features and exact Amazon product link before you buy.",3,40.01,40.01,low,D,review,"missing-image, manual-link",0,heuristic,22:00-23:00,"[""Best Gaming Accessories Budget Under Rs 400 India"", ""Check each product page for other buying options Review And Price"", ""Useful Amazon Find: Check each product page for other buying options"", ""Gaming Accessories Budget For Home And Daily Use"", ""Top Rated Gaming Accessories Budget Worth Checking""]","[""Check each product page for other buying options is a strong gaming accessories budget pick at around Rs. 399. Check the exact product page for latest specs, reviews and offers."", ""Looking for gaming accessories budget? Check each product page for other buying options has useful everyday appeal and is worth comparing before you buy."", ""Save this gaming accessories budget idea for later. Check each product page for other buying options may fit home, work or gifting needs depending on today's Amazon price.""]",Check each product page | Gaming Accessories Budget,"Check each product page is today's budget pick for gaming accessories budget. Price: Rs. 399. Check the exact product page for specs, reviews and current offers. #gamingaccessoriesbudget #amazonfinds #dailyfinds #budgetshopping",https://www.amazon.in/dp/B08DNVDF52,Budget Tech And Desk Setup,10001500,Check each product page for other buying options available on Amazon,
B07SRM58TP,"AGARO Regal 800 Watts Handheld Vacuum Cleaner, for Home Use, Dry Vacuuming, 6.5 kPa Suction Power, Lightweight, Lightweight & Durable Body, Small/Mini Size (Black)",1665.0,INR,4.1,19670,vacuum cleaner home budget,Electronics & Gadgets,scrape,20260531115754.1,False,https://www.amazon.in/dp/B07SRM58TP,,https://www.amazon.in/dp/B07SRM58TP,https://www.amazon.in/dp/B07SRM58TP,https://www.amazon.in/s?k=vacuum+cleaner+home+budget,budget pick,vacuum cleaner home budget,"AGARO Regal 800 Watts Handheld Vacuum Cleaner | Vacuum Cleaner Home Budget Price, Review And Deals","AGARO Regal 800 Watts Handheld Vacuum Cleaner is a budget pick for vacuum cleaner home budget. Compare current price, rating, features and exact Amazon product link before you buy.",5,72.14,72.14,medium,B,post,manual-link,0,heuristic,12:00-13:30,"[""Best Vacuum Cleaner Home Budget Under Rs 1700 India"", ""AGARO Regal 800 Watts Handheld Vacuum Cleaner, for Hom Review And Price"", ""Useful Amazon Find: AGARO Regal 800 Watts Handheld Vacuum Cleaner, for Hom"", ""Vacuum Cleaner Home Budget For Home And Daily Use"", ""Top Rated Vacuum Cleaner Home Budget Worth Checking""]","[""AGARO Regal 800 Watts Handheld Vacuum Cleaner, for Home Use, Dry Vacuumi is a strong vacuum cleaner home budget pick at around Rs. 1,665. Check the exact product page for latest specs, reviews and offers."", ""Looking for vacuum cleaner home budget? AGARO Regal 800 Watts Handheld Vacuum Cleaner, for Home Use, Dry Vacuumi has useful everyday appeal and is worth comparing before you buy."", ""Save this vacuum cleaner home budget idea for later. AGARO Regal 800 Watts Handheld Vacuum Cleaner, for Home Use, Dry Vacuumi may fit home, work or gifting needs depending on today's Amazon price.""]",AGARO Regal 800 Watts Handheld Vacuum Cleaner | Vacuum Cleaner Home Budget,"AGARO Regal 800 Watts Handheld Vacuum Cleaner is today's budget pick for vacuum cleaner home budget. Price: Rs. 1,665. Check the exact product page for specs, reviews and current offers. #vacuumcleanerhomebudget #amazonfinds #dailyfinds #budgetshopping",https://www.amazon.in/dp/B07SRM58TP,Trending Home Finds,10001500,"AGARO Regal 800 Watts Handheld Vacuum Cleaner, for Home Use, Dry Vacuuming, 6.5 kPa Suction Power, Lightweight, Lightweight & Durable Body, Small/Mini Size (Black) available on Amazon",https://m.media-amazon.com/images/I/61R+7C3ID9L._AC_UY218_.jpg
B08WXPJKWY,"AGARO Regal Plus Upright Vacuum Cleaner, 2-in-1, Handheld & Stick, Dry Vacuuming, for Home Use, 800 Watts, 6.5 kPa Suction Power, Bagless, Black",2155.0,INR,3.9,7951,vacuum cleaner home budget,Electronics & Gadgets,scrape,20260531115754.1,False,https://www.amazon.in/dp/B08WXPJKWY,,https://www.amazon.in/dp/B08WXPJKWY,https://www.amazon.in/dp/B08WXPJKWY,https://www.amazon.in/s?k=vacuum+cleaner+home+budget,budget pick,vacuum cleaner home budget,"AGARO Regal Plus Upright Vacuum Cleaner, 2-in-1, Handheld & Stic | Vacuum Cleaner Home Budget Price, Review And Deals","AGARO Regal Plus Upright Vacuum Cleaner, 2-in-1, Handheld & Stic is a budget pick for vacuum cleaner home budget. Compare current price, rating, features and exact Amazon product link before you buy.",5,71.07,71.07,medium,B,post,manual-link,0,heuristic,12:00-13:30,"[""Best Vacuum Cleaner Home Budget Under Rs 2200 India"", ""AGARO Regal Plus Upright Vacuum Cleaner, 2-in-1, Handh Review And Price"", ""Useful Amazon Find: AGARO Regal Plus Upright Vacuum Cleaner, 2-in-1, Handh"", ""Vacuum Cleaner Home Budget For Home And Daily Use"", ""Top Rated Vacuum Cleaner Home Budget Worth Checking""]","[""AGARO Regal Plus Upright Vacuum Cleaner, 2-in-1, Handheld & Stick, Dry V is a strong vacuum cleaner home budget pick at around Rs. 2,155. Check the exact product page for latest specs, reviews and offers."", ""Looking for vacuum cleaner home budget? AGARO Regal Plus Upright Vacuum Cleaner, 2-in-1, Handheld & Stick, Dry V has useful everyday appeal and is worth comparing before you buy."", ""Save this vacuum cleaner home budget idea for later. AGARO Regal Plus Upright Vacuum Cleaner, 2-in-1, Handheld & Stick, Dry V may fit home, work or gifting needs depending on today's Amazon price.""]","AGARO Regal Plus Upright Vacuum Cleaner, 2-in-1, Handheld & Stic | Vacuum Cleaner Home Budget","AGARO Regal Plus Upright Vacuum Cleaner, 2-in-1, Handheld & Stic is today's budget pick for vacuum cleaner home budget. Price: Rs. 2,155. Check the exact product page for specs, reviews and current offers. #vacuumcleanerhomebudget #amazonfinds #dailyfinds #budgetshopping",https://www.amazon.in/dp/B08WXPJKWY,Trending Home Finds,10001500,"AGARO Regal Plus Upright Vacuum Cleaner, 2-in-1, Handheld & Stick, Dry Vacuuming, for Home Use, 800 Watts, 6.5 kPa Suction Power, Bagless, Black available on Amazon",https://m.media-amazon.com/images/I/61NgB98ez7L._AC_UY218_.jpg
B07RCGTZ4M,"AGARO Ace Wet & Dry Vacuum Cleaner for Home, 1600 Watts, 21.5 kPa Suction Power, 21 litres Tank Capacity, for Home Use, Blower Function, Washable 3L Dust Bag, Stainless Steel Body (Black, Red, Steel)",6699.0,INR,4.3,6563,vacuum cleaner home budget,Electronics & Gadgets,scrape,20260531115754.1,False,https://www.amazon.in/dp/B07RCGTZ4M,,https://www.amazon.in/dp/B07RCGTZ4M,https://www.amazon.in/dp/B07RCGTZ4M,https://www.amazon.in/s?k=vacuum+cleaner+home+budget,budget pick,vacuum cleaner home budget,"AGARO Ace Wet & Dry Vacuum Cleaner | Vacuum Cleaner Home Budget Price, Review And Deals","AGARO Ace Wet & Dry Vacuum Cleaner is a budget pick for vacuum cleaner home budget. Compare current price, rating, features and exact Amazon product link before you buy.",5,68.9,68.9,medium,B,post,manual-link,0,heuristic,12:00-13:30,"[""Best Vacuum Cleaner Home Budget Under Rs 6700 India"", ""AGARO Ace Wet & Dry Vacuum Cleaner for Home, 1600 Watt Review And Price"", ""Useful Amazon Find: AGARO Ace Wet & Dry Vacuum Cleaner for Home, 1600 Watt"", ""Vacuum Cleaner Home Budget For Home And Daily Use"", ""Top Rated Vacuum Cleaner Home Budget Worth Checking""]","[""AGARO Ace Wet & Dry Vacuum Cleaner for Home, 1600 Watts, 21.5 kPa Suctio is a strong vacuum cleaner home budget pick at around Rs. 6,699. Check the exact product page for latest specs, reviews and offers."", ""Looking for vacuum cleaner home budget? AGARO Ace Wet & Dry Vacuum Cleaner for Home, 1600 Watts, 21.5 kPa Suctio has useful everyday appeal and is worth comparing before you buy."", ""Save this vacuum cleaner home budget idea for later. AGARO Ace Wet & Dry Vacuum Cleaner for Home, 1600 Watts, 21.5 kPa Suctio may fit home, work or gifting needs depending on today's Amazon price.""]",AGARO Ace Wet & Dry Vacuum Cleaner | Vacuum Cleaner Home Budget,"AGARO Ace Wet & Dry Vacuum Cleaner is today's budget pick for vacuum cleaner home budget. Price: Rs. 6,699. Check the exact product page for specs, reviews and current offers. #vacuumcleanerhomebudget #amazonfinds #dailyfinds #budgetshopping",https://www.amazon.in/dp/B07RCGTZ4M,Trending Home Finds,10001500,"AGARO Ace Wet & Dry Vacuum Cleaner for Home, 1600 Watts, 21.5 kPa Suction Power, 21 litres Tank Capacity, for Home Use, Blower Function, Washable 3L Dust Bag, Stainless Steel Body (Black, Red, Steel) available on Amazon",https://m.media-amazon.com/images/I/61B8-nfHqlL._AC_UY218_.jpg
B0FS1VB862,"ShineXPro Microfiber Cleaning Cloth Roll, 20Pcs, 4000 Times Washable - 10X Cheaper Than Paper Kitchen Towel Roll - Ultra Absorbent Lint Free Microfiber Cleaning Cloth for Kitchen - Tearable, Reusable",299.0,INR,4.5,883,home organization products,Electronics & Gadgets,scrape,20260531115754.1,False,https://www.amazon.in/dp/B0FS1VB862,,https://www.amazon.in/dp/B0FS1VB862,https://www.amazon.in/dp/B0FS1VB862,https://www.amazon.in/s?k=home+organization+products,daily trend,home organization products,"ShineXPro Microfiber Cleaning Cloth Roll, 20Pcs, 4000 Times Wash | Home Organization Products Price, Review And Deals","ShineXPro Microfiber Cleaning Cloth Roll, 20Pcs, 4000 Times Wash is a daily trend for home organization products. Compare current price, rating, features and exact Amazon product link before you buy.",21,67.74,67.74,low,B,post,manual-link,0,heuristic,12:00-13:30,"[""Best Home Organization Products Under Rs 300 India"", ""ShineXPro Microfiber Cleaning Cloth Roll, 20Pcs, 4000 Review And Price"", ""Useful Amazon Find: ShineXPro Microfiber Cleaning Cloth Roll, 20Pcs, 4000"", ""Home Organization Products For Home And Daily Use"", ""Top Rated Home Organization Products Worth Checking""]","[""ShineXPro Microfiber Cleaning Cloth Roll, 20Pcs, 4000 Times Washable is a strong home organization products pick at around Rs. 299. Check the exact product page for latest specs, reviews and offers."", ""Looking for home organization products? ShineXPro Microfiber Cleaning Cloth Roll, 20Pcs, 4000 Times Washable has useful everyday appeal and is worth comparing before you buy."", ""Save this home organization products idea for later. ShineXPro Microfiber Cleaning Cloth Roll, 20Pcs, 4000 Times Washable may fit home, work or gifting needs depending on today's Amazon price.""]","ShineXPro Microfiber Cleaning Cloth Roll, 20Pcs, 4000 Times Wash | Home Organization Products","ShineXPro Microfiber Cleaning Cloth Roll, 20Pcs, 4000 Times Wash is today's daily trend for home organization products. Price: Rs. 299. Check the exact product page for specs, reviews and current offers. #homeorganizationproducts #amazonfinds #dailyfinds #budgetshopping",https://www.amazon.in/dp/B0FS1VB862,Trending Home Finds,10001500,"ShineXPro Microfiber Cleaning Cloth Roll, 20Pcs, 4000 Times Washable - 10X Cheaper Than Paper Kitchen Towel Roll - Ultra Absorbent Lint Free Microfiber Cleaning Cloth for Kitchen - Tearable, Reusable available on Amazon",https://m.media-amazon.com/images/I/81zwlei7RyL._AC_UL320_.jpg
B0BQMJZZNM,"LIRAMARK Mobile Phone Charging Stand, Storage Holder, Bedside Fixed Rack, Home Organization and Storage Supplies, Bedroom Accessories, Office Accessories, Bathroom Accessories (Pack of 1)",119.0,INR,4.0,3756,home organization products,Electronics & Gadgets,scrape,20260531115754.1,False,https://www.amazon.in/dp/B0BQMJZZNM,,https://www.amazon.in/dp/B0BQMJZZNM,https://www.amazon.in/dp/B0BQMJZZNM,https://www.amazon.in/s?k=home+organization+products,daily trend,home organization products,"LIRAMARK Mobile Phone Charging Stand, Storage Holder, Bedside Fi | Home Organization Products Price, Review And Deals","LIRAMARK Mobile Phone Charging Stand, Storage Holder, Bedside Fi is a daily trend for home organization products. Compare current price, rating, features and exact Amazon product link before you buy.",21,65.15,65.15,low,B,post,manual-link,0,heuristic,12:00-13:30,"[""Best Home Organization Products India"", ""LIRAMARK Mobile Phone Charging Stand, Storage Holder Review And Price"", ""Useful Amazon Find: LIRAMARK Mobile Phone Charging Stand, Storage Holder"", ""Home Organization Products For Home And Daily Use"", ""Top Rated Home Organization Products Worth Checking""]","[""LIRAMARK Mobile Phone Charging Stand, Storage Holder, Bedside Fixed Rack is a strong home organization products pick at around Rs. 119. Check the exact product page for latest specs, reviews and offers."", ""Looking for home organization products? LIRAMARK Mobile Phone Charging Stand, Storage Holder, Bedside Fixed Rack has useful everyday appeal and is worth comparing before you buy."", ""Save this home organization products idea for later. LIRAMARK Mobile Phone Charging Stand, Storage Holder, Bedside Fixed Rack may fit home, work or gifting needs depending on today's Amazon price.""]","LIRAMARK Mobile Phone Charging Stand, Storage Holder, Bedside Fi | Home Organization Products","LIRAMARK Mobile Phone Charging Stand, Storage Holder, Bedside Fi is today's daily trend for home organization products. Price: Rs. 119. Check the exact product page for specs, reviews and current offers. #homeorganizationproducts #amazonfinds #dailyfinds #budgetshopping",https://www.amazon.in/dp/B0BQMJZZNM,Trending Home Finds,10001500,"LIRAMARK Mobile Phone Charging Stand, Storage Holder, Bedside Fixed Rack, Home Organization and Storage Supplies, Bedroom Accessories, Office Accessories, Bathroom Accessories (Pack of 1) available on Amazon",https://m.media-amazon.com/images/I/61mJSikurML._AC_UL320_.jpg
