asin,title,price,currency,rating,reviews,keyword,category,source,fetched_at,has_affiliate,product_url,affiliate_link,manual_link,sitestripe_url,search_url,trend_label,seo_keyword,google_title,google_description,trend_score,product_score,ai_score,conversion_score,buyer_intent,quality_grade,recommendation,ai_action,risk_flags,hf_signal,hf_signal_source,hf_category,hf_category_score,hf_image_label,hf_image_score,duplicate_cluster,best_posting_window,seo_title_variants,caption_variants,pin_title,pin_description,pin_link,pin_board,pin_image_size,pin_alt_text,image_url
B0G2CD7GV2,"Portable Mini Projector, 4K 1080P Full HD Projector, Support Video Projector, WiFi 5G BT 5.0, Cinema Projector 180° Can Be Rotated, Android 11, Compatible with TV Stick/Windows/iOS/Android for Kids and Adults",2999.0,INR,3.1,7,mini projector budget,Electronics & Gadgets,scrape,20260617125239.484,False,https://www.amazon.in/dp/B0G2CD7GV2,,https://www.amazon.in/dp/B0G2CD7GV2,https://www.amazon.in/dp/B0G2CD7GV2,https://www.amazon.in/s?k=mini+projector+budget,budget pick,mini projector budget,"Portable Mini Projector, 4K 1080P Full HD Projector, Support Vid | Mini Projector Budget Price, Review And Deals","Portable Mini Projector, 4K 1080P Full HD Projector, Support Vid is a budget pick for mini projector budget. Compare current price, rating, features and exact Amazon product link before you buy.",11,51.09,51.09,55.46,low,C,review,improve,"low-rating, low-review-proof, manual-link",0,heuristic,heuristic,0.0,heuristic,0.0,3a16b4e27dad,22:00-23:00,"[""Best Mini Projector Budget Under Rs 3000 India"", ""Portable Mini Projector, 4K 1080P Full HD Projector, S Review And Price"", ""Useful Amazon Find: Portable Mini Projector, 4K 1080P Full HD Projector, S"", ""Mini Projector Budget For Home And Daily Use"", ""Top Rated Mini Projector Budget Worth Checking""]","[""Portable Mini Projector, 4K 1080P Full HD Projector, Support Video Proje is a strong mini projector budget pick at around Rs. 2,999. Check the exact product page for latest specs, reviews and offers."", ""Looking for mini projector budget? Portable Mini Projector, 4K 1080P Full HD Projector, Support Video Proje has useful everyday appeal and is worth comparing before you buy."", ""Save this mini projector budget idea for later. Portable Mini Projector, 4K 1080P Full HD Projector, Support Video Proje may fit home, work or gifting needs depending on today's Amazon price.""]","Portable Mini Projector, 4K 1080P Full HD Projector, Support Vid | Mini Projector Budget","Portable Mini Projector, 4K 1080P Full HD Projector, Support Vid is today's budget pick for mini projector budget. Price: Rs. 2,999. Check the exact product page for specs, reviews and current offers. #miniprojectorbudget #amazonfinds #dailyfinds #budgetshopping",https://www.amazon.in/dp/B0G2CD7GV2,Viral Amazon Finds,10001500,"Portable Mini Projector, 4K 1080P Full HD Projector, Support Video Projector, WiFi 5G BT 5.0, Cinema Projector 180° Can Be Rotated, Android 11, Compatible with TV Stick/Windows/iOS/Android for Kids and Adults available on Amazon",https://m.media-amazon.com/images/I/61UJVdbAsbL._AC_UY218_.jpg
B0D5HP4X5C,"YG300 400LM Portable Mini Home Theater LED Projector with Remote Controller, Support HDMI, AV, SD, USB Interfaces (Yellow) HD 1.8",1699.0,INR,,,mini projector budget,Electronics & Gadgets,scrape,20260617125239.484,False,https://www.amazon.in/dp/B0D5HP4X5C,,https://www.amazon.in/dp/B0D5HP4X5C,https://www.amazon.in/dp/B0D5HP4X5C,https://www.amazon.in/s?k=mini+projector+budget,budget pick,mini projector budget,"YG300 400LM Portable Mini Home Theater LED Projector | Mini Projector Budget Price, Review And Deals","YG300 400LM Portable Mini Home Theater LED Projector is a budget pick for mini projector budget. Compare current price, rating, features and exact Amazon product link before you buy.",11,38.99,38.99,51.69,medium,D,review,improve,manual-link,0,heuristic,heuristic,0.0,heuristic,0.0,dbfc0b8c9aba,12:00-13:30,"[""Best Mini Projector Budget Under Rs 1700 India"", ""YG300 400LM Portable Mini Home Theater LED Projector w Review And Price"", ""Useful Amazon Find: YG300 400LM Portable Mini Home Theater LED Projector w"", ""Mini Projector Budget For Home And Daily Use"", ""Top Rated Mini Projector Budget Worth Checking""]","[""YG300 400LM Portable Mini Home Theater LED Projector with Remote Control is a strong mini projector budget pick at around Rs. 1,699. Check the exact product page for latest specs, reviews and offers."", ""Looking for mini projector budget? YG300 400LM Portable Mini Home Theater LED Projector with Remote Control has useful everyday appeal and is worth comparing before you buy."", ""Save this mini projector budget idea for later. YG300 400LM Portable Mini Home Theater LED Projector with Remote Control may fit home, work or gifting needs depending on today's Amazon price.""]",YG300 400LM Portable Mini Home Theater LED Projector | Mini Projector Budget,"YG300 400LM Portable Mini Home Theater LED Projector is today's budget pick for mini projector budget. Price: Rs. 1,699. Check the exact product page for specs, reviews and current offers. #miniprojectorbudget #amazonfinds #dailyfinds #budgetshopping",https://www.amazon.in/dp/B0D5HP4X5C,Viral Amazon Finds,10001500,"YG300 400LM Portable Mini Home Theater LED Projector with Remote Controller, Support HDMI, AV, SD, USB Interfaces (Yellow) HD 1.8 available on Amazon",https://m.media-amazon.com/images/I/51zDVWLiekS._AC_UY218_.jpg
B00BMP97OC,Bajaj 500 Watt GX-1 Mixer Grinder with 3 Jars- white,2199.0,INR,4.0,22056,mixer grinder best seller,Electronics & Gadgets,scrape,20260617125239.484,False,https://www.amazon.in/dp/B00BMP97OC,,https://www.amazon.in/dp/B00BMP97OC,https://www.amazon.in/dp/B00BMP97OC,https://www.amazon.in/s?k=mixer+grinder+best+seller,best seller,mixer grinder best seller,"Bajaj 500 Watt GX-1 Mixer Grinder | Mixer Grinder Best Seller Price, Review And Deals","Bajaj 500 Watt GX-1 Mixer Grinder is a best seller for mixer grinder best seller. Compare current price, rating, features and exact Amazon product link before you buy.",9,74.45,74.45,74.56,medium,B,post,post,manual-link,0,heuristic,heuristic,0.0,heuristic,0.0,ffb82b52647c,07:30-09:00,"[""Best Mixer Grinder Best Seller Under Rs 2200 India"", ""Bajaj 500 Watt GX-1 Mixer Grinder with 3 Jars- white Review And Price"", ""Useful Amazon Find: Bajaj 500 Watt GX-1 Mixer Grinder with 3 Jars- white"", ""Mixer Grinder Best Seller For Home And Daily Use"", ""Top Rated Mixer Grinder Best Seller Worth Checking""]","[""Bajaj 500 Watt GX-1 Mixer Grinder with 3 Jars- white is a strong mixer grinder best seller pick at around Rs. 2,199. Check the exact product page for latest specs, reviews and offers."", ""Looking for mixer grinder best seller? Bajaj 500 Watt GX-1 Mixer Grinder with 3 Jars- white has useful everyday appeal and is worth comparing before you buy."", ""Save this mixer grinder best seller idea for later. Bajaj 500 Watt GX-1 Mixer Grinder with 3 Jars- white may fit home, work or gifting needs depending on today's Amazon price.""]",Bajaj 500 Watt GX-1 Mixer Grinder | Mixer Grinder Best Seller,"Bajaj 500 Watt GX-1 Mixer Grinder is today's best seller for mixer grinder best seller. Price: Rs. 2,199. Check the exact product page for specs, reviews and current offers. #mixergrinderbestseller #amazonfinds #dailyfinds #budgetshopping",https://www.amazon.in/dp/B00BMP97OC,Trending Home Finds,10001500,Bajaj 500 Watt GX-1 Mixer Grinder with 3 Jars- white available on Amazon,https://m.media-amazon.com/images/I/51RDpv5updL._AC_UY218_.jpg
B09X5C9VLK,"Lifelong LLMG23 Power Pro 500-Watt Mixer Grinder with 3 Jars (Liquidizing, Wet Grinding and Chutney Jar), Stainless Steel blades, 1 Year Warranty (Black)",1399.0,INR,3.9,51316,mixer grinder best seller,Electronics & Gadgets,scrape,20260617125239.484,False,https://www.amazon.in/dp/B09X5C9VLK,,https://www.amazon.in/dp/B09X5C9VLK,https://www.amazon.in/dp/B09X5C9VLK,https://www.amazon.in/s?k=mixer+grinder+best+seller,best seller,mixer grinder best seller,"Lifelong LLMG23 Power Pro 500-Watt Mixer Grinder | Mixer Grinder Best Seller Price, Review And Deals","Lifelong LLMG23 Power Pro 500-Watt Mixer Grinder is a best seller for mixer grinder best seller. Compare current price, rating, features and exact Amazon product link before you buy.",9,74.0,74.0,74.28,medium,B,post,post,manual-link,0,heuristic,heuristic,0.0,heuristic,0.0,d68a44414e18,07:30-09:00,"[""Best Mixer Grinder Best Seller Under Rs 1400 India"", ""Lifelong LLMG23 Power Pro 500-Watt Mixer Grinder with Review And Price"", ""Useful Amazon Find: Lifelong LLMG23 Power Pro 500-Watt Mixer Grinder with"", ""Mixer Grinder Best Seller For Home And Daily Use"", ""Top Rated Mixer Grinder Best Seller Worth Checking""]","[""Lifelong LLMG23 Power Pro 500-Watt Mixer Grinder with 3 Jars is a strong mixer grinder best seller pick at around Rs. 1,399. Check the exact product page for latest specs, reviews and offers."", ""Looking for mixer grinder best seller? Lifelong LLMG23 Power Pro 500-Watt Mixer Grinder with 3 Jars has useful everyday appeal and is worth comparing before you buy."", ""Save this mixer grinder best seller idea for later. Lifelong LLMG23 Power Pro 500-Watt Mixer Grinder with 3 Jars may fit home, work or gifting needs depending on today's Amazon price.""]",Lifelong LLMG23 Power Pro 500-Watt Mixer Grinder | Mixer Grinder Best Seller,"Lifelong LLMG23 Power Pro 500-Watt Mixer Grinder is today's best seller for mixer grinder best seller. Price: Rs. 1,399. Check the exact product page for specs, reviews and current offers. #mixergrinderbestseller #amazonfinds #dailyfinds #budgetshopping",https://www.amazon.in/dp/B09X5C9VLK,Trending Home Finds,10001500,"Lifelong LLMG23 Power Pro 500-Watt Mixer Grinder with 3 Jars (Liquidizing, Wet Grinding and Chutney Jar), Stainless Steel blades, 1 Year Warranty (Black) available on Amazon",https://m.media-amazon.com/images/I/61wXEocUsyL._AC_UY218_.jpg
B01GZSQJPA,Philips HL7756 Mixer Grinder 750 watt with 3 Stainless Steel Jars | 25 mins Continuous Grinding | Mixer Grinder for Kitchen with 3 Speed Control & Pulse Function (Black),3499.0,INR,4.0,36009,mixer grinder best seller,Electronics & Gadgets,scrape,20260617125239.484,False,https://www.amazon.in/dp/B01GZSQJPA,,https://www.amazon.in/dp/B01GZSQJPA,https://www.amazon.in/dp/B01GZSQJPA,https://www.amazon.in/s?k=mixer+grinder+best+seller,best seller,mixer grinder best seller,"Philips HL7756 Mixer Grinder 750 watt | Mixer Grinder Best Seller Price, Review And Deals","Philips HL7756 Mixer Grinder 750 watt is a best seller for mixer grinder best seller. Compare current price, rating, features and exact Amazon product link before you buy.",9,72.11,72.11,71.03,medium,B,post,post,manual-link,0,heuristic,heuristic,0.0,heuristic,0.0,2dcf52e8ca33,12:00-13:30,"[""Best Mixer Grinder Best Seller Under Rs 3500 India"", ""Philips HL7756 Mixer Grinder 750 watt with 3 Stainless Review And Price"", ""Useful Amazon Find: Philips HL7756 Mixer Grinder 750 watt with 3 Stainless"", ""Mixer Grinder Best Seller For Home And Daily Use"", ""Top Rated Mixer Grinder Best Seller Worth Checking""]","[""Philips HL7756 Mixer Grinder 750 watt with 3 Stainless Steel Jars is a strong mixer grinder best seller pick at around Rs. 3,499. Check the exact product page for latest specs, reviews and offers."", ""Looking for mixer grinder best seller? Philips HL7756 Mixer Grinder 750 watt with 3 Stainless Steel Jars has useful everyday appeal and is worth comparing before you buy."", ""Save this mixer grinder best seller idea for later. Philips HL7756 Mixer Grinder 750 watt with 3 Stainless Steel Jars may fit home, work or gifting needs depending on today's Amazon price.""]",Philips HL7756 Mixer Grinder 750 watt | Mixer Grinder Best Seller,"Philips HL7756 Mixer Grinder 750 watt is today's best seller for mixer grinder best seller. Price: Rs. 3,499. Check the exact product page for specs, reviews and current offers. #mixergrinderbestseller #amazonfinds #dailyfinds #budgetshopping",https://www.amazon.in/dp/B01GZSQJPA,Trending Home Finds,10001500,Philips HL7756 Mixer Grinder 750 watt with 3 Stainless Steel Jars | 25 mins Continuous Grinding | Mixer Grinder for Kitchen with 3 Speed Control & Pulse Function (Black) available on Amazon,https://m.media-amazon.com/images/I/61YC2I7HqGL._AC_UY218_.jpg
B092F47Y2C,"Livronic® Plastic Wet and Dry Cotton Floor Mop with 4Ft Long Handle with 360 Degree Movement Which Allows You to Clean Every Corners Easily with 3 Extra Microfiber Refill (Head 18-in,L) 3Extra Pad",797.0,INR,4.2,1488,cleaning gadgets for home,Electronics & Gadgets,scrape,20260617125239.484,False,https://www.amazon.in/dp/B092F47Y2C,,https://www.amazon.in/dp/B092F47Y2C,https://www.amazon.in/dp/B092F47Y2C,https://www.amazon.in/s?k=cleaning+gadgets+for+home,daily trend,cleaning gadgets for home,"Livronic® Plastic Wet and Dry Cotton Floor Mop | Cleaning Gadgets For Home Price, Review And Deals","Livronic® Plastic Wet and Dry Cotton Floor Mop is a daily trend for cleaning gadgets for home. Compare current price, rating, features and exact Amazon product link before you buy.",19,67.06,67.06,64.48,low,B,post,post,manual-link,0,heuristic,heuristic,0.0,heuristic,0.0,e0f73229257d,12:00-13:30,"[""Best Cleaning Gadgets For Home Under Rs 800 India"", ""Livronic® Plastic Wet and Dry Cotton Floor Mop with 4F Review And Price"", ""Useful Amazon Find: Livronic® Plastic Wet and Dry Cotton Floor Mop with 4F"", ""Cleaning Gadgets For Home For Home And Daily Use"", ""Top Rated Cleaning Gadgets For Home Worth Checking""]","[""Livronic® Plastic Wet and Dry Cotton Floor Mop with 4Ft Long Handle with is a strong cleaning gadgets for home pick at around Rs. 797. Check the exact product page for latest specs, reviews and offers."", ""Looking for cleaning gadgets for home? Livronic® Plastic Wet and Dry Cotton Floor Mop with 4Ft Long Handle with has useful everyday appeal and is worth comparing before you buy."", ""Save this cleaning gadgets for home idea for later. Livronic® Plastic Wet and Dry Cotton Floor Mop with 4Ft Long Handle with may fit home, work or gifting needs depending on today's Amazon price.""]",Livronic® Plastic Wet and Dry Cotton Floor Mop | Cleaning Gadgets For Home,"Livronic® Plastic Wet and Dry Cotton Floor Mop is today's daily trend for cleaning gadgets for home. Price: Rs. 797. Check the exact product page for specs, reviews and current offers. #cleaninggadgetsforhome #amazonfinds #dailyfinds #budgetshopping",https://www.amazon.in/dp/B092F47Y2C,Trending Home Finds,10001500,"Livronic® Plastic Wet and Dry Cotton Floor Mop with 4Ft Long Handle with 360 Degree Movement Which Allows You to Clean Every Corners Easily with 3 Extra Microfiber Refill (Head 18-in,L) 3Extra Pad available on Amazon",https://m.media-amazon.com/images/I/81Vwd7bt5EL._AC_UY218_.jpg
B0C33FLXJJ,"Longway Super Dlx Juicer Mixer Grinder | Up to 750W Max Output Powerful Motor | 4 Jars for Grinding, Mixing, Juicing | 2 Year Warranty | Black & Gray",1499.0,INR,3.9,2592,mixer grinder best seller,Electronics & Gadgets,scrape,20260617125239.484,False,https://www.amazon.in/dp/B0C33FLXJJ,,https://www.amazon.in/dp/B0C33FLXJJ,https://www.amazon.in/dp/B0C33FLXJJ,https://www.amazon.in/s?k=mixer+grinder+best+seller,best seller,mixer grinder best seller,"Longway Super Dlx Juicer Mixer Grinder | Mixer Grinder Best Seller Price, Review And Deals","Longway Super Dlx Juicer Mixer Grinder is a best seller for mixer grinder best seller. Compare current price, rating, features and exact Amazon product link before you buy.",9,66.18,66.18,69.43,medium,B,post,post,manual-link,0,heuristic,heuristic,0.0,heuristic,0.0,9735f5868da8,07:30-09:00,"[""Best Mixer Grinder Best Seller Under Rs 1500 India"", ""Longway Super Dlx Juicer Mixer Grinder Review And Price"", ""Useful Amazon Find: Longway Super Dlx Juicer Mixer Grinder"", ""Mixer Grinder Best Seller For Home And Daily Use"", ""Top Rated Mixer Grinder Best Seller Worth Checking""]","[""Longway Super Dlx Juicer Mixer Grinder is a strong mixer grinder best seller pick at around Rs. 1,499. Check the exact product page for latest specs, reviews and offers."", ""Looking for mixer grinder best seller? Longway Super Dlx Juicer Mixer Grinder has useful everyday appeal and is worth comparing before you buy."", ""Save this mixer grinder best seller idea for later. Longway Super Dlx Juicer Mixer Grinder may fit home, work or gifting needs depending on today's Amazon price.""]",Longway Super Dlx Juicer Mixer Grinder | Mixer Grinder Best Seller,"Longway Super Dlx Juicer Mixer Grinder is today's best seller for mixer grinder best seller. Price: Rs. 1,499. Check the exact product page for specs, reviews and current offers. #mixergrinderbestseller #amazonfinds #dailyfinds #budgetshopping",https://www.amazon.in/dp/B0C33FLXJJ,Trending Home Finds,10001500,"Longway Super Dlx Juicer Mixer Grinder | Up to 750W Max Output Powerful Motor | 4 Jars for Grinding, Mixing, Juicing | 2 Year Warranty | Black & Gray available on Amazon",https://m.media-amazon.com/images/I/71vfrhmJ1SL._AC_UY218_.jpg
B0GWR1BS8P,"9 in 1 Electric Spin DSrubber,Cleaning Brush for Home, 300RPM/Mins 8 Heads - 90Mins Work Time, 3 Adjustable Size, 2 Speeds for Bathroom Shower Bathtub Car",849.0,INR,4.9,4,cleaning gadgets for home,Electronics & Gadgets,scrape,20260617125239.484,False,https://www.amazon.in/dp/B0GWR1BS8P,,https://www.amazon.in/dp/B0GWR1BS8P,https://www.amazon.in/dp/B0GWR1BS8P,https://www.amazon.in/s?k=cleaning+gadgets+for+home,daily trend,cleaning gadgets for home,"9 in 1 Electric Spin DSrubber,Cleaning Brush | Cleaning Gadgets For Home Price, Review And Deals","9 in 1 Electric Spin DSrubber,Cleaning Brush is a daily trend for cleaning gadgets for home. Compare current price, rating, features and exact Amazon product link before you buy.",19,62.85,62.85,61.87,low,C,post,post,"low-review-proof, manual-link",0,heuristic,heuristic,0.0,heuristic,0.0,00a3db7d3c4a,12:00-13:30,"[""Best Cleaning Gadgets For Home Under Rs 900 India"", ""9 in 1 Electric Spin DSrubber,Cleaning Brush for Home Review And Price"", ""Useful Amazon Find: 9 in 1 Electric Spin DSrubber,Cleaning Brush for Home"", ""Cleaning Gadgets For Home For Home And Daily Use"", ""Top Rated Cleaning Gadgets For Home Worth Checking""]","[""9 in 1 Electric Spin DSrubber,Cleaning Brush for Home, 300RPM/Mins 8 Hea is a strong cleaning gadgets for home pick at around Rs. 849. Check the exact product page for latest specs, reviews and offers."", ""Looking for cleaning gadgets for home? 9 in 1 Electric Spin DSrubber,Cleaning Brush for Home, 300RPM/Mins 8 Hea has useful everyday appeal and is worth comparing before you buy."", ""Save this cleaning gadgets for home idea for later. 9 in 1 Electric Spin DSrubber,Cleaning Brush for Home, 300RPM/Mins 8 Hea may fit home, work or gifting needs depending on today's Amazon price.""]","9 in 1 Electric Spin DSrubber,Cleaning Brush | Cleaning Gadgets For Home","9 in 1 Electric Spin DSrubber,Cleaning Brush is today's daily trend for cleaning gadgets for home. Price: Rs. 849. Check the exact product page for specs, reviews and current offers. #cleaninggadgetsforhome #amazonfinds #dailyfinds #budgetshopping",https://www.amazon.in/dp/B0GWR1BS8P,Trending Home Finds,10001500,"9 in 1 Electric Spin DSrubber,Cleaning Brush for Home, 300RPM/Mins 8 Heads - 90Mins Work Time, 3 Adjustable Size, 2 Speeds for Bathroom Shower Bathtub Car available on Amazon",https://m.media-amazon.com/images/I/51fcZFjU7iL._AC_UY218_.jpg
B0GWCRPGDB,"Longway Super Pro Juicer Mixer Grinder | Up to 750W Max Output Powerful Motor | 4 Jars for Grinding, Mixing, Juicing | 2 Years Warranty (Blue & Black)",1599.0,INR,3.9,250,mixer grinder best seller,Electronics & Gadgets,scrape,20260617125239.484,False,https://www.amazon.in/dp/B0GWCRPGDB,,https://www.amazon.in/dp/B0GWCRPGDB,https://www.amazon.in/dp/B0GWCRPGDB,https://www.amazon.in/s?k=mixer+grinder+best+seller,best seller,mixer grinder best seller,"Longway Super Pro Juicer Mixer Grinder | Mixer Grinder Best Seller Price, Review And Deals","Longway Super Pro Juicer Mixer Grinder is a best seller for mixer grinder best seller. Compare current price, rating, features and exact Amazon product link before you buy.",9,59.16,59.16,65.08,medium,C,post,post,manual-link,0,heuristic,heuristic,0.0,heuristic,0.0,885d64105d0a,07:30-09:00,"[""Best Mixer Grinder Best Seller Under Rs 1600 India"", ""Longway Super Pro Juicer Mixer Grinder Review And Price"", ""Useful Amazon Find: Longway Super Pro Juicer Mixer Grinder"", ""Mixer Grinder Best Seller For Home And Daily Use"", ""Top Rated Mixer Grinder Best Seller Worth Checking""]","[""Longway Super Pro Juicer Mixer Grinder is a strong mixer grinder best seller pick at around Rs. 1,599. Check the exact product page for latest specs, reviews and offers."", ""Looking for mixer grinder best seller? Longway Super Pro Juicer Mixer Grinder has useful everyday appeal and is worth comparing before you buy."", ""Save this mixer grinder best seller idea for later. Longway Super Pro Juicer Mixer Grinder may fit home, work or gifting needs depending on today's Amazon price.""]",Longway Super Pro Juicer Mixer Grinder | Mixer Grinder Best Seller,"Longway Super Pro Juicer Mixer Grinder is today's best seller for mixer grinder best seller. Price: Rs. 1,599. Check the exact product page for specs, reviews and current offers. #mixergrinderbestseller #amazonfinds #dailyfinds #budgetshopping",https://www.amazon.in/dp/B0GWCRPGDB,Trending Home Finds,10001500,"Longway Super Pro Juicer Mixer Grinder | Up to 750W Max Output Powerful Motor | 4 Jars for Grinding, Mixing, Juicing | 2 Years Warranty (Blue & Black) available on Amazon",https://m.media-amazon.com/images/I/71uHKg5F3DL._AC_UY218_.jpg
B0F2DZW6BR,"Silicone Dish Washing Gloves for Kitchen & Bathroom Cleaning, Utensil Scrubbing, Pet Hair Removal & Car Wash | Reusable | Unisex | Assorted colors",159.0,INR,4.0,515,cleaning gadgets for home,Electronics & Gadgets,scrape,20260617125239.484,False,https://www.amazon.in/dp/B0F2DZW6BR,,https://www.amazon.in/dp/B0F2DZW6BR,https://www.amazon.in/dp/B0F2DZW6BR,https://www.amazon.in/s?k=cleaning+gadgets+for+home,daily trend,cleaning gadgets for home,"Silicone Dish Washing Gloves | Cleaning Gadgets For Home Price, Review And Deals","Silicone Dish Washing Gloves is a daily trend for cleaning gadgets for home. Compare current price, rating, features and exact Amazon product link before you buy.",19,56.33,56.33,51.9,low,C,post,post,manual-link,0,heuristic,heuristic,0.0,heuristic,0.0,841427e3593b,12:00-13:30,"[""Best Cleaning Gadgets For Home India"", ""Silicone Dish Washing Gloves for Kitchen & Bathroom Cl Review And Price"", ""Useful Amazon Find: Silicone Dish Washing Gloves for Kitchen & Bathroom Cl"", ""Cleaning Gadgets For Home For Home And Daily Use"", ""Top Rated Cleaning Gadgets For Home Worth Checking""]","[""Silicone Dish Washing Gloves for Kitchen & Bathroom Cleaning, Utensil Sc is a strong cleaning gadgets for home pick at around Rs. 159. Check the exact product page for latest specs, reviews and offers."", ""Looking for cleaning gadgets for home? Silicone Dish Washing Gloves for Kitchen & Bathroom Cleaning, Utensil Sc has useful everyday appeal and is worth comparing before you buy."", ""Save this cleaning gadgets for home idea for later. Silicone Dish Washing Gloves for Kitchen & Bathroom Cleaning, Utensil Sc may fit home, work or gifting needs depending on today's Amazon price.""]",Silicone Dish Washing Gloves | Cleaning Gadgets For Home,"Silicone Dish Washing Gloves is today's daily trend for cleaning gadgets for home. Price: Rs. 159. Check the exact product page for specs, reviews and current offers. #cleaninggadgetsforhome #amazonfinds #dailyfinds #budgetshopping",https://www.amazon.in/dp/B0F2DZW6BR,Trending Home Finds,10001500,"Silicone Dish Washing Gloves for Kitchen & Bathroom Cleaning, Utensil Scrubbing, Pet Hair Removal & Car Wash | Reusable | Unisex | Assorted colors available on Amazon",https://m.media-amazon.com/images/I/71HxEvbszOL._AC_UY218_.jpg
