asin,title,price,currency,rating,reviews,keyword,category,source,fetched_at,has_affiliate,product_url,affiliate_link,manual_link,sitestripe_url,search_url,trend_label,seo_keyword,google_title,google_description,trend_score,product_score,ai_score,buyer_intent,quality_grade,recommendation,risk_flags,hf_signal,hf_signal_source,best_posting_window,seo_title_variants,caption_variants,pin_title,pin_description,pin_link,pin_board,pin_image_size,pin_alt_text,image_url
B0GR69WTSY,"MILTON Aston 700 BPA & BPS-Free Water Bottle 700 ml| Food-Grade Plastic | One-Click Open | Leak-Proof | Sip & Gulp Lid I Ideal for Office, School, College, Gym, Purple",198.0,INR,3.9,638,daily deals useful products,Electronics & Gadgets,scrape,20260530010422.83,False,https://www.amazon.in/dp/B0GR69WTSY,,https://www.amazon.in/dp/B0GR69WTSY,https://www.amazon.in/dp/B0GR69WTSY,https://www.amazon.in/s?k=daily+deals+useful+products,budget pick,daily deals useful products,"MILTON Aston 700 BPA & BPS-Free Water Bottle 700 ml| Food-Grade | Daily Deals Useful Products Price, Review And Deals","MILTON Aston 700 BPA & BPS-Free Water Bottle 700 ml| Food-Grade is a budget pick for daily deals useful products. Compare current price, rating, features and exact Amazon product link before you buy.",0,49.44,49.44,medium,D,review,manual-link,0,heuristic,22:00-23:00,"[""Best Daily Deals Useful Products India"", ""MILTON Aston 700 BPA & BPS-Free Water Bottle 700 ml| F Review And Price"", ""Useful Amazon Find: MILTON Aston 700 BPA & BPS-Free Water Bottle 700 ml| F"", ""Daily Deals Useful Products For Home And Daily Use"", ""Top Rated Daily Deals Useful Products Worth Checking""]","[""MILTON Aston 700 BPA & BPS-Free Water Bottle 700 ml| Food-Grade Plastic is a strong daily deals useful products pick at around Rs. 198. Check the exact product page for latest specs, reviews and offers."", ""Looking for daily deals useful products? MILTON Aston 700 BPA & BPS-Free Water Bottle 700 ml| Food-Grade Plastic has useful everyday appeal and is worth comparing before you buy."", ""Save this daily deals useful products idea for later. MILTON Aston 700 BPA & BPS-Free Water Bottle 700 ml| Food-Grade Plastic may fit home, work or gifting needs depending on today's Amazon price.""]",MILTON Aston 700 BPA & BPS-Free Water Bottle 700 ml| Food-Grade | Daily Deals Useful Products,"MILTON Aston 700 BPA & BPS-Free Water Bottle 700 ml| Food-Grade is today's budget pick for daily deals useful products. Price: Rs. 198. Check the exact product page for specs, reviews and current offers. #dailydealsusefulproducts #amazonfinds #dailyfinds #budgetshopping",https://www.amazon.in/dp/B0GR69WTSY,Viral Amazon Finds,10001500,"MILTON Aston 700 BPA & BPS-Free Water Bottle 700 ml| Food-Grade Plastic | One-Click Open | Leak-Proof | Sip & Gulp Lid I Ideal for Office, School, College, Gym, Purple available on Amazon",https://m.media-amazon.com/images/I/61usyMhoLqL._AC_UL320_.jpg
B0D1474ZT6,"PHILIPS Air Fryer NA231/00 with touch panel, uses up to 90% less fat, 1700W, 6.2 Liter, with Rapid Air Technology (Black),Cooking window, Extra Large",10484.0,INR,4.2,,air fryer best seller,Electronics & Gadgets,scrape,20260530010422.83,False,https://www.amazon.in/dp/B0D1474ZT6,,https://www.amazon.in/dp/B0D1474ZT6,https://www.amazon.in/dp/B0D1474ZT6,https://www.amazon.in/s?k=air+fryer+best+seller,best seller,air fryer best seller,"PHILIPS Air Fryer NA231/00 | Air Fryer Best Seller Price, Review And Deals","PHILIPS Air Fryer NA231/00 is a best seller for air fryer best seller. Compare current price, rating, features and exact Amazon product link before you buy.",8,38.86,38.86,medium,D,review,"missing-image, manual-link",0,heuristic,07:30-09:00,"[""Best Air Fryer Best Seller India"", ""PHILIPS Air Fryer NA231/00 with touch panel, uses up t Review And Price"", ""Useful Amazon Find: PHILIPS Air Fryer NA231/00 with touch panel, uses up t"", ""Air Fryer Best Seller For Home And Daily Use"", ""Top Rated Air Fryer Best Seller Worth Checking""]","[""PHILIPS Air Fryer NA231/00 with touch panel, uses up to 90% less fat, 17 is a strong air fryer best seller pick at around Rs. 10,484. Check the exact product page for latest specs, reviews and offers."", ""Looking for air fryer best seller? PHILIPS Air Fryer NA231/00 with touch panel, uses up to 90% less fat, 17 has useful everyday appeal and is worth comparing before you buy."", ""Save this air fryer best seller idea for later. PHILIPS Air Fryer NA231/00 with touch panel, uses up to 90% less fat, 17 may fit home, work or gifting needs depending on today's Amazon price.""]",PHILIPS Air Fryer NA231/00 | Air Fryer Best Seller,"PHILIPS Air Fryer NA231/00 is today's best seller for air fryer best seller. Price: Rs. 10,484. Check the exact product page for specs, reviews and current offers. #airfryerbestseller #amazonfinds #dailyfinds #budgetshopping",https://www.amazon.in/dp/B0D1474ZT6,Trending Home Finds,10001500,"PHILIPS Air Fryer NA231/00 with touch panel, uses up to 90% less fat, 1700W, 6.2 Liter, with Rapid Air Technology (Black),Cooking window, Extra Large available on Amazon",
B0CCSGYBCJ,Ella Garbage Bags Large 24x32 Inches | 60 Bags 4 Rolls | Leak Proof & Tear Resistant Trash Bags for Kitchen Home & Commercial Use | Dustbin Bags For Dry & Wet Waste With Free Check Duster Cloth -Black,186.0,INR,3.8,796,daily deals useful products,Electronics & Gadgets,scrape,20260530010422.83,False,https://www.amazon.in/dp/B0CCSGYBCJ,,https://www.amazon.in/dp/B0CCSGYBCJ,https://www.amazon.in/dp/B0CCSGYBCJ,https://www.amazon.in/s?k=daily+deals+useful+products,budget pick,daily deals useful products,"Ella Garbage Bags Large 24x32 Inches | Daily Deals Useful Products Price, Review And Deals","Ella Garbage Bags Large 24x32 Inches is a budget pick for daily deals useful products. Compare current price, rating, features and exact Amazon product link before you buy.",0,50.7,50.7,high,C,review,manual-link,0,heuristic,12:00-13:30,"[""Best Daily Deals Useful Products India"", ""Ella Garbage Bags Large 24x32 Inches Review And Price"", ""Useful Amazon Find: Ella Garbage Bags Large 24x32 Inches"", ""Daily Deals Useful Products For Home And Daily Use"", ""Top Rated Daily Deals Useful Products Worth Checking""]","[""Ella Garbage Bags Large 24x32 Inches is a strong daily deals useful products pick at around Rs. 186. Check the exact product page for latest specs, reviews and offers."", ""Looking for daily deals useful products? Ella Garbage Bags Large 24x32 Inches has useful everyday appeal and is worth comparing before you buy."", ""Save this daily deals useful products idea for later. Ella Garbage Bags Large 24x32 Inches may fit home, work or gifting needs depending on today's Amazon price.""]",Ella Garbage Bags Large 24x32 Inches | Daily Deals Useful Products,"Ella Garbage Bags Large 24x32 Inches is today's budget pick for daily deals useful products. Price: Rs. 186. Check the exact product page for specs, reviews and current offers. #dailydealsusefulproducts #amazonfinds #dailyfinds #budgetshopping",https://www.amazon.in/dp/B0CCSGYBCJ,Viral Amazon Finds,10001500,Ella Garbage Bags Large 24x32 Inches | 60 Bags 4 Rolls | Leak Proof & Tear Resistant Trash Bags for Kitchen Home & Commercial Use | Dustbin Bags For Dry & Wet Waste With Free Check Duster Cloth -Black available on Amazon,https://m.media-amazon.com/images/I/71k61z6eG1L._AC_UL320_.jpg
746,12001.24,849.0,INR,4.1,1485,water bottle trending,Electronics & Gadgets,scrape,20260530010422.83,False,https://www.amazon.in/dp/B0DD74V6NL,,https://www.amazon.in/dp/B0DD74V6NL,https://www.amazon.in/dp/B0DD74V6NL,https://www.amazon.in/s?k=water+bottle+trending,daily trend,water bottle trending,"Tumbler | Water Bottle Trending Price, Review And Deals","Tumbler is a daily trend for water bottle trending. Compare current price, rating, features and exact Amazon product link before you buy.",12,63.32,63.32,low,C,post,manual-link,0,heuristic,07:30-09:00,"[""Best Water Bottle Trending Under Rs 900 India"", ""12001.24 Review And Price"", ""Useful Amazon Find: 12001.24"", ""Water Bottle Trending For Home And Daily Use"", ""Top Rated Water Bottle Trending Worth Checking""]","[""12001.24 is a strong water bottle trending pick at around Rs. 849. Check the exact product page for latest specs, reviews and offers."", ""Looking for water bottle trending? 12001.24 has useful everyday appeal and is worth comparing before you buy."", ""Save this water bottle trending idea for later. 12001.24 may fit home, work or gifting needs depending on today's Amazon price.""]",Tumbler | Water Bottle Trending,"Tumbler is today's daily trend for water bottle trending. Price: Rs. 849. Check the exact product page for specs, reviews and current offers. #waterbottletrending #amazonfinds #dailyfinds #budgetshopping",https://www.amazon.in/dp/B0DD74V6NL,Viral Amazon Finds,10001500,12001.24,https://m.media-amazon.com/images/I/71IK9WA4FNL._AC_UL320_.jpg
5,2,178.0,INR,3.8,717,water bottle trending,Electronics & Gadgets,scrape,20260530010422.83,False,https://www.amazon.in/dp/B0DSPPLGZ5,,https://www.amazon.in/dp/B0DSPPLGZ5,https://www.amazon.in/dp/B0DSPPLGZ5,https://www.amazon.in/s?k=water+bottle+trending,daily trend,water bottle trending,2,"JEBISON 2 L Capacity Belt Straw Transparent Motivational Water B is a daily trend for water bottle trending. Compare current price, rating, features and exact Amazon product link before you buy.",12,52.96,52.96,low,C,review,manual-link,0,heuristic,07:30-09:00,"[""Best Water Bottle Trending India"", ""2 Review And Price"", ""Useful Amazon Find: 2"", ""Water Bottle Trending For Home And Daily Use"", ""Top Rated Water Bottle Trending Worth Checking""]","[""2 is a strong water bottle trending pick at around Rs. 178. Check the exact product page for latest specs, reviews and offers."", ""Looking for water bottle trending? 2 has useful everyday appeal and is worth comparing before you buy."", ""Save this water bottle trending idea for later. 2 may fit home, work or gifting needs depending on today's Amazon price.""]",2,"JEBISON 2 L Capacity Belt Straw Transparent Motivational Water B is today's daily trend for water bottle trending. Price: Rs. 178. Check the exact product page for specs, reviews and current offers. #waterbottletrending #amazonfinds #dailyfinds #budgetshopping",https://www.amazon.in/dp/B0DSPPLGZ5,Viral Amazon Finds,10001500,2,https://m.media-amazon.com/images/I/61818em94pL._AC_UL320_.jpg
7835,750,879.0,INR,4.2,,water bottle trending,Electronics & Gadgets,scrape,20260530010422.83,False,https://www.amazon.in/dp/B0783BPJ5F,,https://www.amazon.in/dp/B0783BPJ5F,https://www.amazon.in/dp/B0783BPJ5F,https://www.amazon.in/s?k=water+bottle+trending,daily trend,water bottle trending,"TintBox Borosilicate Glass Water Bottle | Water Bottle Trending Price, Review And Deals","TintBox Borosilicate Glass Water Bottle is a daily trend for water bottle trending. Compare current price, rating, features and exact Amazon product link before you buy.",12,44.06,44.06,low,D,review,"missing-image, manual-link",0,heuristic,07:30-09:00,"[""Best Water Bottle Trending Under Rs 900 India"", ""750 Review And Price"", ""Useful Amazon Find: 750"", ""Water Bottle Trending For Home And Daily Use"", ""Top Rated Water Bottle Trending Worth Checking""]","[""750 is a strong water bottle trending pick at around Rs. 879. Check the exact product page for latest specs, reviews and offers."", ""Looking for water bottle trending? 750 has useful everyday appeal and is worth comparing before you buy."", ""Save this water bottle trending idea for later. 750 may fit home, work or gifting needs depending on today's Amazon price.""]",TintBox Borosilicate Glass Water Bottle | Water Bottle Trending,"TintBox Borosilicate Glass Water Bottle is today's daily trend for water bottle trending. Price: Rs. 879. Check the exact product page for specs, reviews and current offers. #waterbottletrending #amazonfinds #dailyfinds #budgetshopping",https://www.amazon.in/dp/B0783BPJ5F,Viral Amazon Finds,10001500,750,
78627,Check each product page for other buying options. Price and other details may vary based on product size and colour,879.0,INR,4.2,,water bottle trending,Electronics & Gadgets,scrape,20260530010422.83,False,https://www.amazon.in/dp/B0786DD2N7,,https://www.amazon.in/dp/B0786DD2N7,https://www.amazon.in/dp/B0786DD2N7,https://www.amazon.in/s?k=water+bottle+trending,daily trend,water bottle trending,"Check each product page | Water Bottle Trending Price, Review And Deals","Check each product page is a daily trend for water bottle trending. Compare current price, rating, features and exact Amazon product link before you buy.",12,47.0,47.0,medium,D,review,"missing-image, manual-link",0,heuristic,07:30-09:00,"[""Best Water Bottle Trending Under Rs 900 India"", ""Check each product page for other buying options. Pric Review And Price"", ""Useful Amazon Find: Check each product page for other buying options. Pric"", ""Water Bottle Trending For Home And Daily Use"", ""Top Rated Water Bottle Trending Worth Checking""]","[""Check each product page for other buying options. Price and other detail is a strong water bottle trending pick at around Rs. 879. Check the exact product page for latest specs, reviews and offers."", ""Looking for water bottle trending? Check each product page for other buying options. Price and other detail has useful everyday appeal and is worth comparing before you buy."", ""Save this water bottle trending idea for later. Check each product page for other buying options. Price and other detail may fit home, work or gifting needs depending on today's Amazon price.""]",Check each product page | Water Bottle Trending,"Check each product page is today's daily trend for water bottle trending. Price: Rs. 879. Check the exact product page for specs, reviews and current offers. #waterbottletrending #amazonfinds #dailyfinds #budgetshopping",https://www.amazon.in/dp/B0786DD2N7,Viral Amazon Finds,10001500,Check each product page for other buying options. Price and other details may vary based on product size and colour available on Amazon,
364,"Sounce Suction Phone Case, Phone Suction Sticker, for Hands-Free Mobile Accessory Holder Grip, Video Phone Accessory Compatible Mirror, Shower (Pink)",99.0,INR,3.7,86,phone accessories trending,Electronics & Gadgets,scrape,20260530010422.83,False,https://www.amazon.in/dp/B0GV3W64BR,,https://www.amazon.in/dp/B0GV3W64BR,https://www.amazon.in/dp/B0GV3W64BR,https://www.amazon.in/s?k=phone+accessories+trending,daily trend,phone accessories trending,"Sounce Suction Phone Case, Phone Suction Sticker | Phone Accessories Trending Price, Review And Deals","Sounce Suction Phone Case, Phone Suction Sticker is a daily trend for phone accessories trending. Compare current price, rating, features and exact Amazon product link before you buy.",16,51.2,51.2,low,C,review,"low-rating, manual-link",0,heuristic,07:30-09:00,"[""Best Phone Accessories Trending India"", ""Sounce Suction Phone Case, Phone Suction Sticker, for Review And Price"", ""Useful Amazon Find: Sounce Suction Phone Case, Phone Suction Sticker, for"", ""Phone Accessories Trending For Home And Daily Use"", ""Top Rated Phone Accessories Trending Worth Checking""]","[""Sounce Suction Phone Case, Phone Suction Sticker, for Hands-Free Mobile  is a strong phone accessories trending pick at around Rs. 99. Check the exact product page for latest specs, reviews and offers."", ""Looking for phone accessories trending? Sounce Suction Phone Case, Phone Suction Sticker, for Hands-Free Mobile  has useful everyday appeal and is worth comparing before you buy."", ""Save this phone accessories trending idea for later. Sounce Suction Phone Case, Phone Suction Sticker, for Hands-Free Mobile  may fit home, work or gifting needs depending on today's Amazon price.""]","Sounce Suction Phone Case, Phone Suction Sticker | Phone Accessories Trending","Sounce Suction Phone Case, Phone Suction Sticker is today's daily trend for phone accessories trending. Price: Rs. 99. Check the exact product page for specs, reviews and current offers. #phoneaccessoriestrending #amazonfinds #dailyfinds #budgetshopping",https://www.amazon.in/dp/B0GV3W64BR,Budget Tech And Desk Setup,10001500,"Sounce Suction Phone Case, Phone Suction Sticker, for Hands-Free Mobile Accessory Holder Grip, Video Phone Accessory Compatible Mirror, Shower (Pink) available on Amazon",https://m.media-amazon.com/images/I/719T30vKx7L._AC_UY218_.jpg
1,1,99.0,INR,3.7,86,phone accessories trending,Electronics & Gadgets,scrape,20260530010422.83,False,https://www.amazon.in/dp/B0GKPQHTP1,,https://www.amazon.in/dp/B0GKPQHTP1,https://www.amazon.in/dp/B0GKPQHTP1,https://www.amazon.in/s?k=phone+accessories+trending,daily trend,phone accessories trending,"Sounce Silicone Suction Phone Case, Suction Phone Case | Phone Accessories Trending Price, Review And Deals","Sounce Silicone Suction Phone Case, Suction Phone Case is a daily trend for phone accessories trending. Compare current price, rating, features and exact Amazon product link before you buy.",16,51.2,51.2,low,C,review,"low-rating, manual-link",0,heuristic,07:30-09:00,"[""Best Phone Accessories Trending India"", ""1 Review And Price"", ""Useful Amazon Find: 1"", ""Phone Accessories Trending For Home And Daily Use"", ""Top Rated Phone Accessories Trending Worth Checking""]","[""1 is a strong phone accessories trending pick at around Rs. 99. Check the exact product page for latest specs, reviews and offers."", ""Looking for phone accessories trending? 1 has useful everyday appeal and is worth comparing before you buy."", ""Save this phone accessories trending idea for later. 1 may fit home, work or gifting needs depending on today's Amazon price.""]","Sounce Silicone Suction Phone Case, Suction Phone Case | Phone Accessories Trending","Sounce Silicone Suction Phone Case, Suction Phone Case is today's daily trend for phone accessories trending. Price: Rs. 99. Check the exact product page for specs, reviews and current offers. #phoneaccessoriestrending #amazonfinds #dailyfinds #budgetshopping",https://www.amazon.in/dp/B0GKPQHTP1,Budget Tech And Desk Setup,10001500,1,https://m.media-amazon.com/images/I/514fKCI15tL._AC_UY218_.jpg
