asin,title,price,currency,rating,reviews,keyword,category,source,fetched_at,has_affiliate,product_url,affiliate_link,manual_link,sitestripe_url,search_url,trend_label,seo_keyword,google_title,google_description,trend_score,product_score,ai_score,buyer_intent,quality_grade,recommendation,risk_flags,hf_signal,hf_signal_source,best_posting_window,seo_title_variants,caption_variants,pin_title,pin_description,pin_link,pin_board,pin_image_size,pin_alt_text,image_url
B07SRM58TP,"AGARO Regal 800 Watts Handheld Vacuum Cleaner, for Home Use, Dry Vacuuming, 6.5 kPa Suction Power, Lightweight, Lightweight & Durable Body, Small/Mini Size (Black)",1665.0,INR,4.1,"19,670",vacuum cleaner home budget,Electronics & Gadgets,scrape,2026-05-30T11:24:54.173738,False,https://www.amazon.in/dp/B07SRM58TP,,https://www.amazon.in/dp/B07SRM58TP,https://www.amazon.in/dp/B07SRM58TP,https://www.amazon.in/s?k=vacuum+cleaner+home+budget,budget pick,vacuum cleaner home budget,"AGARO Regal 800 Watts Handheld Vacuum Cleaner | Vacuum Cleaner Home Budget Price, Review And Deals","AGARO Regal 800 Watts Handheld Vacuum Cleaner is a budget pick for vacuum cleaner home budget. Compare current price, rating, features and exact Amazon product link before you buy.",5,72.14,72.14,medium,B,post,manual-link,0,heuristic,12:00-13:30,"[""Best Vacuum Cleaner Home Budget Under Rs 1700 India"", ""AGARO Regal 800 Watts Handheld Vacuum Cleaner, for Hom Review And Price"", ""Useful Amazon Find: AGARO Regal 800 Watts Handheld Vacuum Cleaner, for Hom"", ""Vacuum Cleaner Home Budget For Home And Daily Use"", ""Top Rated Vacuum Cleaner Home Budget Worth Checking""]","[""AGARO Regal 800 Watts Handheld Vacuum Cleaner, for Home Use, Dry Vacuumi is a strong vacuum cleaner home budget pick at around Rs. 1,665. Check the exact product page for latest specs, reviews and offers."", ""Looking for vacuum cleaner home budget? AGARO Regal 800 Watts Handheld Vacuum Cleaner, for Home Use, Dry Vacuumi has useful everyday appeal and is worth comparing before you buy."", ""Save this vacuum cleaner home budget idea for later. AGARO Regal 800 Watts Handheld Vacuum Cleaner, for Home Use, Dry Vacuumi may fit home, work or gifting needs depending on today's Amazon price.""]",AGARO Regal 800 Watts Handheld Vacuum Cleaner | Vacuum Cleaner Home Budget,"AGARO Regal 800 Watts Handheld Vacuum Cleaner is today's budget pick for vacuum cleaner home budget. Price: Rs. 1,665. Check the exact product page for specs, reviews and current offers. #vacuumcleanerhomebudget #amazonfinds #dailyfinds #budgetshopping",https://www.amazon.in/dp/B07SRM58TP,Trending Home Finds,1000x1500px,"AGARO Regal 800 Watts Handheld Vacuum Cleaner, for Home Use, Dry Vacuuming, 6.5 kPa Suction Power, Lightweight, Lightweight & Durable Body, Small/Mini Size (Black) available on Amazon",https://m.media-amazon.com/images/I/61R+7C3ID9L._AC_UY218_.jpg
B08WXPJKWY,"AGARO Regal Plus Upright Vacuum Cleaner, 2-in-1, Handheld & Stick, Dry Vacuuming, for Home Use, 800 Watts, 6.5 kPa Suction Power, Bagless, Black",2155.0,INR,3.9,"7,951",vacuum cleaner home budget,Electronics & Gadgets,scrape,2026-05-30T11:24:54.175276,False,https://www.amazon.in/dp/B08WXPJKWY,,https://www.amazon.in/dp/B08WXPJKWY,https://www.amazon.in/dp/B08WXPJKWY,https://www.amazon.in/s?k=vacuum+cleaner+home+budget,budget pick,vacuum cleaner home budget,"AGARO Regal Plus Upright Vacuum Cleaner, 2-in-1, Handheld & Stic | Vacuum Cleaner Home Budget Price, Review And Deals","AGARO Regal Plus Upright Vacuum Cleaner, 2-in-1, Handheld & Stic is a budget pick for vacuum cleaner home budget. Compare current price, rating, features and exact Amazon product link before you buy.",5,71.07,71.07,medium,B,post,manual-link,0,heuristic,12:00-13:30,"[""Best Vacuum Cleaner Home Budget Under Rs 2200 India"", ""AGARO Regal Plus Upright Vacuum Cleaner, 2-in-1, Handh Review And Price"", ""Useful Amazon Find: AGARO Regal Plus Upright Vacuum Cleaner, 2-in-1, Handh"", ""Vacuum Cleaner Home Budget For Home And Daily Use"", ""Top Rated Vacuum Cleaner Home Budget Worth Checking""]","[""AGARO Regal Plus Upright Vacuum Cleaner, 2-in-1, Handheld & Stick, Dry V is a strong vacuum cleaner home budget pick at around Rs. 2,155. Check the exact product page for latest specs, reviews and offers."", ""Looking for vacuum cleaner home budget? AGARO Regal Plus Upright Vacuum Cleaner, 2-in-1, Handheld & Stick, Dry V has useful everyday appeal and is worth comparing before you buy."", ""Save this vacuum cleaner home budget idea for later. AGARO Regal Plus Upright Vacuum Cleaner, 2-in-1, Handheld & Stick, Dry V may fit home, work or gifting needs depending on today's Amazon price.""]","AGARO Regal Plus Upright Vacuum Cleaner, 2-in-1, Handheld & Stic | Vacuum Cleaner Home Budget","AGARO Regal Plus Upright Vacuum Cleaner, 2-in-1, Handheld & Stic is today's budget pick for vacuum cleaner home budget. Price: Rs. 2,155. Check the exact product page for specs, reviews and current offers. #vacuumcleanerhomebudget #amazonfinds #dailyfinds #budgetshopping",https://www.amazon.in/dp/B08WXPJKWY,Trending Home Finds,1000x1500px,"AGARO Regal Plus Upright Vacuum Cleaner, 2-in-1, Handheld & Stick, Dry Vacuuming, for Home Use, 800 Watts, 6.5 kPa Suction Power, Bagless, Black available on Amazon",https://m.media-amazon.com/images/I/61NgB98ez7L._AC_UY218_.jpg
B07RCGTZ4M,"AGARO Ace Wet & Dry Vacuum Cleaner for Home, 1600 Watts, 21.5 kPa Suction Power, 21 litres Tank Capacity, for Home Use, Blower Function, Washable 3L Dust Bag, Stainless Steel Body (Black, Red, Steel)",6699.0,INR,4.3,"6,563",vacuum cleaner home budget,Electronics & Gadgets,scrape,2026-05-30T11:24:54.176089,False,https://www.amazon.in/dp/B07RCGTZ4M,,https://www.amazon.in/dp/B07RCGTZ4M,https://www.amazon.in/dp/B07RCGTZ4M,https://www.amazon.in/s?k=vacuum+cleaner+home+budget,budget pick,vacuum cleaner home budget,"AGARO Ace Wet & Dry Vacuum Cleaner | Vacuum Cleaner Home Budget Price, Review And Deals","AGARO Ace Wet & Dry Vacuum Cleaner is a budget pick for vacuum cleaner home budget. Compare current price, rating, features and exact Amazon product link before you buy.",5,68.9,68.9,medium,B,post,manual-link,0,heuristic,12:00-13:30,"[""Best Vacuum Cleaner Home Budget Under Rs 6700 India"", ""AGARO Ace Wet & Dry Vacuum Cleaner for Home, 1600 Watt Review And Price"", ""Useful Amazon Find: AGARO Ace Wet & Dry Vacuum Cleaner for Home, 1600 Watt"", ""Vacuum Cleaner Home Budget For Home And Daily Use"", ""Top Rated Vacuum Cleaner Home Budget Worth Checking""]","[""AGARO Ace Wet & Dry Vacuum Cleaner for Home, 1600 Watts, 21.5 kPa Suctio is a strong vacuum cleaner home budget pick at around Rs. 6,699. Check the exact product page for latest specs, reviews and offers."", ""Looking for vacuum cleaner home budget? AGARO Ace Wet & Dry Vacuum Cleaner for Home, 1600 Watts, 21.5 kPa Suctio has useful everyday appeal and is worth comparing before you buy."", ""Save this vacuum cleaner home budget idea for later. AGARO Ace Wet & Dry Vacuum Cleaner for Home, 1600 Watts, 21.5 kPa Suctio may fit home, work or gifting needs depending on today's Amazon price.""]",AGARO Ace Wet & Dry Vacuum Cleaner | Vacuum Cleaner Home Budget,"AGARO Ace Wet & Dry Vacuum Cleaner is today's budget pick for vacuum cleaner home budget. Price: Rs. 6,699. Check the exact product page for specs, reviews and current offers. #vacuumcleanerhomebudget #amazonfinds #dailyfinds #budgetshopping",https://www.amazon.in/dp/B07RCGTZ4M,Trending Home Finds,1000x1500px,"AGARO Ace Wet & Dry Vacuum Cleaner for Home, 1600 Watts, 21.5 kPa Suction Power, 21 litres Tank Capacity, for Home Use, Blower Function, Washable 3L Dust Bag, Stainless Steel Body (Black, Red, Steel) available on Amazon",https://m.media-amazon.com/images/I/61B8-nfHqlL._AC_UY218_.jpg
B0FS1VB862,"ShineXPro Microfiber Cleaning Cloth Roll, 20Pcs, 4000 Times Washable - 10X Cheaper Than Paper Kitchen Towel Roll - Ultra Absorbent Lint Free Microfiber Cleaning Cloth for Kitchen - Tearable, Reusable",299.0,INR,4.5,883,home organization products,Electronics & Gadgets,scrape,2026-05-30T11:24:27.108362,False,https://www.amazon.in/dp/B0FS1VB862,,https://www.amazon.in/dp/B0FS1VB862,https://www.amazon.in/dp/B0FS1VB862,https://www.amazon.in/s?k=home+organization+products,daily trend,home organization products,"ShineXPro Microfiber Cleaning Cloth Roll, 20Pcs, 4000 Times Wash | Home Organization Products Price, Review And Deals","ShineXPro Microfiber Cleaning Cloth Roll, 20Pcs, 4000 Times Wash is a daily trend for home organization products. Compare current price, rating, features and exact Amazon product link before you buy.",21,67.74,67.74,low,B,post,manual-link,0,heuristic,12:00-13:30,"[""Best Home Organization Products Under Rs 300 India"", ""ShineXPro Microfiber Cleaning Cloth Roll, 20Pcs, 4000 Review And Price"", ""Useful Amazon Find: ShineXPro Microfiber Cleaning Cloth Roll, 20Pcs, 4000"", ""Home Organization Products For Home And Daily Use"", ""Top Rated Home Organization Products Worth Checking""]","[""ShineXPro Microfiber Cleaning Cloth Roll, 20Pcs, 4000 Times Washable is a strong home organization products pick at around Rs. 299. Check the exact product page for latest specs, reviews and offers."", ""Looking for home organization products? ShineXPro Microfiber Cleaning Cloth Roll, 20Pcs, 4000 Times Washable has useful everyday appeal and is worth comparing before you buy."", ""Save this home organization products idea for later. ShineXPro Microfiber Cleaning Cloth Roll, 20Pcs, 4000 Times Washable may fit home, work or gifting needs depending on today's Amazon price.""]","ShineXPro Microfiber Cleaning Cloth Roll, 20Pcs, 4000 Times Wash | Home Organization Products","ShineXPro Microfiber Cleaning Cloth Roll, 20Pcs, 4000 Times Wash is today's daily trend for home organization products. Price: Rs. 299. Check the exact product page for specs, reviews and current offers. #homeorganizationproducts #amazonfinds #dailyfinds #budgetshopping",https://www.amazon.in/dp/B0FS1VB862,Trending Home Finds,1000x1500px,"ShineXPro Microfiber Cleaning Cloth Roll, 20Pcs, 4000 Times Washable - 10X Cheaper Than Paper Kitchen Towel Roll - Ultra Absorbent Lint Free Microfiber Cleaning Cloth for Kitchen - Tearable, Reusable available on Amazon",https://m.media-amazon.com/images/I/81zwlei7RyL._AC_UL320_.jpg
B0BQMJZZNM,"LIRAMARK Mobile Phone Charging Stand, Storage Holder, Bedside Fixed Rack, Home Organization and Storage Supplies, Bedroom Accessories, Office Accessories, Bathroom Accessories (Pack of 1)",119.0,INR,4.0,"3,756",home organization products,Electronics & Gadgets,scrape,2026-05-30T11:24:27.110445,False,https://www.amazon.in/dp/B0BQMJZZNM,,https://www.amazon.in/dp/B0BQMJZZNM,https://www.amazon.in/dp/B0BQMJZZNM,https://www.amazon.in/s?k=home+organization+products,daily trend,home organization products,"LIRAMARK Mobile Phone Charging Stand, Storage Holder, Bedside Fi | Home Organization Products Price, Review And Deals","LIRAMARK Mobile Phone Charging Stand, Storage Holder, Bedside Fi is a daily trend for home organization products. Compare current price, rating, features and exact Amazon product link before you buy.",21,65.15,65.15,low,B,post,manual-link,0,heuristic,12:00-13:30,"[""Best Home Organization Products India"", ""LIRAMARK Mobile Phone Charging Stand, Storage Holder Review And Price"", ""Useful Amazon Find: LIRAMARK Mobile Phone Charging Stand, Storage Holder"", ""Home Organization Products For Home And Daily Use"", ""Top Rated Home Organization Products Worth Checking""]","[""LIRAMARK Mobile Phone Charging Stand, Storage Holder, Bedside Fixed Rack is a strong home organization products pick at around Rs. 119. Check the exact product page for latest specs, reviews and offers."", ""Looking for home organization products? LIRAMARK Mobile Phone Charging Stand, Storage Holder, Bedside Fixed Rack has useful everyday appeal and is worth comparing before you buy."", ""Save this home organization products idea for later. LIRAMARK Mobile Phone Charging Stand, Storage Holder, Bedside Fixed Rack may fit home, work or gifting needs depending on today's Amazon price.""]","LIRAMARK Mobile Phone Charging Stand, Storage Holder, Bedside Fi | Home Organization Products","LIRAMARK Mobile Phone Charging Stand, Storage Holder, Bedside Fi is today's daily trend for home organization products. Price: Rs. 119. Check the exact product page for specs, reviews and current offers. #homeorganizationproducts #amazonfinds #dailyfinds #budgetshopping",https://www.amazon.in/dp/B0BQMJZZNM,Trending Home Finds,1000x1500px,"LIRAMARK Mobile Phone Charging Stand, Storage Holder, Bedside Fixed Rack, Home Organization and Storage Supplies, Bedroom Accessories, Office Accessories, Bathroom Accessories (Pack of 1) available on Amazon",https://m.media-amazon.com/images/I/61mJSikurML._AC_UL320_.jpg
B09SB36BJX,"INALSA Wet and Dry Vacuum Cleaner for Home, 15 LTR Capacity,1400 W, 17 kPa Suction, Blower Function,HEPA Filter, Wet Vacuum Cleaner for Sofa, House Cleaning Machine,Stainless Steel Body (Micro WD15)",4399.0,INR,4.2,"3,144",vacuum cleaner home budget,Electronics & Gadgets,scrape,2026-05-30T11:24:54.174507,False,https://www.amazon.in/dp/B09SB36BJX,,https://www.amazon.in/dp/B09SB36BJX,https://www.amazon.in/dp/B09SB36BJX,https://www.amazon.in/s?k=vacuum+cleaner+home+budget,budget pick,vacuum cleaner home budget,"INALSA Wet and Dry Vacuum Cleaner | Vacuum Cleaner Home Budget Price, Review And Deals","INALSA Wet and Dry Vacuum Cleaner is a budget pick for vacuum cleaner home budget. Compare current price, rating, features and exact Amazon product link before you buy.",5,63.46,63.46,medium,C,post,manual-link,0,heuristic,12:00-13:30,"[""Best Vacuum Cleaner Home Budget Under Rs 4400 India"", ""INALSA Wet and Dry Vacuum Cleaner for Home, 15 LTR Cap Review And Price"", ""Useful Amazon Find: INALSA Wet and Dry Vacuum Cleaner for Home, 15 LTR Cap"", ""Vacuum Cleaner Home Budget For Home And Daily Use"", ""Top Rated Vacuum Cleaner Home Budget Worth Checking""]","[""INALSA Wet and Dry Vacuum Cleaner for Home, 15 LTR Capacity,1400 W, 17 k is a strong vacuum cleaner home budget pick at around Rs. 4,399. Check the exact product page for latest specs, reviews and offers."", ""Looking for vacuum cleaner home budget? INALSA Wet and Dry Vacuum Cleaner for Home, 15 LTR Capacity,1400 W, 17 k has useful everyday appeal and is worth comparing before you buy."", ""Save this vacuum cleaner home budget idea for later. INALSA Wet and Dry Vacuum Cleaner for Home, 15 LTR Capacity,1400 W, 17 k may fit home, work or gifting needs depending on today's Amazon price.""]",INALSA Wet and Dry Vacuum Cleaner | Vacuum Cleaner Home Budget,"INALSA Wet and Dry Vacuum Cleaner is today's budget pick for vacuum cleaner home budget. Price: Rs. 4,399. Check the exact product page for specs, reviews and current offers. #vacuumcleanerhomebudget #amazonfinds #dailyfinds #budgetshopping",https://www.amazon.in/dp/B09SB36BJX,Trending Home Finds,1000x1500px,"INALSA Wet and Dry Vacuum Cleaner for Home, 15 LTR Capacity,1400 W, 17 kPa Suction, Blower Function,HEPA Filter, Wet Vacuum Cleaner for Sofa, House Cleaning Machine,Stainless Steel Body (Micro WD15) available on Amazon",https://m.media-amazon.com/images/I/51Iaql+WytL._AC_UY218_.jpg
B0CD2RKMHZ,"JICOOT Hard Bristle Crevice Cleaning Brush - Cleaning Tools for Household Use, Multifunctional Gap Cleaning Supplies for Kitchen, Bathroom, Toilet, Window, Vehicle, Faucets, Grout, Home, Plastic",128.0,INR,4.1,"2,541",home organization products,Electronics & Gadgets,scrape,2026-05-30T11:24:27.114977,False,https://www.amazon.in/dp/B0CD2RKMHZ,,https://www.amazon.in/dp/B0CD2RKMHZ,https://www.amazon.in/dp/B0CD2RKMHZ,https://www.amazon.in/s?k=home+organization+products,daily trend,home organization products,"JICOOT Hard Bristle Crevice Cleaning Brush | Home Organization Products Price, Review And Deals","JICOOT Hard Bristle Crevice Cleaning Brush is a daily trend for home organization products. Compare current price, rating, features and exact Amazon product link before you buy.",21,63.42,63.42,low,C,post,manual-link,0,heuristic,12:00-13:30,"[""Best Home Organization Products India"", ""JICOOT Hard Bristle Crevice Cleaning Brush Review And Price"", ""Useful Amazon Find: JICOOT Hard Bristle Crevice Cleaning Brush"", ""Home Organization Products For Home And Daily Use"", ""Top Rated Home Organization Products Worth Checking""]","[""JICOOT Hard Bristle Crevice Cleaning Brush is a strong home organization products pick at around Rs. 128. Check the exact product page for latest specs, reviews and offers."", ""Looking for home organization products? JICOOT Hard Bristle Crevice Cleaning Brush has useful everyday appeal and is worth comparing before you buy."", ""Save this home organization products idea for later. JICOOT Hard Bristle Crevice Cleaning Brush may fit home, work or gifting needs depending on today's Amazon price.""]",JICOOT Hard Bristle Crevice Cleaning Brush | Home Organization Products,"JICOOT Hard Bristle Crevice Cleaning Brush is today's daily trend for home organization products. Price: Rs. 128. Check the exact product page for specs, reviews and current offers. #homeorganizationproducts #amazonfinds #dailyfinds #budgetshopping",https://www.amazon.in/dp/B0CD2RKMHZ,Trending Home Finds,1000x1500px,"JICOOT Hard Bristle Crevice Cleaning Brush - Cleaning Tools for Household Use, Multifunctional Gap Cleaning Supplies for Kitchen, Bathroom, Toilet, Window, Vehicle, Faucets, Grout, Home, Plastic available on Amazon",https://m.media-amazon.com/images/I/61INELI4GdL._AC_UL320_.jpg
B0FP2MV5N8,"UCRAVO Stylish Stackable Desk Organizer with 2 Drawers and 5 Compartments– Multi-Functional Desktop Storage Box with Pen Holder for Home, Office, School, Craft Supplies, and Art Stationery - Blue",198.0,INR,4.1,741,home organization products,Electronics & Gadgets,scrape,2026-05-30T11:24:27.112881,False,https://www.amazon.in/dp/B0FP2MV5N8,,https://www.amazon.in/dp/B0FP2MV5N8,https://www.amazon.in/dp/B0FP2MV5N8,https://www.amazon.in/s?k=home+organization+products,daily trend,home organization products,"UCRAVO Stylish Stackable Desk Organizer | Home Organization Products Price, Review And Deals","UCRAVO Stylish Stackable Desk Organizer is a daily trend for home organization products. Compare current price, rating, features and exact Amazon product link before you buy.",21,58.78,58.78,low,C,post,manual-link,0,heuristic,12:00-13:30,"[""Best Home Organization Products India"", ""UCRAVO Stylish Stackable Desk Organizer with 2 Drawers Review And Price"", ""Useful Amazon Find: UCRAVO Stylish Stackable Desk Organizer with 2 Drawers"", ""Home Organization Products For Home And Daily Use"", ""Top Rated Home Organization Products Worth Checking""]","[""UCRAVO Stylish Stackable Desk Organizer with 2 Drawers and 5 Compartment is a strong home organization products pick at around Rs. 198. Check the exact product page for latest specs, reviews and offers."", ""Looking for home organization products? UCRAVO Stylish Stackable Desk Organizer with 2 Drawers and 5 Compartment has useful everyday appeal and is worth comparing before you buy."", ""Save this home organization products idea for later. UCRAVO Stylish Stackable Desk Organizer with 2 Drawers and 5 Compartment may fit home, work or gifting needs depending on today's Amazon price.""]",UCRAVO Stylish Stackable Desk Organizer | Home Organization Products,"UCRAVO Stylish Stackable Desk Organizer is today's daily trend for home organization products. Price: Rs. 198. Check the exact product page for specs, reviews and current offers. #homeorganizationproducts #amazonfinds #dailyfinds #budgetshopping",https://www.amazon.in/dp/B0FP2MV5N8,Trending Home Finds,1000x1500px,"UCRAVO Stylish Stackable Desk Organizer with 2 Drawers and 5 Compartments– Multi-Functional Desktop Storage Box with Pen Holder for Home, Office, School, Craft Supplies, and Art Stationery - Blue available on Amazon",https://m.media-amazon.com/images/I/71r9ps4DXWL._AC_UL320_.jpg
B0DNQTZPNN,Check each product page for other buying options. Price and other details may vary based on product size and colour,,INR,3.8,,home organization products,Electronics & Gadgets,scrape,2026-05-30T11:24:27.105275,False,https://www.amazon.in/dp/B0DNQTZPNN,,https://www.amazon.in/dp/B0DNQTZPNN,https://www.amazon.in/dp/B0DNQTZPNN,https://www.amazon.in/s?k=home+organization+products,daily trend,home organization products,"Check each product page | Home Organization Products Price, Review And Deals","Check each product page is a daily trend for home organization products. Compare current price, rating, features and exact Amazon product link before you buy.",21,40.05,40.05,medium,D,review,"missing-image, manual-link",0,heuristic,12:00-13:30,"[""Best Home Organization Products India"", ""Check each product page for other buying options. Pric Review And Price"", ""Useful Amazon Find: Check each product page for other buying options. Pric"", ""Home Organization Products For Home And Daily Use"", ""Top Rated Home Organization Products Worth Checking""]","[""Check each product page for other buying options. Price and other detail is a strong home organization products pick at with current Amazon pricing. Check the exact product page for latest specs, reviews and offers."", ""Looking for home organization products? Check each product page for other buying options. Price and other detail has useful everyday appeal and is worth comparing before you buy."", ""Save this home organization products idea for later. Check each product page for other buying options. Price and other detail may fit home, work or gifting needs depending on today's Amazon price.""]",Check each product page | Home Organization Products,"Check each product page is today's daily trend for home organization products. Price: check listing. Check the exact product page for specs, reviews and current offers. #homeorganizationproducts #amazonfinds #dailyfinds #budgetshopping",https://www.amazon.in/dp/B0DNQTZPNN,Trending Home Finds,1000x1500px,Check each product page for other buying options. Price and other details may vary based on product size and colour available on Amazon,
B0DCZ3WDTB,"Xiaomi Power Bank 4i 20000mAh 33W Super Fast Charging PD |Smart 12 Layer Protection|Type C Input & Output|Triple Output Ports|Supports Android,Apple, Tablets, Earbuds,Watch(MI Powerbank),Black",1799.0,INR,4.2,10314,portable power bank best seller,Electronics & Gadgets,scrape,20260530010422.83,False,https://www.amazon.in/dp/B0DCZ3WDTB,,https://www.amazon.in/dp/B0DCZ3WDTB,https://www.amazon.in/dp/B0DCZ3WDTB,https://www.amazon.in/s?k=portable+power+bank+best+seller,best seller,portable power bank best seller,"Xiaomi Power Bank 4i 20000mAh 33W Super Fast Charging PD | Portable Power Bank Best Seller Price, Review And Deals","Xiaomi Power Bank 4i 20000mAh 33W Super Fast Charging PD is a best seller for portable power bank best seller. Compare current price, rating, features and exact Amazon product link before you buy.",26,84.7,84.7,medium,A,post,manual-link,0,heuristic,07:30-09:00,"[""Best Portable Power Bank Best Seller Under Rs 1800 India"", ""Xiaomi Power Bank 4i 20000mAh 33W Super Fast Charging Review And Price"", ""Useful Amazon Find: Xiaomi Power Bank 4i 20000mAh 33W Super Fast Charging"", ""Portable Power Bank Best Seller For Home And Daily Use"", ""Top Rated Portable Power Bank Best Seller Worth Checking""]","[""Xiaomi Power Bank 4i 20000mAh 33W Super Fast Charging PD is a strong portable power bank best seller pick at around Rs. 1,799. Check the exact product page for latest specs, reviews and offers."", ""Looking for portable power bank best seller? Xiaomi Power Bank 4i 20000mAh 33W Super Fast Charging PD has useful everyday appeal and is worth comparing before you buy."", ""Save this portable power bank best seller idea for later. Xiaomi Power Bank 4i 20000mAh 33W Super Fast Charging PD may fit home, work or gifting needs depending on today's Amazon price.""]",Xiaomi Power Bank 4i 20000mAh 33W Super Fast Charging PD | Portable Power Bank Best Seller,"Xiaomi Power Bank 4i 20000mAh 33W Super Fast Charging PD is today's best seller for portable power bank best seller. Price: Rs. 1,799. Check the exact product page for specs, reviews and current offers. #portablepowerbankbestseller #amazonfinds #dailyfinds #budgetshopping",https://www.amazon.in/dp/B0DCZ3WDTB,Viral Amazon Finds,10001500,"Xiaomi Power Bank 4i 20000mAh 33W Super Fast Charging PD |Smart 12 Layer Protection|Type C Input & Output|Triple Output Ports|Supports Android,Apple, Tablets, Earbuds,Watch(MI Powerbank),Black available on Amazon",https://m.media-amazon.com/images/I/41vBAaU8clL._AC_UY218_.jpg
