asin,title,price,currency,rating,reviews,keyword,category,source,fetched_at,has_affiliate,product_url,affiliate_link,manual_link,sitestripe_url,search_url,trend_label,seo_keyword,google_title,google_description,trend_score,product_score,ai_score,conversion_score,buyer_intent,quality_grade,recommendation,ai_action,risk_flags,hf_signal,hf_signal_source,hf_category,hf_category_score,hf_image_label,hf_image_score,duplicate_cluster,best_posting_window,seo_title_variants,caption_variants,pin_title,pin_description,pin_link,pin_board,pin_image_size,pin_alt_text,image_url
B09BFV96TS,"Dyazo Water Resistant Laptop Sleeve/Laptop case/laptop cover with Handle Compatible for 15 Inch to 15.6"" Inches laptops & Notebooks - Grey",299.0,INR,4.3,"23,346",laptop accessories best sellers,Electronics & Gadgets,scrape,2026-06-19T12:51:01.878616,False,https://www.amazon.in/dp/B09BFV96TS,,https://www.amazon.in/dp/B09BFV96TS,https://www.amazon.in/dp/B09BFV96TS,https://www.amazon.in/s?k=laptop+accessories+best+sellers,best seller,laptop accessories best sellers,"Dyazo Water Resistant Laptop Sleeve/Laptop case/laptop cover | Laptop Accessories Best Sellers Price, Review And Deals","Dyazo Water Resistant Laptop Sleeve/Laptop case/laptop cover is a best seller for laptop accessories best sellers. Compare current price, rating, features and exact Amazon product link before you buy.",16,79.65,79.65,77.78,medium,A,post,post,manual-link,0,heuristic,heuristic,0.0,heuristic,0.0,1da76f3642a7,07:30-09:00,"[""Best Laptop Accessories Best Sellers Under Rs 300 India"", ""Dyazo Water Resistant Laptop Sleeve/Laptop case/laptop Review And Price"", ""Useful Amazon Find: Dyazo Water Resistant Laptop Sleeve/Laptop case/laptop"", ""Laptop Accessories Best Sellers For Home And Daily Use"", ""Top Rated Laptop Accessories Best Sellers Worth Checking""]","[""Dyazo Water Resistant Laptop Sleeve/Laptop case/laptop cover with Handle is a strong laptop accessories best sellers pick at around Rs. 299. Check the exact product page for latest specs, reviews and offers."", ""Looking for laptop accessories best sellers? Dyazo Water Resistant Laptop Sleeve/Laptop case/laptop cover with Handle has useful everyday appeal and is worth comparing before you buy."", ""Save this laptop accessories best sellers idea for later. Dyazo Water Resistant Laptop Sleeve/Laptop case/laptop cover with Handle may fit home, work or gifting needs depending on today's Amazon price.""]",Dyazo Water Resistant Laptop Sleeve/Laptop case/laptop cover | Laptop Accessories Best Sellers,"Dyazo Water Resistant Laptop Sleeve/Laptop case/laptop cover is today's best seller for laptop accessories best sellers. Price: Rs. 299. Check the exact product page for specs, reviews and current offers. #laptopaccessoriesbestsellers #amazonfinds #dailyfinds #budgetshopping",https://www.amazon.in/dp/B09BFV96TS,Budget Tech And Desk Setup,1000x1500px,"Dyazo Water Resistant Laptop Sleeve/Laptop case/laptop cover with Handle Compatible for 15 Inch to 15.6"" Inches laptops & Notebooks - Grey available on Amazon",https://m.media-amazon.com/images/I/81rRMwFG0+L._AC_UY218_.jpg
B08LHTJTBB,"Dyazo 6 Angles Adjustable Aluminum Ergonomic Foldable Portable Tabletop Laptop/Desktop Riser Stand Holder Compatible for MacBook, HP, Dell, Lenovo & All Other Notebook (Silver)",389.0,INR,4.3,"19,259",laptop accessories best sellers,Electronics & Gadgets,scrape,2026-06-19T12:51:01.879411,False,https://www.amazon.in/dp/B08LHTJTBB,,https://www.amazon.in/dp/B08LHTJTBB,https://www.amazon.in/dp/B08LHTJTBB,https://www.amazon.in/s?k=laptop+accessories+best+sellers,best seller,laptop accessories best sellers,"Dyazo 6 Angles Adjustable Aluminum Ergonomic Foldable Portable T | Laptop Accessories Best Sellers Price, Review And Dea","Dyazo 6 Angles Adjustable Aluminum Ergonomic Foldable Portable T is a best seller for laptop accessories best sellers. Compare current price, rating, features and exact Amazon product link before you buy.",16,79.65,79.65,77.78,medium,A,post,post,manual-link,0,heuristic,heuristic,0.0,heuristic,0.0,30bd83317d7c,07:30-09:00,"[""Best Laptop Accessories Best Sellers Under Rs 400 India"", ""Dyazo 6 Angles Adjustable Aluminum Ergonomic Foldable Review And Price"", ""Useful Amazon Find: Dyazo 6 Angles Adjustable Aluminum Ergonomic Foldable"", ""Laptop Accessories Best Sellers For Home And Daily Use"", ""Top Rated Laptop Accessories Best Sellers Worth Checking""]","[""Dyazo 6 Angles Adjustable Aluminum Ergonomic Foldable Portable Tabletop  is a strong laptop accessories best sellers pick at around Rs. 389. Check the exact product page for latest specs, reviews and offers."", ""Looking for laptop accessories best sellers? Dyazo 6 Angles Adjustable Aluminum Ergonomic Foldable Portable Tabletop  has useful everyday appeal and is worth comparing before you buy."", ""Save this laptop accessories best sellers idea for later. Dyazo 6 Angles Adjustable Aluminum Ergonomic Foldable Portable Tabletop  may fit home, work or gifting needs depending on today's Amazon price.""]",Dyazo 6 Angles Adjustable Aluminum Ergonomic Foldable Portable T | Laptop Accessories Best Sellers,"Dyazo 6 Angles Adjustable Aluminum Ergonomic Foldable Portable T is today's best seller for laptop accessories best sellers. Price: Rs. 389. Check the exact product page for specs, reviews and current offers. #laptopaccessoriesbestsellers #amazonfinds #dailyfinds #budgetshopping",https://www.amazon.in/dp/B08LHTJTBB,Budget Tech And Desk Setup,1000x1500px,"Dyazo 6 Angles Adjustable Aluminum Ergonomic Foldable Portable Tabletop Laptop/Desktop Riser Stand Holder Compatible for MacBook, HP, Dell, Lenovo & All Other Notebook (Silver) available on Amazon",https://m.media-amazon.com/images/I/61kBmC8NfGL._AC_UY218_.jpg
B07XCM6T4N,STRIFF Adjustable Laptop Tabletop Stand Patented Riser Ventilated Portable Foldable Compatible with MacBook Notebook Tablet Tray Desk Table Book with Free Phone Stand (Black),249.0,INR,4.3,"44,018",laptop accessories best sellers,Electronics & Gadgets,scrape,2026-06-19T12:51:01.877034,False,https://www.amazon.in/dp/B07XCM6T4N,,https://www.amazon.in/dp/B07XCM6T4N,https://www.amazon.in/dp/B07XCM6T4N,https://www.amazon.in/s?k=laptop+accessories+best+sellers,best seller,laptop accessories best sellers,"STRIFF Adjustable Laptop Tabletop Stand Patented Riser Ventilate | Laptop Accessories Best Sellers Price, Review And Dea","STRIFF Adjustable Laptop Tabletop Stand Patented Riser Ventilate is a best seller for laptop accessories best sellers. Compare current price, rating, features and exact Amazon product link before you buy.",16,72.99,72.99,67.73,medium,B,post,post,manual-link,0,heuristic,heuristic,0.0,heuristic,0.0,6f9639697970,07:30-09:00,"[""Best Laptop Accessories Best Sellers India"", ""STRIFF Adjustable Laptop Tabletop Stand Patented Riser Review And Price"", ""Useful Amazon Find: STRIFF Adjustable Laptop Tabletop Stand Patented Riser"", ""Laptop Accessories Best Sellers For Home And Daily Use"", ""Top Rated Laptop Accessories Best Sellers Worth Checking""]","[""STRIFF Adjustable Laptop Tabletop Stand Patented Riser Ventilated Portab is a strong laptop accessories best sellers pick at around Rs. 249. Check the exact product page for latest specs, reviews and offers."", ""Looking for laptop accessories best sellers? STRIFF Adjustable Laptop Tabletop Stand Patented Riser Ventilated Portab has useful everyday appeal and is worth comparing before you buy."", ""Save this laptop accessories best sellers idea for later. STRIFF Adjustable Laptop Tabletop Stand Patented Riser Ventilated Portab may fit home, work or gifting needs depending on today's Amazon price.""]",STRIFF Adjustable Laptop Tabletop Stand Patented Riser Ventilate | Laptop Accessories Best Sellers,"STRIFF Adjustable Laptop Tabletop Stand Patented Riser Ventilate is today's best seller for laptop accessories best sellers. Price: Rs. 249. Check the exact product page for specs, reviews and current offers. #laptopaccessoriesbestsellers #amazonfinds #dailyfinds #budgetshopping",https://www.amazon.in/dp/B07XCM6T4N,Budget Tech And Desk Setup,1000x1500px,STRIFF Adjustable Laptop Tabletop Stand Patented Riser Ventilated Portable Foldable Compatible with MacBook Notebook Tablet Tray Desk Table Book with Free Phone Stand (Black) available on Amazon,https://m.media-amazon.com/images/I/71Zf9uUp+GL._AC_UY218_.jpg
B0B77X44MX,"Boldfit Hand Gripper for Men & Women Hand Grip Strengthener for Forearm, Wrist & Finger Workout Fitness Equipment for Home & Gym Training",179.0,INR,4.1,"37,127",fitness accessories for home workout,Electronics & Gadgets,scrape,2026-06-19T12:50:49.443865,False,https://www.amazon.in/dp/B0B77X44MX,,https://www.amazon.in/dp/B0B77X44MX,https://www.amazon.in/dp/B0B77X44MX,https://www.amazon.in/s?k=fitness+accessories+for+home+workout,daily trend,fitness accessories for home workout,"Boldfit Hand Gripper | Fitness Accessories For Home Workout Price, Review And Deals","Boldfit Hand Gripper is a daily trend for fitness accessories for home workout. Compare current price, rating, features and exact Amazon product link before you buy.",22,71.89,71.89,61.55,low,B,post,post,manual-link,0,heuristic,heuristic,0.0,heuristic,0.0,0ec2ff8c2dc3,12:00-13:30,"[""Best Fitness Accessories For Home Workout India"", ""Boldfit Hand Gripper for Men & Women Hand Grip Strengt Review And Price"", ""Useful Amazon Find: Boldfit Hand Gripper for Men & Women Hand Grip Strengt"", ""Fitness Accessories For Home Workout For Home And Daily Use"", ""Top Rated Fitness Accessories For Home Workout Worth Checking""]","[""Boldfit Hand Gripper for Men & Women Hand Grip Strengthener for Forearm, is a strong fitness accessories for home workout pick at around Rs. 179. Check the exact product page for latest specs, reviews and offers."", ""Looking for fitness accessories for home workout? Boldfit Hand Gripper for Men & Women Hand Grip Strengthener for Forearm, has useful everyday appeal and is worth comparing before you buy."", ""Save this fitness accessories for home workout idea for later. Boldfit Hand Gripper for Men & Women Hand Grip Strengthener for Forearm, may fit home, work or gifting needs depending on today's Amazon price.""]",Boldfit Hand Gripper | Fitness Accessories For Home Workout,"Boldfit Hand Gripper is today's daily trend for fitness accessories for home workout. Price: Rs. 179. Check the exact product page for specs, reviews and current offers. #fitnessaccessoriesforhomeworkout #amazonfinds #dailyfinds #budgetshopping",https://www.amazon.in/dp/B0B77X44MX,Trending Home Finds,1000x1500px,"Boldfit Hand Gripper for Men & Women Hand Grip Strengthener for Forearm, Wrist & Finger Workout Fitness Equipment for Home & Gym Training available on Amazon",https://m.media-amazon.com/images/I/612AmJbiG1L._AC_UL320_.jpg
B08VNYBLB1,"CELLBELL Desire C104 Ergonomic Mesh Office Chair for Home & Office | Mid Back Computer Chair with Adjustable Support, Smart Tilt Lock, Height Adjustment, Metal Base & 360° Swivel Wheels (Blue)",3599.0,INR,4.1,"9,814",office chair ergonomic budget,Electronics & Gadgets,scrape,2026-06-19T12:51:18.232091,False,https://www.amazon.in/dp/B08VNYBLB1,,https://www.amazon.in/dp/B08VNYBLB1,https://www.amazon.in/dp/B08VNYBLB1,https://www.amazon.in/s?k=office+chair+ergonomic+budget,budget pick,office chair ergonomic budget,"CELLBELL Desire C104 Ergonomic Mesh Office Chair | Office Chair Ergonomic Budget Price, Review And Deals","CELLBELL Desire C104 Ergonomic Mesh Office Chair is a budget pick for office chair ergonomic budget. Compare current price, rating, features and exact Amazon product link before you buy.",7,70.9,70.9,69.4,medium,B,post,post,manual-link,0,heuristic,heuristic,0.0,heuristic,0.0,86b9f9be051b,12:00-13:30,"[""Best Office Chair Ergonomic Budget Under Rs 3600 India"", ""CELLBELL Desire C104 Ergonomic Mesh Office Chair for H Review And Price"", ""Useful Amazon Find: CELLBELL Desire C104 Ergonomic Mesh Office Chair for H"", ""Office Chair Ergonomic Budget For Home And Daily Use"", ""Top Rated Office Chair Ergonomic Budget Worth Checking""]","[""CELLBELL Desire C104 Ergonomic Mesh Office Chair for Home & Office is a strong office chair ergonomic budget pick at around Rs. 3,599. Check the exact product page for latest specs, reviews and offers."", ""Looking for office chair ergonomic budget? CELLBELL Desire C104 Ergonomic Mesh Office Chair for Home & Office has useful everyday appeal and is worth comparing before you buy."", ""Save this office chair ergonomic budget idea for later. CELLBELL Desire C104 Ergonomic Mesh Office Chair for Home & Office may fit home, work or gifting needs depending on today's Amazon price.""]",CELLBELL Desire C104 Ergonomic Mesh Office Chair | Office Chair Ergonomic Budget,"CELLBELL Desire C104 Ergonomic Mesh Office Chair is today's budget pick for office chair ergonomic budget. Price: Rs. 3,599. Check the exact product page for specs, reviews and current offers. #officechairergonomicbudget #amazonfinds #dailyfinds #budgetshopping",https://www.amazon.in/dp/B08VNYBLB1,Budget Tech And Desk Setup,1000x1500px,"CELLBELL Desire C104 Ergonomic Mesh Office Chair for Home & Office | Mid Back Computer Chair with Adjustable Support, Smart Tilt Lock, Height Adjustment, Metal Base & 360° Swivel Wheels (Blue) available on Amazon",https://m.media-amazon.com/images/I/61iSIW9HZTL._AC_UL320_.jpg
B08H8KD72Q,Boldfit Heavy Resistance Band for Workout Set Exercise & Stretching Pull Up Bands for Home Exercise for Gym Men & Women Loop Bands Toning Bands Resistance Band Yellow (3-7 Kg),178.0,INR,4.1,"6,016",fitness accessories for home workout,Electronics & Gadgets,scrape,2026-06-19T12:50:49.445350,False,https://www.amazon.in/dp/B08H8KD72Q,,https://www.amazon.in/dp/B08H8KD72Q,https://www.amazon.in/dp/B08H8KD72Q,https://www.amazon.in/s?k=fitness+accessories+for+home+workout,daily trend,fitness accessories for home workout,"Boldfit Heavy Resistance Band | Fitness Accessories For Home Workout Price, Review And Deals","Boldfit Heavy Resistance Band is a daily trend for fitness accessories for home workout. Compare current price, rating, features and exact Amazon product link before you buy.",22,69.4,69.4,60.01,low,B,post,post,manual-link,0,heuristic,heuristic,0.0,heuristic,0.0,fb73ec20a512,12:00-13:30,"[""Best Fitness Accessories For Home Workout India"", ""Boldfit Heavy Resistance Band for Workout Set Exercise Review And Price"", ""Useful Amazon Find: Boldfit Heavy Resistance Band for Workout Set Exercise"", ""Fitness Accessories For Home Workout For Home And Daily Use"", ""Top Rated Fitness Accessories For Home Workout Worth Checking""]","[""Boldfit Heavy Resistance Band for Workout Set Exercise & Stretching Pull is a strong fitness accessories for home workout pick at around Rs. 178. Check the exact product page for latest specs, reviews and offers."", ""Looking for fitness accessories for home workout? Boldfit Heavy Resistance Band for Workout Set Exercise & Stretching Pull has useful everyday appeal and is worth comparing before you buy."", ""Save this fitness accessories for home workout idea for later. Boldfit Heavy Resistance Band for Workout Set Exercise & Stretching Pull may fit home, work or gifting needs depending on today's Amazon price.""]",Boldfit Heavy Resistance Band | Fitness Accessories For Home Workout,"Boldfit Heavy Resistance Band is today's daily trend for fitness accessories for home workout. Price: Rs. 178. Check the exact product page for specs, reviews and current offers. #fitnessaccessoriesforhomeworkout #amazonfinds #dailyfinds #budgetshopping",https://www.amazon.in/dp/B08H8KD72Q,Trending Home Finds,1000x1500px,Boldfit Heavy Resistance Band for Workout Set Exercise & Stretching Pull Up Bands for Home Exercise for Gym Men & Women Loop Bands Toning Bands Resistance Band Yellow (3-7 Kg) available on Amazon,https://m.media-amazon.com/images/I/61JlKYdhFdL._AC_UL320_.jpg
B0GTFV15PS,"5 Pcs Laptop Accessories Combo with Adjustable Aluminum Laptop Stand, 7-in-1 Electronic Cleaner, Silicone Keyboard Cover, Data Cable Set & Shortcut Mouse Pad for Office Study Travel",853.0,INR,5.0,1,laptop accessories best sellers,Electronics & Gadgets,scrape,2026-06-19T12:51:01.877824,False,https://www.amazon.in/dp/B0GTFV15PS,,https://www.amazon.in/dp/B0GTFV15PS,https://www.amazon.in/dp/B0GTFV15PS,https://www.amazon.in/s?k=laptop+accessories+best+sellers,best seller,laptop accessories best sellers,"5 Pcs Laptop Accessories Combo | Laptop Accessories Best Sellers Price, Review And Deals","5 Pcs Laptop Accessories Combo is a best seller for laptop accessories best sellers. Compare current price, rating, features and exact Amazon product link before you buy.",16,65.62,65.62,70.84,high,B,post,post,"low-review-proof, manual-link",0,heuristic,heuristic,0.0,heuristic,0.0,15469f708601,07:30-09:00,"[""Best Laptop Accessories Best Sellers Under Rs 900 India"", ""5 Pcs Laptop Accessories Combo with Adjustable Aluminu Review And Price"", ""Useful Amazon Find: 5 Pcs Laptop Accessories Combo with Adjustable Aluminu"", ""Laptop Accessories Best Sellers For Home And Daily Use"", ""Top Rated Laptop Accessories Best Sellers Worth Checking""]","[""5 Pcs Laptop Accessories Combo with Adjustable Aluminum Laptop Stand, 7- is a strong laptop accessories best sellers pick at around Rs. 853. Check the exact product page for latest specs, reviews and offers."", ""Looking for laptop accessories best sellers? 5 Pcs Laptop Accessories Combo with Adjustable Aluminum Laptop Stand, 7- has useful everyday appeal and is worth comparing before you buy."", ""Save this laptop accessories best sellers idea for later. 5 Pcs Laptop Accessories Combo with Adjustable Aluminum Laptop Stand, 7- may fit home, work or gifting needs depending on today's Amazon price.""]",5 Pcs Laptop Accessories Combo | Laptop Accessories Best Sellers,"5 Pcs Laptop Accessories Combo is today's best seller for laptop accessories best sellers. Price: Rs. 853. Check the exact product page for specs, reviews and current offers. #laptopaccessoriesbestsellers #amazonfinds #dailyfinds #budgetshopping",https://www.amazon.in/dp/B0GTFV15PS,Budget Tech And Desk Setup,1000x1500px,"5 Pcs Laptop Accessories Combo with Adjustable Aluminum Laptop Stand, 7-in-1 Electronic Cleaner, Silicone Keyboard Cover, Data Cable Set & Shortcut Mouse Pad for Office Study Travel available on Amazon",https://m.media-amazon.com/images/I/814xxMqNlwL._AC_UY218_.jpg
B0D2XZ6SZC,IAFA FURNITURE® Diego Mid-Back Mesh Office Chair | 3 Year Warranty | Ergonomic Study | Computer Chair with Revolving Base | Tilting & Height Adjustable Mechanism | Heavy-Duty Metal Base (Black) (DIY),2999.0,INR,3.6,"1,723",office chair ergonomic budget,Electronics & Gadgets,scrape,2026-06-19T12:51:18.229550,False,https://www.amazon.in/dp/B0D2XZ6SZC,,https://www.amazon.in/dp/B0D2XZ6SZC,https://www.amazon.in/dp/B0D2XZ6SZC,https://www.amazon.in/s?k=office+chair+ergonomic+budget,budget pick,office chair ergonomic budget,"IAFA FURNITURE® Diego Mid-Back Mesh Office Chair | Office Chair Ergonomic Budget Price, Review And Deals","IAFA FURNITURE® Diego Mid-Back Mesh Office Chair is a budget pick for office chair ergonomic budget. Compare current price, rating, features and exact Amazon product link before you buy.",7,58.91,58.91,60.3,low,C,post,post,"low-rating, manual-link",0,heuristic,heuristic,0.0,heuristic,0.0,f56735ebc843,22:00-23:00,"[""Best Office Chair Ergonomic Budget Under Rs 3000 India"", ""IAFA FURNITURE® Diego Mid-Back Mesh Office Chair Review And Price"", ""Useful Amazon Find: IAFA FURNITURE® Diego Mid-Back Mesh Office Chair"", ""Office Chair Ergonomic Budget For Home And Daily Use"", ""Top Rated Office Chair Ergonomic Budget Worth Checking""]","[""IAFA FURNITURE® Diego Mid-Back Mesh Office Chair is a strong office chair ergonomic budget pick at around Rs. 2,999. Check the exact product page for latest specs, reviews and offers."", ""Looking for office chair ergonomic budget? IAFA FURNITURE® Diego Mid-Back Mesh Office Chair has useful everyday appeal and is worth comparing before you buy."", ""Save this office chair ergonomic budget idea for later. IAFA FURNITURE® Diego Mid-Back Mesh Office Chair may fit home, work or gifting needs depending on today's Amazon price.""]",IAFA FURNITURE® Diego Mid-Back Mesh Office Chair | Office Chair Ergonomic Budget,"IAFA FURNITURE® Diego Mid-Back Mesh Office Chair is today's budget pick for office chair ergonomic budget. Price: Rs. 2,999. Check the exact product page for specs, reviews and current offers. #officechairergonomicbudget #amazonfinds #dailyfinds #budgetshopping",https://www.amazon.in/dp/B0D2XZ6SZC,Budget Tech And Desk Setup,1000x1500px,IAFA FURNITURE® Diego Mid-Back Mesh Office Chair | 3 Year Warranty | Ergonomic Study | Computer Chair with Revolving Base | Tilting & Height Adjustable Mechanism | Heavy-Duty Metal Base (Black) (DIY) available on Amazon,https://m.media-amazon.com/images/I/71zC-swECpL._AC_UL320_.jpg
B09F37RYYL,Check each product page for other buying options. Price and other details may vary based on product size and colour,16899.0,INR,4.4,,fitness accessories for home workout,Electronics & Gadgets,scrape,2026-06-19T12:50:49.442321,False,https://www.amazon.in/dp/B09F37RYYL,,https://www.amazon.in/dp/B09F37RYYL,https://www.amazon.in/dp/B09F37RYYL,https://www.amazon.in/s?k=fitness+accessories+for+home+workout,daily trend,fitness accessories for home workout,"Check each product page | Fitness Accessories For Home Workout Price, Review And Deals","Check each product page is a daily trend for fitness accessories for home workout. Compare current price, rating, features and exact Amazon product link before you buy.",22,42.58,42.58,44.8,medium,D,review,improve,"missing-image, manual-link, high-price",0,heuristic,heuristic,0.0,heuristic,0.0,896216195bf1,12:00-13:30,"[""Best Fitness Accessories For Home Workout India"", ""Check each product page for other buying options. Pric Review And Price"", ""Useful Amazon Find: Check each product page for other buying options. Pric"", ""Fitness Accessories For Home Workout For Home And Daily Use"", ""Top Rated Fitness Accessories For Home Workout Worth Checking""]","[""Check each product page for other buying options. Price and other detail is a strong fitness accessories for home workout pick at around Rs. 16,899. Check the exact product page for latest specs, reviews and offers."", ""Looking for fitness accessories for home workout? Check each product page for other buying options. Price and other detail has useful everyday appeal and is worth comparing before you buy."", ""Save this fitness accessories for home workout idea for later. Check each product page for other buying options. Price and other detail may fit home, work or gifting needs depending on today's Amazon price.""]",Check each product page | Fitness Accessories For Home Workout,"Check each product page is today's daily trend for fitness accessories for home workout. Price: Rs. 16,899. Check the exact product page for specs, reviews and current offers. #fitnessaccessoriesforhomeworkout #amazonfinds #dailyfinds #budgetshopping",https://www.amazon.in/dp/B09F37RYYL,Trending Home Finds,1000x1500px,Check each product page for other buying options. Price and other details may vary based on product size and colour available on Amazon,
B0DF6BBPWW,"Lifeline Multi Home Gym Leg Press Machine HG 008 with Preacher Curl & Ab Crunch 72 Kg Weight Stack, Home Gym Equipment Strength Training Workout Gym Exercise Machine, Free Home Installation",27999.0,INR,4.4,,fitness accessories for home workout,Electronics & Gadgets,scrape,2026-06-19T12:50:49.439792,False,https://www.amazon.in/dp/B0DF6BBPWW,,https://www.amazon.in/dp/B0DF6BBPWW,https://www.amazon.in/dp/B0DF6BBPWW,https://www.amazon.in/s?k=fitness+accessories+for+home+workout,daily trend,fitness accessories for home workout,"Lifeline Multi Home Gym Leg Press Machine HG 008 | Fitness Accessories For Home Workout Price, Review And Deals","Lifeline Multi Home Gym Leg Press Machine HG 008 is a daily trend for fitness accessories for home workout. Compare current price, rating, features and exact Amazon product link before you buy.",22,39.64,39.64,38.36,low,D,review,improve,"missing-image, manual-link, high-price",0,heuristic,heuristic,0.0,heuristic,0.0,831fca216464,12:00-13:30,"[""Best Fitness Accessories For Home Workout India"", ""Lifeline Multi Home Gym Leg Press Machine HG 008 with Review And Price"", ""Useful Amazon Find: Lifeline Multi Home Gym Leg Press Machine HG 008 with"", ""Fitness Accessories For Home Workout For Home And Daily Use"", ""Top Rated Fitness Accessories For Home Workout Worth Checking""]","[""Lifeline Multi Home Gym Leg Press Machine HG 008 with Preacher Curl & Ab is a strong fitness accessories for home workout pick at around Rs. 27,999. Check the exact product page for latest specs, reviews and offers."", ""Looking for fitness accessories for home workout? Lifeline Multi Home Gym Leg Press Machine HG 008 with Preacher Curl & Ab has useful everyday appeal and is worth comparing before you buy."", ""Save this fitness accessories for home workout idea for later. Lifeline Multi Home Gym Leg Press Machine HG 008 with Preacher Curl & Ab may fit home, work or gifting needs depending on today's Amazon price.""]",Lifeline Multi Home Gym Leg Press Machine HG 008 | Fitness Accessories For Home Workout,"Lifeline Multi Home Gym Leg Press Machine HG 008 is today's daily trend for fitness accessories for home workout. Price: Rs. 27,999. Check the exact product page for specs, reviews and current offers. #fitnessaccessoriesforhomeworkout #amazonfinds #dailyfinds #budgetshopping",https://www.amazon.in/dp/B0DF6BBPWW,Trending Home Finds,1000x1500px,"Lifeline Multi Home Gym Leg Press Machine HG 008 with Preacher Curl & Ab Crunch 72 Kg Weight Stack, Home Gym Equipment Strength Training Workout Gym Exercise Machine, Free Home Installation available on Amazon",
