asin,title,price,currency,rating,reviews,keyword,category,source,fetched_at,has_affiliate,product_url,affiliate_link,manual_link,sitestripe_url,search_url,trend_label,seo_keyword,google_title,google_description,trend_score,product_score,ai_score,buyer_intent,quality_grade,recommendation,risk_flags,hf_signal,hf_signal_source,best_posting_window,seo_title_variants,caption_variants,pin_title,pin_description,pin_link,pin_board,pin_image_size,pin_alt_text,image_url
B09SB36BJX,"INALSA Wet and Dry Vacuum Cleaner for Home, 15 LTR Capacity,1400 W, 17 kPa Suction, Blower Function,HEPA Filter, Wet Vacuum Cleaner for Sofa, House Cleaning Machine,Stainless Steel Body (Micro WD15)",4399.0,INR,4.2,3144,vacuum cleaner home budget,Electronics & Gadgets,scrape,20260531115754.1,False,https://www.amazon.in/dp/B09SB36BJX,,https://www.amazon.in/dp/B09SB36BJX,https://www.amazon.in/dp/B09SB36BJX,https://www.amazon.in/s?k=vacuum+cleaner+home+budget,budget pick,vacuum cleaner home budget,"INALSA Wet and Dry Vacuum Cleaner | Vacuum Cleaner Home Budget Price, Review And Deals","INALSA Wet and Dry Vacuum Cleaner is a budget pick for vacuum cleaner home budget. Compare current price, rating, features and exact Amazon product link before you buy.",5,63.46,63.46,medium,C,post,manual-link,0,heuristic,12:00-13:30,"[""Best Vacuum Cleaner Home Budget Under Rs 4400 India"", ""INALSA Wet and Dry Vacuum Cleaner for Home, 15 LTR Cap Review And Price"", ""Useful Amazon Find: INALSA Wet and Dry Vacuum Cleaner for Home, 15 LTR Cap"", ""Vacuum Cleaner Home Budget For Home And Daily Use"", ""Top Rated Vacuum Cleaner Home Budget Worth Checking""]","[""INALSA Wet and Dry Vacuum Cleaner for Home, 15 LTR Capacity,1400 W, 17 k is a strong vacuum cleaner home budget pick at around Rs. 4,399. Check the exact product page for latest specs, reviews and offers."", ""Looking for vacuum cleaner home budget? INALSA Wet and Dry Vacuum Cleaner for Home, 15 LTR Capacity,1400 W, 17 k has useful everyday appeal and is worth comparing before you buy."", ""Save this vacuum cleaner home budget idea for later. INALSA Wet and Dry Vacuum Cleaner for Home, 15 LTR Capacity,1400 W, 17 k may fit home, work or gifting needs depending on today's Amazon price.""]",INALSA Wet and Dry Vacuum Cleaner | Vacuum Cleaner Home Budget,"INALSA Wet and Dry Vacuum Cleaner is today's budget pick for vacuum cleaner home budget. Price: Rs. 4,399. Check the exact product page for specs, reviews and current offers. #vacuumcleanerhomebudget #amazonfinds #dailyfinds #budgetshopping",https://www.amazon.in/dp/B09SB36BJX,Trending Home Finds,10001500,"INALSA Wet and Dry Vacuum Cleaner for Home, 15 LTR Capacity,1400 W, 17 kPa Suction, Blower Function,HEPA Filter, Wet Vacuum Cleaner for Sofa, House Cleaning Machine,Stainless Steel Body (Micro WD15) available on Amazon",https://m.media-amazon.com/images/I/51Iaql+WytL._AC_UY218_.jpg
B0CD2RKMHZ,"JICOOT Hard Bristle Crevice Cleaning Brush - Cleaning Tools for Household Use, Multifunctional Gap Cleaning Supplies for Kitchen, Bathroom, Toilet, Window, Vehicle, Faucets, Grout, Home, Plastic",128.0,INR,4.1,2541,home organization products,Electronics & Gadgets,scrape,20260531115754.1,False,https://www.amazon.in/dp/B0CD2RKMHZ,,https://www.amazon.in/dp/B0CD2RKMHZ,https://www.amazon.in/dp/B0CD2RKMHZ,https://www.amazon.in/s?k=home+organization+products,daily trend,home organization products,"JICOOT Hard Bristle Crevice Cleaning Brush | Home Organization Products Price, Review And Deals","JICOOT Hard Bristle Crevice Cleaning Brush is a daily trend for home organization products. Compare current price, rating, features and exact Amazon product link before you buy.",21,63.42,63.42,low,C,post,manual-link,0,heuristic,12:00-13:30,"[""Best Home Organization Products India"", ""JICOOT Hard Bristle Crevice Cleaning Brush Review And Price"", ""Useful Amazon Find: JICOOT Hard Bristle Crevice Cleaning Brush"", ""Home Organization Products For Home And Daily Use"", ""Top Rated Home Organization Products Worth Checking""]","[""JICOOT Hard Bristle Crevice Cleaning Brush is a strong home organization products pick at around Rs. 128. Check the exact product page for latest specs, reviews and offers."", ""Looking for home organization products? JICOOT Hard Bristle Crevice Cleaning Brush has useful everyday appeal and is worth comparing before you buy."", ""Save this home organization products idea for later. JICOOT Hard Bristle Crevice Cleaning Brush may fit home, work or gifting needs depending on today's Amazon price.""]",JICOOT Hard Bristle Crevice Cleaning Brush | Home Organization Products,"JICOOT Hard Bristle Crevice Cleaning Brush is today's daily trend for home organization products. Price: Rs. 128. Check the exact product page for specs, reviews and current offers. #homeorganizationproducts #amazonfinds #dailyfinds #budgetshopping",https://www.amazon.in/dp/B0CD2RKMHZ,Trending Home Finds,10001500,"JICOOT Hard Bristle Crevice Cleaning Brush - Cleaning Tools for Household Use, Multifunctional Gap Cleaning Supplies for Kitchen, Bathroom, Toilet, Window, Vehicle, Faucets, Grout, Home, Plastic available on Amazon",https://m.media-amazon.com/images/I/61INELI4GdL._AC_UL320_.jpg
B0FP2MV5N8,"UCRAVO Stylish Stackable Desk Organizer with 2 Drawers and 5 Compartments– Multi-Functional Desktop Storage Box with Pen Holder for Home, Office, School, Craft Supplies, and Art Stationery - Blue",198.0,INR,4.1,741,home organization products,Electronics & Gadgets,scrape,20260531115754.1,False,https://www.amazon.in/dp/B0FP2MV5N8,,https://www.amazon.in/dp/B0FP2MV5N8,https://www.amazon.in/dp/B0FP2MV5N8,https://www.amazon.in/s?k=home+organization+products,daily trend,home organization products,"UCRAVO Stylish Stackable Desk Organizer | Home Organization Products Price, Review And Deals","UCRAVO Stylish Stackable Desk Organizer is a daily trend for home organization products. Compare current price, rating, features and exact Amazon product link before you buy.",21,58.78,58.78,low,C,post,manual-link,0,heuristic,12:00-13:30,"[""Best Home Organization Products India"", ""UCRAVO Stylish Stackable Desk Organizer with 2 Drawers Review And Price"", ""Useful Amazon Find: UCRAVO Stylish Stackable Desk Organizer with 2 Drawers"", ""Home Organization Products For Home And Daily Use"", ""Top Rated Home Organization Products Worth Checking""]","[""UCRAVO Stylish Stackable Desk Organizer with 2 Drawers and 5 Compartment is a strong home organization products pick at around Rs. 198. Check the exact product page for latest specs, reviews and offers."", ""Looking for home organization products? UCRAVO Stylish Stackable Desk Organizer with 2 Drawers and 5 Compartment has useful everyday appeal and is worth comparing before you buy."", ""Save this home organization products idea for later. UCRAVO Stylish Stackable Desk Organizer with 2 Drawers and 5 Compartment may fit home, work or gifting needs depending on today's Amazon price.""]",UCRAVO Stylish Stackable Desk Organizer | Home Organization Products,"UCRAVO Stylish Stackable Desk Organizer is today's daily trend for home organization products. Price: Rs. 198. Check the exact product page for specs, reviews and current offers. #homeorganizationproducts #amazonfinds #dailyfinds #budgetshopping",https://www.amazon.in/dp/B0FP2MV5N8,Trending Home Finds,10001500,"UCRAVO Stylish Stackable Desk Organizer with 2 Drawers and 5 Compartments– Multi-Functional Desktop Storage Box with Pen Holder for Home, Office, School, Craft Supplies, and Art Stationery - Blue available on Amazon",https://m.media-amazon.com/images/I/71r9ps4DXWL._AC_UL320_.jpg
B0DNQTZPNN,Check each product page for other buying options. Price and other details may vary based on product size and colour,,INR,3.8,,home organization products,Electronics & Gadgets,scrape,20260531115754.1,False,https://www.amazon.in/dp/B0DNQTZPNN,,https://www.amazon.in/dp/B0DNQTZPNN,https://www.amazon.in/dp/B0DNQTZPNN,https://www.amazon.in/s?k=home+organization+products,daily trend,home organization products,"Check each product page | Home Organization Products Price, Review And Deals","Check each product page is a daily trend for home organization products. Compare current price, rating, features and exact Amazon product link before you buy.",21,40.05,40.05,medium,D,review,"missing-image, manual-link",0,heuristic,12:00-13:30,"[""Best Home Organization Products India"", ""Check each product page for other buying options. Pric Review And Price"", ""Useful Amazon Find: Check each product page for other buying options. Pric"", ""Home Organization Products For Home And Daily Use"", ""Top Rated Home Organization Products Worth Checking""]","[""Check each product page for other buying options. Price and other detail is a strong home organization products pick at with current Amazon pricing. Check the exact product page for latest specs, reviews and offers."", ""Looking for home organization products? Check each product page for other buying options. Price and other detail has useful everyday appeal and is worth comparing before you buy."", ""Save this home organization products idea for later. Check each product page for other buying options. Price and other detail may fit home, work or gifting needs depending on today's Amazon price.""]",Check each product page | Home Organization Products,"Check each product page is today's daily trend for home organization products. Price: check listing. Check the exact product page for specs, reviews and current offers. #homeorganizationproducts #amazonfinds #dailyfinds #budgetshopping",https://www.amazon.in/dp/B0DNQTZPNN,Trending Home Finds,10001500,Check each product page for other buying options. Price and other details may vary based on product size and colour available on Amazon,
B0DCZ3WDTB,"Xiaomi Power Bank 4i 20000mAh 33W Super Fast Charging PD |Smart 12 Layer Protection|Type C Input & Output|Triple Output Ports|Supports Android,Apple, Tablets, Earbuds,Watch(MI Powerbank),Black",1799.0,INR,4.2,10314,portable power bank best seller,Electronics & Gadgets,scrape,20260531115754.1,False,https://www.amazon.in/dp/B0DCZ3WDTB,,https://www.amazon.in/dp/B0DCZ3WDTB,https://www.amazon.in/dp/B0DCZ3WDTB,https://www.amazon.in/s?k=portable+power+bank+best+seller,best seller,portable power bank best seller,"Xiaomi Power Bank 4i 20000mAh 33W Super Fast Charging PD | Portable Power Bank Best Seller Price, Review And Deals","Xiaomi Power Bank 4i 20000mAh 33W Super Fast Charging PD is a best seller for portable power bank best seller. Compare current price, rating, features and exact Amazon product link before you buy.",26,84.7,84.7,medium,A,post,manual-link,0,heuristic,07:30-09:00,"[""Best Portable Power Bank Best Seller Under Rs 1800 India"", ""Xiaomi Power Bank 4i 20000mAh 33W Super Fast Charging Review And Price"", ""Useful Amazon Find: Xiaomi Power Bank 4i 20000mAh 33W Super Fast Charging"", ""Portable Power Bank Best Seller For Home And Daily Use"", ""Top Rated Portable Power Bank Best Seller Worth Checking""]","[""Xiaomi Power Bank 4i 20000mAh 33W Super Fast Charging PD is a strong portable power bank best seller pick at around Rs. 1,799. Check the exact product page for latest specs, reviews and offers."", ""Looking for portable power bank best seller? Xiaomi Power Bank 4i 20000mAh 33W Super Fast Charging PD has useful everyday appeal and is worth comparing before you buy."", ""Save this portable power bank best seller idea for later. Xiaomi Power Bank 4i 20000mAh 33W Super Fast Charging PD may fit home, work or gifting needs depending on today's Amazon price.""]",Xiaomi Power Bank 4i 20000mAh 33W Super Fast Charging PD | Portable Power Bank Best Seller,"Xiaomi Power Bank 4i 20000mAh 33W Super Fast Charging PD is today's best seller for portable power bank best seller. Price: Rs. 1,799. Check the exact product page for specs, reviews and current offers. #portablepowerbankbestseller #amazonfinds #dailyfinds #budgetshopping",https://www.amazon.in/dp/B0DCZ3WDTB,Viral Amazon Finds,10001500,"Xiaomi Power Bank 4i 20000mAh 33W Super Fast Charging PD |Smart 12 Layer Protection|Type C Input & Output|Triple Output Ports|Supports Android,Apple, Tablets, Earbuds,Watch(MI Powerbank),Black available on Amazon",https://m.media-amazon.com/images/I/41vBAaU8clL._AC_UY218_.jpg
B0D14BB5XY,"PHILIPS Air Fryer NA120/00, uses up to 90% less fat, 1500W, 4.2 Liter, with Rapid Air Technology (Black), Large",4844.0,INR,4.3,7372,air fryer best seller,Electronics & Gadgets,scrape,20260531115754.1,False,https://www.amazon.in/dp/B0D14BB5XY,,https://www.amazon.in/dp/B0D14BB5XY,https://www.amazon.in/dp/B0D14BB5XY,https://www.amazon.in/s?k=air+fryer+best+seller,best seller,air fryer best seller,"PHILIPS Air Fryer NA120/00, uses up to 90% less fat, 1500W, 4.2 | Air Fryer Best Seller Price, Review And Deals","PHILIPS Air Fryer NA120/00, uses up to 90% less fat, 1500W, 4.2 is a best seller for air fryer best seller. Compare current price, rating, features and exact Amazon product link before you buy.",8,72.08,72.08,medium,B,post,manual-link,0,heuristic,07:30-09:00,"[""Best Air Fryer Best Seller Under Rs 4900 India"", ""PHILIPS Air Fryer NA120/00, uses up to 90% less fat, 1 Review And Price"", ""Useful Amazon Find: PHILIPS Air Fryer NA120/00, uses up to 90% less fat, 1"", ""Air Fryer Best Seller For Home And Daily Use"", ""Top Rated Air Fryer Best Seller Worth Checking""]","[""PHILIPS Air Fryer NA120/00, uses up to 90% less fat, 1500W, 4.2 Liter, w is a strong air fryer best seller pick at around Rs. 4,844. Check the exact product page for latest specs, reviews and offers."", ""Looking for air fryer best seller? PHILIPS Air Fryer NA120/00, uses up to 90% less fat, 1500W, 4.2 Liter, w has useful everyday appeal and is worth comparing before you buy."", ""Save this air fryer best seller idea for later. PHILIPS Air Fryer NA120/00, uses up to 90% less fat, 1500W, 4.2 Liter, w may fit home, work or gifting needs depending on today's Amazon price.""]","PHILIPS Air Fryer NA120/00, uses up to 90% less fat, 1500W, 4.2 | Air Fryer Best Seller","PHILIPS Air Fryer NA120/00, uses up to 90% less fat, 1500W, 4.2 is today's best seller for air fryer best seller. Price: Rs. 4,844. Check the exact product page for specs, reviews and current offers. #airfryerbestseller #amazonfinds #dailyfinds #budgetshopping",https://www.amazon.in/dp/B0D14BB5XY,Trending Home Finds,10001500,"PHILIPS Air Fryer NA120/00, uses up to 90% less fat, 1500W, 4.2 Liter, with Rapid Air Technology (Black), Large available on Amazon",https://m.media-amazon.com/images/I/51CM1SXLDIL._AC_UY218_.jpg
B0DQ4NYQZQ,URBN Power Bank 20000mAh Fast Charging | 22.5W Super Fast Power Delivery (PD) Portable Charger | Triple Output | USB Type C Input & Output | Pass Through Charging | (Black),899.0,INR,4.0,1995,portable power bank best seller,Electronics & Gadgets,scrape,20260531115754.1,False,https://www.amazon.in/dp/B0DQ4NYQZQ,,https://www.amazon.in/dp/B0DQ4NYQZQ,https://www.amazon.in/dp/B0DQ4NYQZQ,https://www.amazon.in/s?k=portable+power+bank+best+seller,best seller,portable power bank best seller,"URBN Power Bank 20000mAh Fast Charging | Portable Power Bank Best Seller Price, Review And Deals","URBN Power Bank 20000mAh Fast Charging is a best seller for portable power bank best seller. Compare current price, rating, features and exact Amazon product link before you buy.",26,74.73,74.73,medium,B,post,manual-link,0,heuristic,07:30-09:00,"[""Best Portable Power Bank Best Seller Under Rs 900 India"", ""URBN Power Bank 20000mAh Fast Charging Review And Price"", ""Useful Amazon Find: URBN Power Bank 20000mAh Fast Charging"", ""Portable Power Bank Best Seller For Home And Daily Use"", ""Top Rated Portable Power Bank Best Seller Worth Checking""]","[""URBN Power Bank 20000mAh Fast Charging is a strong portable power bank best seller pick at around Rs. 899. Check the exact product page for latest specs, reviews and offers."", ""Looking for portable power bank best seller? URBN Power Bank 20000mAh Fast Charging has useful everyday appeal and is worth comparing before you buy."", ""Save this portable power bank best seller idea for later. URBN Power Bank 20000mAh Fast Charging may fit home, work or gifting needs depending on today's Amazon price.""]",URBN Power Bank 20000mAh Fast Charging | Portable Power Bank Best Seller,"URBN Power Bank 20000mAh Fast Charging is today's best seller for portable power bank best seller. Price: Rs. 899. Check the exact product page for specs, reviews and current offers. #portablepowerbankbestseller #amazonfinds #dailyfinds #budgetshopping",https://www.amazon.in/dp/B0DQ4NYQZQ,Viral Amazon Finds,10001500,URBN Power Bank 20000mAh Fast Charging | 22.5W Super Fast Power Delivery (PD) Portable Charger | Triple Output | USB Type C Input & Output | Pass Through Charging | (Black) available on Amazon,https://m.media-amazon.com/images/I/71TUiV0TyiL._AC_UY218_.jpg
B0B8XNPQPN,"Pigeon Healthifry Digital Air Fryer, 360° High Speed Air Circulation Technology 1200 W with Non-Stick 4.2 L Basket",2637.0,INR,3.7,11830,air fryer best seller,Electronics & Gadgets,scrape,20260531115754.1,False,https://www.amazon.in/dp/B0B8XNPQPN,,https://www.amazon.in/dp/B0B8XNPQPN,https://www.amazon.in/dp/B0B8XNPQPN,https://www.amazon.in/s?k=air+fryer+best+seller,best seller,air fryer best seller,"Pigeon Healthifry Digital Air Fryer, 360° High Speed Air Circula | Air Fryer Best Seller Price, Review And Deals","Pigeon Healthifry Digital Air Fryer, 360° High Speed Air Circula is a best seller for air fryer best seller. Compare current price, rating, features and exact Amazon product link before you buy.",8,72.55,72.55,medium,B,post,"low-rating, manual-link",0,heuristic,07:30-09:00,"[""Best Air Fryer Best Seller Under Rs 2700 India"", ""Pigeon Healthifry Digital Air Fryer, 360° High Speed A Review And Price"", ""Useful Amazon Find: Pigeon Healthifry Digital Air Fryer, 360° High Speed A"", ""Air Fryer Best Seller For Home And Daily Use"", ""Top Rated Air Fryer Best Seller Worth Checking""]","[""Pigeon Healthifry Digital Air Fryer, 360° High Speed Air Circulation Tec is a strong air fryer best seller pick at around Rs. 2,637. Check the exact product page for latest specs, reviews and offers."", ""Looking for air fryer best seller? Pigeon Healthifry Digital Air Fryer, 360° High Speed Air Circulation Tec has useful everyday appeal and is worth comparing before you buy."", ""Save this air fryer best seller idea for later. Pigeon Healthifry Digital Air Fryer, 360° High Speed Air Circulation Tec may fit home, work or gifting needs depending on today's Amazon price.""]","Pigeon Healthifry Digital Air Fryer, 360° High Speed Air Circula | Air Fryer Best Seller","Pigeon Healthifry Digital Air Fryer, 360° High Speed Air Circula is today's best seller for air fryer best seller. Price: Rs. 2,637. Check the exact product page for specs, reviews and current offers. #airfryerbestseller #amazonfinds #dailyfinds #budgetshopping",https://www.amazon.in/dp/B0B8XNPQPN,Trending Home Finds,10001500,"Pigeon Healthifry Digital Air Fryer, 360° High Speed Air Circulation Technology 1200 W with Non-Stick 4.2 L Basket available on Amazon",https://m.media-amazon.com/images/I/71NZiryyhbL._AC_UY218_.jpg
B0D96HMLYX,"Amazon Basics 20000 mAh Power Bank | 22.5W Fast Charging | Dual Output & Input | Charge 3 Devices Simultaneously | for Smartphones, TWS Earbuds, Speakers, Tablets (Dark Blue)",999.0,INR,3.9,1476,portable power bank best seller,Electronics & Gadgets,scrape,20260531115754.1,False,https://www.amazon.in/dp/B0D96HMLYX,,https://www.amazon.in/dp/B0D96HMLYX,https://www.amazon.in/dp/B0D96HMLYX,https://www.amazon.in/s?k=portable+power+bank+best+seller,best seller,portable power bank best seller,"Amazon Basics 20000 mAh Power Bank | Portable Power Bank Best Seller Price, Review And Deals","Amazon Basics 20000 mAh Power Bank is a best seller for portable power bank best seller. Compare current price, rating, features and exact Amazon product link before you buy.",26,74.15,74.15,high,B,post,manual-link,0,heuristic,07:30-09:00,"[""Best Portable Power Bank Best Seller Under Rs 1000 India"", ""Amazon Basics 20000 mAh Power Bank Review And Price"", ""Useful Amazon Find: Amazon Basics 20000 mAh Power Bank"", ""Portable Power Bank Best Seller For Home And Daily Use"", ""Top Rated Portable Power Bank Best Seller Worth Checking""]","[""Amazon Basics 20000 mAh Power Bank is a strong portable power bank best seller pick at around Rs. 999. Check the exact product page for latest specs, reviews and offers."", ""Looking for portable power bank best seller? Amazon Basics 20000 mAh Power Bank has useful everyday appeal and is worth comparing before you buy."", ""Save this portable power bank best seller idea for later. Amazon Basics 20000 mAh Power Bank may fit home, work or gifting needs depending on today's Amazon price.""]",Amazon Basics 20000 mAh Power Bank | Portable Power Bank Best Seller,"Amazon Basics 20000 mAh Power Bank is today's best seller for portable power bank best seller. Price: Rs. 999. Check the exact product page for specs, reviews and current offers. #portablepowerbankbestseller #amazonfinds #dailyfinds #budgetshopping",https://www.amazon.in/dp/B0D96HMLYX,Viral Amazon Finds,10001500,"Amazon Basics 20000 mAh Power Bank | 22.5W Fast Charging | Dual Output & Input | Charge 3 Devices Simultaneously | for Smartphones, TWS Earbuds, Speakers, Tablets (Dark Blue) available on Amazon",https://m.media-amazon.com/images/I/61FEiRJcFiL._AC_UY218_.jpg
B0F1TWKRF6,Rated 4.2 out of 5 stars from 36 reviews,,INR,4.2,,portable power bank best seller,Electronics & Gadgets,scrape,20260531115754.1,False,https://www.amazon.in/dp/B0F1TWKRF6,,https://www.amazon.in/dp/B0F1TWKRF6,https://www.amazon.in/dp/B0F1TWKRF6,https://www.amazon.in/s?k=portable+power+bank+best+seller,best seller,portable power bank best seller,"Rated 4.2 out of 5 stars from 36 reviews | Portable Power Bank Best Seller Price, Review And Deals","Rated 4.2 out of 5 stars from 36 reviews is a best seller for portable power bank best seller. Compare current price, rating, features and exact Amazon product link before you buy.",26,46.84,46.84,high,D,review,"missing-image, manual-link",0,heuristic,07:30-09:00,"[""Best Portable Power Bank Best Seller India"", ""Rated 4.2 out of 5 stars from 36 reviews Review And Price"", ""Useful Amazon Find: Rated 4.2 out of 5 stars from 36 reviews"", ""Portable Power Bank Best Seller For Home And Daily Use"", ""Top Rated Portable Power Bank Best Seller Worth Checking""]","[""Rated 4.2 out of 5 stars from 36 reviews is a strong portable power bank best seller pick at with current Amazon pricing. Check the exact product page for latest specs, reviews and offers."", ""Looking for portable power bank best seller? Rated 4.2 out of 5 stars from 36 reviews has useful everyday appeal and is worth comparing before you buy."", ""Save this portable power bank best seller idea for later. Rated 4.2 out of 5 stars from 36 reviews may fit home, work or gifting needs depending on today's Amazon price.""]",Rated 4.2 out of 5 stars from 36 reviews | Portable Power Bank Best Seller,"Rated 4.2 out of 5 stars from 36 reviews is today's best seller for portable power bank best seller. Price: check listing. Check the exact product page for specs, reviews and current offers. #portablepowerbankbestseller #amazonfinds #dailyfinds #budgetshopping",https://www.amazon.in/dp/B0F1TWKRF6,Viral Amazon Finds,10001500,Rated 4.2 out of 5 stars from 36 reviews available on Amazon,
