asin,title,price,currency,rating,reviews,keyword,category,source,fetched_at,has_affiliate,product_url,affiliate_link,manual_link,sitestripe_url,search_url,trend_label,seo_keyword,google_title,google_description,trend_score,product_score,ai_score,buyer_intent,quality_grade,recommendation,risk_flags,hf_signal,hf_signal_source,best_posting_window,seo_title_variants,caption_variants,pin_title,pin_description,pin_link,pin_board,pin_image_size,pin_alt_text,image_url
B0D14BB5XY,"PHILIPS Air Fryer NA120/00, uses up to 90% less fat, 1500W, 4.2 Liter, with Rapid Air Technology (Black), Large",4844.0,INR,4.3,7372,air fryer best seller,Electronics & Gadgets,scrape,20260530010422.83,False,https://www.amazon.in/dp/B0D14BB5XY,,https://www.amazon.in/dp/B0D14BB5XY,https://www.amazon.in/dp/B0D14BB5XY,https://www.amazon.in/s?k=air+fryer+best+seller,best seller,air fryer best seller,"PHILIPS Air Fryer NA120/00, uses up to 90% less fat, 1500W, 4.2 | Air Fryer Best Seller Price, Review And Deals","PHILIPS Air Fryer NA120/00, uses up to 90% less fat, 1500W, 4.2 is a best seller for air fryer best seller. Compare current price, rating, features and exact Amazon product link before you buy.",8,72.08,72.08,medium,B,post,manual-link,0,heuristic,07:30-09:00,"[""Best Air Fryer Best Seller Under Rs 4900 India"", ""PHILIPS Air Fryer NA120/00, uses up to 90% less fat, 1 Review And Price"", ""Useful Amazon Find: PHILIPS Air Fryer NA120/00, uses up to 90% less fat, 1"", ""Air Fryer Best Seller For Home And Daily Use"", ""Top Rated Air Fryer Best Seller Worth Checking""]","[""PHILIPS Air Fryer NA120/00, uses up to 90% less fat, 1500W, 4.2 Liter, w is a strong air fryer best seller pick at around Rs. 4,844. Check the exact product page for latest specs, reviews and offers."", ""Looking for air fryer best seller? PHILIPS Air Fryer NA120/00, uses up to 90% less fat, 1500W, 4.2 Liter, w has useful everyday appeal and is worth comparing before you buy."", ""Save this air fryer best seller idea for later. PHILIPS Air Fryer NA120/00, uses up to 90% less fat, 1500W, 4.2 Liter, w may fit home, work or gifting needs depending on today's Amazon price.""]","PHILIPS Air Fryer NA120/00, uses up to 90% less fat, 1500W, 4.2 | Air Fryer Best Seller","PHILIPS Air Fryer NA120/00, uses up to 90% less fat, 1500W, 4.2 is today's best seller for air fryer best seller. Price: Rs. 4,844. Check the exact product page for specs, reviews and current offers. #airfryerbestseller #amazonfinds #dailyfinds #budgetshopping",https://www.amazon.in/dp/B0D14BB5XY,Trending Home Finds,10001500,"PHILIPS Air Fryer NA120/00, uses up to 90% less fat, 1500W, 4.2 Liter, with Rapid Air Technology (Black), Large available on Amazon",https://m.media-amazon.com/images/I/51CM1SXLDIL._AC_UY218_.jpg
B0DQ4NYQZQ,URBN Power Bank 20000mAh Fast Charging | 22.5W Super Fast Power Delivery (PD) Portable Charger | Triple Output | USB Type C Input & Output | Pass Through Charging | (Black),899.0,INR,4.0,1995,portable power bank best seller,Electronics & Gadgets,scrape,20260530010422.83,False,https://www.amazon.in/dp/B0DQ4NYQZQ,,https://www.amazon.in/dp/B0DQ4NYQZQ,https://www.amazon.in/dp/B0DQ4NYQZQ,https://www.amazon.in/s?k=portable+power+bank+best+seller,best seller,portable power bank best seller,"URBN Power Bank 20000mAh Fast Charging | Portable Power Bank Best Seller Price, Review And Deals","URBN Power Bank 20000mAh Fast Charging is a best seller for portable power bank best seller. Compare current price, rating, features and exact Amazon product link before you buy.",26,74.73,74.73,medium,B,post,manual-link,0,heuristic,07:30-09:00,"[""Best Portable Power Bank Best Seller Under Rs 900 India"", ""URBN Power Bank 20000mAh Fast Charging Review And Price"", ""Useful Amazon Find: URBN Power Bank 20000mAh Fast Charging"", ""Portable Power Bank Best Seller For Home And Daily Use"", ""Top Rated Portable Power Bank Best Seller Worth Checking""]","[""URBN Power Bank 20000mAh Fast Charging is a strong portable power bank best seller pick at around Rs. 899. Check the exact product page for latest specs, reviews and offers."", ""Looking for portable power bank best seller? URBN Power Bank 20000mAh Fast Charging has useful everyday appeal and is worth comparing before you buy."", ""Save this portable power bank best seller idea for later. URBN Power Bank 20000mAh Fast Charging may fit home, work or gifting needs depending on today's Amazon price.""]",URBN Power Bank 20000mAh Fast Charging | Portable Power Bank Best Seller,"URBN Power Bank 20000mAh Fast Charging is today's best seller for portable power bank best seller. Price: Rs. 899. Check the exact product page for specs, reviews and current offers. #portablepowerbankbestseller #amazonfinds #dailyfinds #budgetshopping",https://www.amazon.in/dp/B0DQ4NYQZQ,Viral Amazon Finds,10001500,URBN Power Bank 20000mAh Fast Charging | 22.5W Super Fast Power Delivery (PD) Portable Charger | Triple Output | USB Type C Input & Output | Pass Through Charging | (Black) available on Amazon,https://m.media-amazon.com/images/I/71TUiV0TyiL._AC_UY218_.jpg
B0B8XNPQPN,"Pigeon Healthifry Digital Air Fryer, 360° High Speed Air Circulation Technology 1200 W with Non-Stick 4.2 L Basket",2637.0,INR,3.7,11830,air fryer best seller,Electronics & Gadgets,scrape,20260530010422.83,False,https://www.amazon.in/dp/B0B8XNPQPN,,https://www.amazon.in/dp/B0B8XNPQPN,https://www.amazon.in/dp/B0B8XNPQPN,https://www.amazon.in/s?k=air+fryer+best+seller,best seller,air fryer best seller,"Pigeon Healthifry Digital Air Fryer, 360° High Speed Air Circula | Air Fryer Best Seller Price, Review And Deals","Pigeon Healthifry Digital Air Fryer, 360° High Speed Air Circula is a best seller for air fryer best seller. Compare current price, rating, features and exact Amazon product link before you buy.",8,72.55,72.55,medium,B,post,"low-rating, manual-link",0,heuristic,07:30-09:00,"[""Best Air Fryer Best Seller Under Rs 2700 India"", ""Pigeon Healthifry Digital Air Fryer, 360° High Speed A Review And Price"", ""Useful Amazon Find: Pigeon Healthifry Digital Air Fryer, 360° High Speed A"", ""Air Fryer Best Seller For Home And Daily Use"", ""Top Rated Air Fryer Best Seller Worth Checking""]","[""Pigeon Healthifry Digital Air Fryer, 360° High Speed Air Circulation Tec is a strong air fryer best seller pick at around Rs. 2,637. Check the exact product page for latest specs, reviews and offers."", ""Looking for air fryer best seller? Pigeon Healthifry Digital Air Fryer, 360° High Speed Air Circulation Tec has useful everyday appeal and is worth comparing before you buy."", ""Save this air fryer best seller idea for later. Pigeon Healthifry Digital Air Fryer, 360° High Speed Air Circulation Tec may fit home, work or gifting needs depending on today's Amazon price.""]","Pigeon Healthifry Digital Air Fryer, 360° High Speed Air Circula | Air Fryer Best Seller","Pigeon Healthifry Digital Air Fryer, 360° High Speed Air Circula is today's best seller for air fryer best seller. Price: Rs. 2,637. Check the exact product page for specs, reviews and current offers. #airfryerbestseller #amazonfinds #dailyfinds #budgetshopping",https://www.amazon.in/dp/B0B8XNPQPN,Trending Home Finds,10001500,"Pigeon Healthifry Digital Air Fryer, 360° High Speed Air Circulation Technology 1200 W with Non-Stick 4.2 L Basket available on Amazon",https://m.media-amazon.com/images/I/71NZiryyhbL._AC_UY218_.jpg
B0D96HMLYX,"Amazon Basics 20000 mAh Power Bank | 22.5W Fast Charging | Dual Output & Input | Charge 3 Devices Simultaneously | for Smartphones, TWS Earbuds, Speakers, Tablets (Dark Blue)",999.0,INR,3.9,1476,portable power bank best seller,Electronics & Gadgets,scrape,20260530010422.83,False,https://www.amazon.in/dp/B0D96HMLYX,,https://www.amazon.in/dp/B0D96HMLYX,https://www.amazon.in/dp/B0D96HMLYX,https://www.amazon.in/s?k=portable+power+bank+best+seller,best seller,portable power bank best seller,"Amazon Basics 20000 mAh Power Bank | Portable Power Bank Best Seller Price, Review And Deals","Amazon Basics 20000 mAh Power Bank is a best seller for portable power bank best seller. Compare current price, rating, features and exact Amazon product link before you buy.",26,74.15,74.15,high,B,post,manual-link,0,heuristic,07:30-09:00,"[""Best Portable Power Bank Best Seller Under Rs 1000 India"", ""Amazon Basics 20000 mAh Power Bank Review And Price"", ""Useful Amazon Find: Amazon Basics 20000 mAh Power Bank"", ""Portable Power Bank Best Seller For Home And Daily Use"", ""Top Rated Portable Power Bank Best Seller Worth Checking""]","[""Amazon Basics 20000 mAh Power Bank is a strong portable power bank best seller pick at around Rs. 999. Check the exact product page for latest specs, reviews and offers."", ""Looking for portable power bank best seller? Amazon Basics 20000 mAh Power Bank has useful everyday appeal and is worth comparing before you buy."", ""Save this portable power bank best seller idea for later. Amazon Basics 20000 mAh Power Bank may fit home, work or gifting needs depending on today's Amazon price.""]",Amazon Basics 20000 mAh Power Bank | Portable Power Bank Best Seller,"Amazon Basics 20000 mAh Power Bank is today's best seller for portable power bank best seller. Price: Rs. 999. Check the exact product page for specs, reviews and current offers. #portablepowerbankbestseller #amazonfinds #dailyfinds #budgetshopping",https://www.amazon.in/dp/B0D96HMLYX,Viral Amazon Finds,10001500,"Amazon Basics 20000 mAh Power Bank | 22.5W Fast Charging | Dual Output & Input | Charge 3 Devices Simultaneously | for Smartphones, TWS Earbuds, Speakers, Tablets (Dark Blue) available on Amazon",https://m.media-amazon.com/images/I/61FEiRJcFiL._AC_UY218_.jpg
B0F1TWKRF6,Rated 4.2 out of 5 stars from 36 reviews,,INR,4.2,,portable power bank best seller,Electronics & Gadgets,scrape,20260530010422.83,False,https://www.amazon.in/dp/B0F1TWKRF6,,https://www.amazon.in/dp/B0F1TWKRF6,https://www.amazon.in/dp/B0F1TWKRF6,https://www.amazon.in/s?k=portable+power+bank+best+seller,best seller,portable power bank best seller,"Rated 4.2 out of 5 stars from 36 reviews | Portable Power Bank Best Seller Price, Review And Deals","Rated 4.2 out of 5 stars from 36 reviews is a best seller for portable power bank best seller. Compare current price, rating, features and exact Amazon product link before you buy.",26,46.84,46.84,high,D,review,"missing-image, manual-link",0,heuristic,07:30-09:00,"[""Best Portable Power Bank Best Seller India"", ""Rated 4.2 out of 5 stars from 36 reviews Review And Price"", ""Useful Amazon Find: Rated 4.2 out of 5 stars from 36 reviews"", ""Portable Power Bank Best Seller For Home And Daily Use"", ""Top Rated Portable Power Bank Best Seller Worth Checking""]","[""Rated 4.2 out of 5 stars from 36 reviews is a strong portable power bank best seller pick at with current Amazon pricing. Check the exact product page for latest specs, reviews and offers."", ""Looking for portable power bank best seller? Rated 4.2 out of 5 stars from 36 reviews has useful everyday appeal and is worth comparing before you buy."", ""Save this portable power bank best seller idea for later. Rated 4.2 out of 5 stars from 36 reviews may fit home, work or gifting needs depending on today's Amazon price.""]",Rated 4.2 out of 5 stars from 36 reviews | Portable Power Bank Best Seller,"Rated 4.2 out of 5 stars from 36 reviews is today's best seller for portable power bank best seller. Price: check listing. Check the exact product page for specs, reviews and current offers. #portablepowerbankbestseller #amazonfinds #dailyfinds #budgetshopping",https://www.amazon.in/dp/B0F1TWKRF6,Viral Amazon Finds,10001500,Rated 4.2 out of 5 stars from 36 reviews available on Amazon,
B0F2FKCWCJ,Rated 4.1 out of 5 stars from 103 reviews,,INR,4.1,,portable power bank best seller,Electronics & Gadgets,scrape,20260530010422.83,False,https://www.amazon.in/dp/B0F2FKCWCJ,,https://www.amazon.in/dp/B0F2FKCWCJ,https://www.amazon.in/dp/B0F2FKCWCJ,https://www.amazon.in/s?k=portable+power+bank+best+seller,best seller,portable power bank best seller,"Rated 4.1 out of 5 stars from 103 reviews | Portable Power Bank Best Seller Price, Review And Deals","Rated 4.1 out of 5 stars from 103 reviews is a best seller for portable power bank best seller. Compare current price, rating, features and exact Amazon product link before you buy.",26,46.39,46.39,high,D,review,"missing-image, manual-link",0,heuristic,07:30-09:00,"[""Best Portable Power Bank Best Seller India"", ""Rated 4.1 out of 5 stars from 103 reviews Review And Price"", ""Useful Amazon Find: Rated 4.1 out of 5 stars from 103 reviews"", ""Portable Power Bank Best Seller For Home And Daily Use"", ""Top Rated Portable Power Bank Best Seller Worth Checking""]","[""Rated 4.1 out of 5 stars from 103 reviews is a strong portable power bank best seller pick at with current Amazon pricing. Check the exact product page for latest specs, reviews and offers."", ""Looking for portable power bank best seller? Rated 4.1 out of 5 stars from 103 reviews has useful everyday appeal and is worth comparing before you buy."", ""Save this portable power bank best seller idea for later. Rated 4.1 out of 5 stars from 103 reviews may fit home, work or gifting needs depending on today's Amazon price.""]",Rated 4.1 out of 5 stars from 103 reviews | Portable Power Bank Best Seller,"Rated 4.1 out of 5 stars from 103 reviews is today's best seller for portable power bank best seller. Price: check listing. Check the exact product page for specs, reviews and current offers. #portablepowerbankbestseller #amazonfinds #dailyfinds #budgetshopping",https://www.amazon.in/dp/B0F2FKCWCJ,Viral Amazon Finds,10001500,Rated 4.1 out of 5 stars from 103 reviews available on Amazon,
B0GNM66RYF,"Hair Brush Dryer and Volumizer Hot Air Brush, 4-in-1 Ionic Blow Dryer Brush & Styler for Straightening, Curling, and Detangling, Professional Ceramic Tourmaline Hair Straightener Brush for All Hair Types for shine (B2)",499.0,INR,4.4,172,daily deals useful products,Electronics & Gadgets,scrape,20260530010422.83,False,https://www.amazon.in/dp/B0GNM66RYF,,https://www.amazon.in/dp/B0GNM66RYF,https://www.amazon.in/dp/B0GNM66RYF,https://www.amazon.in/s?k=daily+deals+useful+products,budget pick,daily deals useful products,"Hair Brush Dryer and Volumizer Hot Air Brush, 4-in-1 Ionic Blow | Daily Deals Useful Products Price, Review And Deals","Hair Brush Dryer and Volumizer Hot Air Brush, 4-in-1 Ionic Blow is a budget pick for daily deals useful products. Compare current price, rating, features and exact Amazon product link before you buy.",0,55.92,55.92,medium,C,post,manual-link,0,heuristic,22:00-23:00,"[""Best Daily Deals Useful Products Under Rs 500 India"", ""Hair Brush Dryer and Volumizer Hot Air Brush, 4-in-1 I Review And Price"", ""Useful Amazon Find: Hair Brush Dryer and Volumizer Hot Air Brush, 4-in-1 I"", ""Daily Deals Useful Products For Home And Daily Use"", ""Top Rated Daily Deals Useful Products Worth Checking""]","[""Hair Brush Dryer and Volumizer Hot Air Brush, 4-in-1 Ionic Blow Dryer Br is a strong daily deals useful products pick at around Rs. 499. Check the exact product page for latest specs, reviews and offers."", ""Looking for daily deals useful products? Hair Brush Dryer and Volumizer Hot Air Brush, 4-in-1 Ionic Blow Dryer Br has useful everyday appeal and is worth comparing before you buy."", ""Save this daily deals useful products idea for later. Hair Brush Dryer and Volumizer Hot Air Brush, 4-in-1 Ionic Blow Dryer Br may fit home, work or gifting needs depending on today's Amazon price.""]","Hair Brush Dryer and Volumizer Hot Air Brush, 4-in-1 Ionic Blow | Daily Deals Useful Products","Hair Brush Dryer and Volumizer Hot Air Brush, 4-in-1 Ionic Blow is today's budget pick for daily deals useful products. Price: Rs. 499. Check the exact product page for specs, reviews and current offers. #dailydealsusefulproducts #amazonfinds #dailyfinds #budgetshopping",https://www.amazon.in/dp/B0GNM66RYF,Viral Amazon Finds,10001500,"Hair Brush Dryer and Volumizer Hot Air Brush, 4-in-1 Ionic Blow Dryer Brush & Styler for Straightening, Curling, and Detangling, Professional Ceramic Tourmaline Hair Straightener Brush for All Hair Types for shine (B2) available on Amazon",https://m.media-amazon.com/images/I/61jhrw9HgRL._AC_UL320_.jpg
B0CXM5DT52,"SOFTSPUN Microfiber Cleaning Cloths, 12pcs 30x30cms 220 GSM Multi-Colour! Highly Absorbent Lint and Streak Free Multi -Purpose Wash Cloth for Kitchen Window Stainless Steel Silverware",262.0,INR,4.1,1932,daily deals useful products,Electronics & Gadgets,scrape,20260530010422.83,False,https://www.amazon.in/dp/B0CXM5DT52,,https://www.amazon.in/dp/B0CXM5DT52,https://www.amazon.in/dp/B0CXM5DT52,https://www.amazon.in/s?k=daily+deals+useful+products,budget pick,daily deals useful products,"SOFTSPUN Microfiber Cleaning Cloths, 12pcs 30x30cms 220 GSM Mult | Daily Deals Useful Products Price, Review And Deals","SOFTSPUN Microfiber Cleaning Cloths, 12pcs 30x30cms 220 GSM Mult is a budget pick for daily deals useful products. Compare current price, rating, features and exact Amazon product link before you buy.",0,54.08,54.08,medium,C,review,manual-link,0,heuristic,12:00-13:30,"[""Best Daily Deals Useful Products India"", ""SOFTSPUN Microfiber Cleaning Cloths, 12pcs 30x30cms 22 Review And Price"", ""Useful Amazon Find: SOFTSPUN Microfiber Cleaning Cloths, 12pcs 30x30cms 22"", ""Daily Deals Useful Products For Home And Daily Use"", ""Top Rated Daily Deals Useful Products Worth Checking""]","[""SOFTSPUN Microfiber Cleaning Cloths, 12pcs 30x30cms 220 GSM Multi-Colour is a strong daily deals useful products pick at around Rs. 262. Check the exact product page for latest specs, reviews and offers."", ""Looking for daily deals useful products? SOFTSPUN Microfiber Cleaning Cloths, 12pcs 30x30cms 220 GSM Multi-Colour has useful everyday appeal and is worth comparing before you buy."", ""Save this daily deals useful products idea for later. SOFTSPUN Microfiber Cleaning Cloths, 12pcs 30x30cms 220 GSM Multi-Colour may fit home, work or gifting needs depending on today's Amazon price.""]","SOFTSPUN Microfiber Cleaning Cloths, 12pcs 30x30cms 220 GSM Mult | Daily Deals Useful Products","SOFTSPUN Microfiber Cleaning Cloths, 12pcs 30x30cms 220 GSM Mult is today's budget pick for daily deals useful products. Price: Rs. 262. Check the exact product page for specs, reviews and current offers. #dailydealsusefulproducts #amazonfinds #dailyfinds #budgetshopping",https://www.amazon.in/dp/B0CXM5DT52,Viral Amazon Finds,10001500,"SOFTSPUN Microfiber Cleaning Cloths, 12pcs 30x30cms 220 GSM Multi-Colour! Highly Absorbent Lint and Streak Free Multi -Purpose Wash Cloth for Kitchen Window Stainless Steel Silverware available on Amazon",https://m.media-amazon.com/images/I/91tyVf3xovL._AC_UL320_.jpg
B0D9W76ZDV,"Philips Air Fryer Oven 7.2L with See Through Window, 16-in-1 Functions: Airfry, Bake, Grill, Ferment for Curd & Dehydrate for Fruits, Airfryer with Touch Control & Rapid Air Plus for 360˚ Even Cooking",14799.0,INR,4.6,,air fryer best seller,Electronics & Gadgets,scrape,20260530010422.83,False,https://www.amazon.in/dp/B0D9W76ZDV,,https://www.amazon.in/dp/B0D9W76ZDV,https://www.amazon.in/dp/B0D9W76ZDV,https://www.amazon.in/s?k=air+fryer+best+seller,best seller,air fryer best seller,"Philips Air Fryer Oven 7.2L | Air Fryer Best Seller Price, Review And Deals","Philips Air Fryer Oven 7.2L is a best seller for air fryer best seller. Compare current price, rating, features and exact Amazon product link before you buy.",8,40.66,40.66,medium,D,review,"missing-image, manual-link",0,heuristic,07:30-09:00,"[""Best Air Fryer Best Seller India"", ""Philips Air Fryer Oven 7.2L with See Through Window, 1 Review And Price"", ""Useful Amazon Find: Philips Air Fryer Oven 7.2L with See Through Window, 1"", ""Air Fryer Best Seller For Home And Daily Use"", ""Top Rated Air Fryer Best Seller Worth Checking""]","[""Philips Air Fryer Oven 7.2L with See Through Window, 16-in-1 Functions:  is a strong air fryer best seller pick at around Rs. 14,799. Check the exact product page for latest specs, reviews and offers."", ""Looking for air fryer best seller? Philips Air Fryer Oven 7.2L with See Through Window, 16-in-1 Functions:  has useful everyday appeal and is worth comparing before you buy."", ""Save this air fryer best seller idea for later. Philips Air Fryer Oven 7.2L with See Through Window, 16-in-1 Functions:  may fit home, work or gifting needs depending on today's Amazon price.""]",Philips Air Fryer Oven 7.2L | Air Fryer Best Seller,"Philips Air Fryer Oven 7.2L is today's best seller for air fryer best seller. Price: Rs. 14,799. Check the exact product page for specs, reviews and current offers. #airfryerbestseller #amazonfinds #dailyfinds #budgetshopping",https://www.amazon.in/dp/B0D9W76ZDV,Trending Home Finds,10001500,"Philips Air Fryer Oven 7.2L with See Through Window, 16-in-1 Functions: Airfry, Bake, Grill, Ferment for Curd & Dehydrate for Fruits, Airfryer with Touch Control & Rapid Air Plus for 360˚ Even Cooking available on Amazon",
B0DSVWCS5D,"NIVEA Soft Daily UV Light Moisturising Cream with SPF-15, 100ml",195.0,INR,4.2,354,daily deals useful products,Electronics & Gadgets,scrape,20260530010422.83,False,https://www.amazon.in/dp/B0DSVWCS5D,,https://www.amazon.in/dp/B0DSVWCS5D,https://www.amazon.in/dp/B0DSVWCS5D,https://www.amazon.in/s?k=daily+deals+useful+products,budget pick,daily deals useful products,"NIVEA Soft Daily UV Light Moisturising Cream | Daily Deals Useful Products Price, Review And Deals","NIVEA Soft Daily UV Light Moisturising Cream is a budget pick for daily deals useful products. Compare current price, rating, features and exact Amazon product link before you buy.",0,49.5,49.5,medium,D,review,manual-link,0,heuristic,22:00-23:00,"[""Best Daily Deals Useful Products India"", ""NIVEA Soft Daily UV Light Moisturising Cream with SPF Review And Price"", ""Useful Amazon Find: NIVEA Soft Daily UV Light Moisturising Cream with SPF"", ""Daily Deals Useful Products For Home And Daily Use"", ""Top Rated Daily Deals Useful Products Worth Checking""]","[""NIVEA Soft Daily UV Light Moisturising Cream with SPF-15, 100ml is a strong daily deals useful products pick at around Rs. 195. Check the exact product page for latest specs, reviews and offers."", ""Looking for daily deals useful products? NIVEA Soft Daily UV Light Moisturising Cream with SPF-15, 100ml has useful everyday appeal and is worth comparing before you buy."", ""Save this daily deals useful products idea for later. NIVEA Soft Daily UV Light Moisturising Cream with SPF-15, 100ml may fit home, work or gifting needs depending on today's Amazon price.""]",NIVEA Soft Daily UV Light Moisturising Cream | Daily Deals Useful Products,"NIVEA Soft Daily UV Light Moisturising Cream is today's budget pick for daily deals useful products. Price: Rs. 195. Check the exact product page for specs, reviews and current offers. #dailydealsusefulproducts #amazonfinds #dailyfinds #budgetshopping",https://www.amazon.in/dp/B0DSVWCS5D,Viral Amazon Finds,10001500,"NIVEA Soft Daily UV Light Moisturising Cream with SPF-15, 100ml available on Amazon",https://m.media-amazon.com/images/I/61N7ISBanuL._AC_UL320_.jpg
B09CTWFV5W,Check each product page for other buying options,5199.0,INR,4.3,,air fryer best seller,Electronics & Gadgets,scrape,20260530010422.83,False,https://www.amazon.in/dp/B09CTWFV5W,,https://www.amazon.in/dp/B09CTWFV5W,https://www.amazon.in/dp/B09CTWFV5W,https://www.amazon.in/s?k=air+fryer+best+seller,best seller,air fryer best seller,"Check each product page | Air Fryer Best Seller Price, Review And Deals","Check each product page is a best seller for air fryer best seller. Compare current price, rating, features and exact Amazon product link before you buy.",8,42.91,42.91,medium,D,review,"missing-image, manual-link",0,heuristic,07:30-09:00,"[""Best Air Fryer Best Seller Under Rs 5200 India"", ""Check each product page for other buying options Review And Price"", ""Useful Amazon Find: Check each product page for other buying options"", ""Air Fryer Best Seller For Home And Daily Use"", ""Top Rated Air Fryer Best Seller Worth Checking""]","[""Check each product page for other buying options is a strong air fryer best seller pick at around Rs. 5,199. Check the exact product page for latest specs, reviews and offers."", ""Looking for air fryer best seller? Check each product page for other buying options has useful everyday appeal and is worth comparing before you buy."", ""Save this air fryer best seller idea for later. Check each product page for other buying options may fit home, work or gifting needs depending on today's Amazon price.""]",Check each product page | Air Fryer Best Seller,"Check each product page is today's best seller for air fryer best seller. Price: Rs. 5,199. Check the exact product page for specs, reviews and current offers. #airfryerbestseller #amazonfinds #dailyfinds #budgetshopping",https://www.amazon.in/dp/B09CTWFV5W,Trending Home Finds,10001500,Check each product page for other buying options available on Amazon,
